avatar,fullname,id,images/0,images/1,images/2,images/3,isQuote,isRetweet,likes,links/0,links/1,links/2,links/3,links/4,links/5,links/6,links/7,links/8,links/9,links/10,links/11,links/12,links/13,links/14,links/15,links/16,quotedTweet/avatar,quotedTweet/fullname,quotedTweet/images/0,quotedTweet/images/1,quotedTweet/images/2,quotedTweet/links/0,quotedTweet/links/1,quotedTweet/links/2,quotedTweet/links/3,quotedTweet/links/4,quotedTweet/links/5,quotedTweet/links/6,quotedTweet/links/7,quotedTweet/links/8,quotedTweet/links/9,quotedTweet/links/10,quotedTweet/text,quotedTweet/timestamp,quotedTweet/url,quotedTweet/username,quotes,replies,retweets,searchQuery,text,timestamp,url,user/avatar,user/description,user/joinDate,user/location,user/totalFollowers,user/totalFollowing,user/totalLikes,user/totalTweets,user/url,user/userFullName,user/username,user/verified,user/website,username,verified
,,1467205782080872454,https://pbs.twimg.com/media/FFyP4eKVUAESYk0.jpg,,,,False,False,1,https://twitter.com/search?q=%23PierreJeanneret,https://twitter.com/search?q=%23architect,https://twitter.com/search?q=%23art,,,,,,,,,,,,,,,,,,,,,,,,,,,,,,,,,,,0,0,0,college,remembering pierre jeanneret death anniversary residence yearsnow museum chandigarh sector first chief architect chandigarh also first principal chandigarh college architecture pierrejeanneret architect art,2021-12-04T18:54:00.000Z,https://twitter.com/shardullahoti/status/1467205782080872454,https://pbs.twimg.com/profile_images/1665406738248646656/UtdGt6po.jpg,Architect | Photographer | Designer | Explorer | Aesthete,2017-06-05T16:34:00.000Z,"Pune, India",30,199,2144,210,https://twitter.com//shardullahoti,Shardul Lahoti,@shardullahoti,False,instagram.com/photo_sha.la,,False
,,1470272685942792197,,,,,False,False,0,https://twitter.com/i/broadcasts/1PlJQagZBEdJE,,,,,,,,,,,,,,,,,,,,,,,,,,,,,,,,,,,,,0,0,0,College,eggs kalsa college,2021-12-13T06:01:00.000Z,https://twitter.com/gagan47/status/1470272685942792197,https://pbs.twimg.com/profile_images/1489116391467008001/rfm3VN8M.jpg,"Research Scholar/Educator Motto- Be Strong when weak, brave when scared and humble when victorious!",2010-03-26T04:44:00.000Z,"Chandigarh, India",55,618,135,131,https://twitter.com//gagan47,Gagan Josan,@gagan47,False,,,False
,,1469641191977222147,,,,,False,False,0,https://twitter.com/KhushiT23806367,,,,,,,,,,,,,,,,,,,,,,,,,,,,,,,,,,,,,0,0,0,college,read news tractor crushing college girl solar district news reached news printed taking bribe accident occurred last week,2021-12-11T12:12:00.000Z,https://twitter.com/KamalJeetVerma_/status/1469641191977222147,https://pbs.twimg.com/profile_images/865855192587051008/LHB66O1m.jpg,"Ex- #Vipsian  #GGSIPU #Law #Delhi
Himachal Born #Solan
Classy Person. - ""Think like a Thinker""    --©",2011-08-08T14:33:00.000Z,"New Delhi, India",39,250,161,297,https://twitter.com//KamalJeetVerma_,Kamal Jeet Verma,@KamalJeetVerma_,False,facebook.com/Thakur.Kamal.Je…,,False
,,1466742159323787265,https://pbs.twimg.com/media/FFrqOGBVUAAgs2B.jpg,,,,False,False,5,https://twitter.com/search?q=%23ImportantNotice,,,,,,,,,,,,,,,,,,,,,,,,,,,,,,,,,,,,,0,1,0,college,importantnotice alliance franchise delhi library shall remain closed visitors ith december 2021 saturday per recent delhi governments directives regards schools colleges libraries closed immediate effect,2021-12-03T12:12:00.000Z,https://twitter.com/alliancefrdelhi/status/1466742159323787265,https://pbs.twimg.com/profile_images/1183589136667529216/ib2JJocv.jpg,An Indo-French cultural centre which specializes in French language teaching & curating cultural events.,2012-02-22T08:59:00.000Z,New Delhi,2526,140,3793,1904,https://twitter.com//alliancefrdelhi,Alliance française de Delhi,@alliancefrdelhi,False,delhi.afindia.org/,,False
,,1465602182225358848,https://pbs.twimg.com/media/FFbdZhiVkAQuIw0.jpg,https://pbs.twimg.com/media/FFbdaHZVcAI1Vvy.jpg,,,False,False,7,https://twitter.com/search?q=%23abvpmembershipdrive2021,https://twitter.com/AbvpChandigarh,https://twitter.com/abvp4pu,https://twitter.com/ABVPPunjab,https://twitter.com/ABVPVoice,,,,,,,,,,,,,,,,,,,,,,,,,,,,,,,,,0,0,2,college,abvpmembershipdrive2021 eggs girls college sector,2021-11-30T08:42:00.000Z,https://twitter.com/sandeepazadhr/status/1465602182225358848,https://pbs.twimg.com/profile_images/1594703705915686912/4xxSUrtP.jpg,"Gen. Secretary @ipprsdind।
Research Scholar।Columnist। Entrepreneur। Social & Political Activist @BJP4Haryana। Ex. Organizing Secretary @ABVPChandigarh।",2014-08-06T10:18:00.000Z,"Barwala, Hisar",809,553,4503,3746,https://twitter.com//sandeepazadhr,संदीप आजाद/Sandeep Azad🇮🇳,@sandeepazadhr,False,,,False
,,1470857542599274500,https://pbs.twimg.com/media/FGmJHRYVcAM3-DB.jpg,https://pbs.twimg.com/media/FGmJHxOVQAAiH6B.jpg,,,False,False,1,https://twitter.com/search?q=%23hpu,https://twitter.com/search?q=%23winning,https://twitter.com/search?q=%232021ChampionForhpu,,,,,,,,,,,,,,,,,,,,,,,,,,,,,,,,,,,0,0,0,College,inter college football tournament new champions sundernagar defeated nathan junior kamal singh handicar scored goals team junior congratulations winning 2021championforhpu,2021-12-14T20:45:00.000Z,https://twitter.com/Gaurinho10/status/1470857542599274500,https://pbs.twimg.com/profile_images/1525958875270172672/nbIPHxPB.jpg,I'm at the peak of the Himalayas and I'll always want to remain on top 🔝 pin.it/53HK1Br👈,2021-09-02T17:03:00.000Z,भारत 🇮🇳❤️,3,20,154,316,https://twitter.com//Gaurinho10,Gourinho singh pandiyar,@Gaurinho10,False,,,False
,,1475003544918921216,,,,,False,False,0,,,,,,,,,,,,,,,,,,,,,,,,,,,,,,,,,,,,,,0,0,0,Masters,never last years seen politico huge mental imbalance still pedis playing masters voice effect huge dirty swiss banks money,2021-12-26T07:20:00.000Z,https://twitter.com/GjptaK/status/1475003544918921216,https://abs.twimg.com/sticky/default_profile_images/default_profile.png,"Taught physics at degree level n now mentoring children at school level. Studied 8th class at govt school Doda 1960, 10th at SA high school Bhadarwah 1962,",2013-09-09T11:02:00.000Z,,459,868,73211,154727,https://twitter.com//GjptaK,R K Gupta,@GjptaK,False,,,False
,,1465746978596216837,,,,,False,False,1,https://twitter.com/search?q=%23sdcollege,https://twitter.com/search?q=%23silvermedal,https://twitter.com/search?q=%23intercollegecompetition,https://twitter.com/search?q=%23chesschampionship,https://twitter.com/search?q=%23punjabuniversity,https://www.instagram.com/p/CW6Oah-BPZU/?utm_medium=twitter,,,,,,,,,,,,,,,,,,,,,,,,,,,,,,,,0,0,0,college,inter college chess championship college silvermedal intercollegecompetition chesschampionship punjabuniversity college chandigarh,2021-11-30T18:18:00.000Z,https://twitter.com/Pooja_Arya08/status/1465746978596216837,https://pbs.twimg.com/profile_images/1347769382429069313/0eBiLBhD.jpg,"Daughter Of GoD👑
🙏Worshipper⛪
Ggdsd college🏫
Netplus Broadband Services 💼
Chess🥰
8 feb🎂",2017-05-20T08:39:00.000Z,"Chandigarh, India",87,119,436,168,https://twitter.com//Pooja_Arya08,Pooja Arya,@Pooja_Arya08,False,,,False
,,1401493976490803201,https://pbs.twimg.com/media/E3MbVsbVcAAM6le.jpg,,,,False,False,0,,,,,,,,,,,,,,,,,,,,,,,,,,,,,,,,,,,,,,0,0,0,Masters,find something woods books trees stones teach never learn masters,2021-06-06T10:59:00.000Z,https://twitter.com/the_sidhulife/status/1401493976490803201,https://pbs.twimg.com/profile_images/1295579296774230017/NCq5T8AZ.jpg,"TRAVEL VLOGGER | OVERLANDER | EX-STUNTER “An adventure is only an inconvenience rightly considered.” - @expeditify📍 Chandigarh, India 🇮🇳",2020-08-18T04:32:00.000Z,"Chandigarh 160019, Chandigarh",8,13,68,36,https://twitter.com//the_sidhulife,ADV TOUR GUIDE | AMAN SIDHU,@the_sidhulife,False,piped.video/c/RideInFame,,False
,,1463354040037740545,https://pbs.twimg.com/media/FE7fXQmUcAEoYWx.jpg,https://pbs.twimg.com/media/FE7fXVYVUAI2p2e.jpg,https://pbs.twimg.com/media/FE7fXaiVQAM36mS.jpg,https://pbs.twimg.com/media/FE7fXfQVIAwqhuz.jpg,False,False,77,https://twitter.com/PlakshaUniv,https://twitter.com/hitobs,https://twitter.com/drriteshmalik,https://twitter.com/DineshAgarwal,,,,,,,,,,,,,,,,,,,,,,,,,,,,,,,,,,2,1,3,college,enjoyed session entrepreneurship inaugural batch next generation highly evolved species fearless highly aware socially conscious birth college entrepreneurship india India,2021-11-24T03:49:00.000Z,https://twitter.com/rajeshsawhney/status/1463354040037740545,https://pbs.twimg.com/profile_images/950418146334162944/4KGcx8nx.jpg,"Founder, Investor, Board Member",2009-07-16T06:56:00.000Z,"Nako, India",59115,1255,64222,40079,https://twitter.com//rajeshsawhney,Rajesh Sawhney 🇮🇳,@rajeshsawhney,True,gsfindia.com,,True
,,1408239243760177152,https://pbs.twimg.com/media/E4sSIN7UUAQkQnB.jpg,,,,False,False,53,https://twitter.com/search?q=%23FridayFitness,https://twitter.com/Gurmeetramrahim,,,,,,,,,,,,,,,,,,,,,,,,,,,,,,,,,,,,0,1,92,Masters,boost immunity meditation wid pranayam guided recommended experts and spiritual masterspranayam and meditation best way stay healthy physically well mentally everyone follow fridayfitness tips saint,2021-06-25T01:42:00.000Z,https://twitter.com/sunita675/status/1408239243760177152,https://pbs.twimg.com/profile_images/1358631608727851008/mox1ECSz.jpg,My New I'd,2020-05-17T16:34:00.000Z,,1620,102,56122,67313,https://twitter.com//sunita675,Sunita 🌹Dr MSG ji ki Beti 🌹,@sunita675,False,,,False
,,1448138177047265291,,,,,False,False,2,,,,,,,,,,,,,,,,,,,,,,,,,,,,,,,,,,,,,,0,0,0,Masters,owes position masters true watch dogs,2021-10-13T04:07:00.000Z,https://twitter.com/Sandykanwar/status/1448138177047265291,https://pbs.twimg.com/profile_images/1531270431369723904/1puo1KdI.jpg,,2010-03-13T11:52:00.000Z,India,363,734,14054,12298,https://twitter.com//Sandykanwar,Sandeep Kanwar 🇮🇳,@Sandykanwar,False,,,False
,,1400335141189214210,,,,,True,False,0,,,,,,,,,,,,,,,,,,,TIMES NOW,,,,https://twitter.com/search?q=%23NewsAlert,https://twitter.com/capt_amarinder,,,,,,,,,,#NewsAlert | Congress High Command summons @Capt_Amarinder to Delhi. Punjab CM is on his way to Delhi.,2021-06-03T06:06:00.000Z,https://twitter.com/TimesNow/status/1400332958137872389,@TimesNow,0,0,0,Masters,shame masters delhi whistle goes resigned,2021-06-03T06:14:00.000Z,https://twitter.com/as_kapoor/status/1400335141189214210,https://pbs.twimg.com/profile_images/431666877094326272/REV8cWs2.jpeg,"Retired from Govt Service. 
Active Citizen of India.🇮🇳",2012-12-11T05:16:00.000Z,Mohali.,2171,155,49021,79065,https://twitter.com//as_kapoor,Avinder Singh Kapoor,@as_kapoor,False,,,True
https://pbs.twimg.com/profile_images/1726637620904742912/Dy6hAcIL.jpg,bushra ahuja,1336897917748039680,,,,,False,False,1,,,,,,,,,,,,,,,,,,,,,,,,,,,,,,,,,,,,,,0,1,0,Masters,yada vafadar kan hes loyal outta dani armband masters masters voice seen gramophone dont think belong generation,2020-12-10T04:57:00.000Z,https://twitter.com/bushraahuja/status/1336897917748039680,https://pbs.twimg.com/profile_images/1726637620904742912/Dy6hAcIL.jpg,"An Indian to the Core; Teacher,Teacher Educator Educational Administrator",2010-02-05T06:25:00.000Z,"Himachal Pradesh, India",510,72,22348,36217,https://twitter.com//bushraahuja,bushra ahuja,@bushraahuja,False,,@bushraahuja,False
https://pbs.twimg.com/profile_images/1695092915750744064/HM0SSJ_f.jpg,Col J Sharotri(Veteran) 🇮🇳,1324009165241528321,,,,,False,False,6,https://twitter.com/search?q=%23NarendraModi,https://twitter.com/search?q=%23AmitShah,,,,,,,,,,,,,,,,,,,,,,,,,,,,,,,,,,,,0,1,2,Masters,india democracy compulsory exercise right vote give present conduct mah govt mumbai acting like stooge pol masters like responsible ips union govt lead sari narendramodi sari amitshah,2020-11-04T15:22:00.000Z,https://twitter.com/colonelsharotri/status/1324009165241528321,https://pbs.twimg.com/profile_images/1695092915750744064/HM0SSJ_f.jpg,Bharat ka poorav Sainik .,2011-04-03T12:48:00.000Z,BHARAT (Devbhumi),4977,1713,13399,78337,https://twitter.com//colonelsharotri,Col J Sharotri(Veteran) 🇮🇳,@colonelsharotri,False,,@colonelsharotri,False
https://pbs.twimg.com/profile_images/1695092915750744064/HM0SSJ_f.jpg,Col J Sharotri(Veteran) 🇮🇳,1322561294432493568,,,,,False,False,2,,,,,,,,,,,,,,,,,,,,,,,,,,,,,,,,,,,,,,0,0,0,Masters,sir say the need day days very tomdik harry being self styled analyst coming child creat narrative pol masters ask creat sad wonder kind gain young children given,2020-10-31T15:29:00.000Z,https://twitter.com/colonelsharotri/status/1322561294432493568,https://pbs.twimg.com/profile_images/1695092915750744064/HM0SSJ_f.jpg,Bharat ka poorav Sainik .,2011-04-03T12:48:00.000Z,BHARAT (Devbhumi),4977,1713,13399,78337,https://twitter.com//colonelsharotri,Col J Sharotri(Veteran) 🇮🇳,@colonelsharotri,False,,@colonelsharotri,False
https://pbs.twimg.com/profile_images/1695092915750744064/HM0SSJ_f.jpg,Col J Sharotri(Veteran) 🇮🇳,1321842621573050368,,,,,False,False,2,https://twitter.com/search?q=%23republic,,,,,,,,,,,,,,,,,,,,,,,,,,,,,,,,,,,,,0,1,0,Masters,mark words union govt have neither political courage act angst paramour protect republic angst the rouge policeman candor pol masters talked the bop tied hav there party form govt shame bop voters,2020-10-29T15:53:00.000Z,https://twitter.com/colonelsharotri/status/1321842621573050368,https://pbs.twimg.com/profile_images/1695092915750744064/HM0SSJ_f.jpg,Bharat ka poorav Sainik .,2011-04-03T12:48:00.000Z,BHARAT (Devbhumi),4977,1713,13399,78337,https://twitter.com//colonelsharotri,Col J Sharotri(Veteran) 🇮🇳,@colonelsharotri,False,,@colonelsharotri,False
https://pbs.twimg.com/profile_images/431666877094326272/REV8cWs2.jpeg,Avinder Singh Kapoor,1307185501296709633,,,,,False,False,0,,,,,,,,,,,,,,,,,,,,,,,,,,,,,,,,,,,,,,0,0,0,Masters,easy write hindi words english graduate masters,2020-09-19T05:11:00.000Z,https://twitter.com/as_kapoor/status/1307185501296709633,https://pbs.twimg.com/profile_images/431666877094326272/REV8cWs2.jpeg,"Retired from Govt Service. 
Active Citizen of India.🇮🇳",2012-12-11T05:16:00.000Z,Mohali.,2171,155,49021,79065,https://twitter.com//as_kapoor,Avinder Singh Kapoor,@as_kapoor,False,,@as_kapoor,False
,,1406661823969988608,https://pbs.twimg.com/media/E4V3drNVgAURfKv.jpg,,,,False,False,2,,,,,,,,,,,,,,,,,,,,,,,,,,,,,,,,,,,,,,0,0,0,Masters,lot difference education learned masters learned situation,2021-06-20T17:14:00.000Z,https://twitter.com/sauren_suraj/status/1406661823969988608,https://pbs.twimg.com/profile_images/1627972667407208448/_OYmPJwP.jpg,MIS Executive at pernod ricard india pvt. ltd,2021-06-20T16:36:00.000Z,"Kanpur, BHARAT",45,123,50,18,https://twitter.com//sauren_suraj,suraj sauren,@sauren_suraj,False,saurenguide.blogspot.com,,False
,,1392039002169954308,,,,,False,False,1,,,,,,,,,,,,,,,,,,,,,,,,,,,,,,,,,,,,,,0,0,0,Masters,mere puppet fun masters behind bars proved another sacrificial lamb,2021-05-11T08:48:00.000Z,https://twitter.com/RaajeevSood/status/1392039002169954308,https://pbs.twimg.com/profile_images/1699106831203983361/3H-uxIBt.jpg,,2015-05-20T14:15:00.000Z,,189,208,30644,11971,https://twitter.com//RaajeevSood,raajeev 🇮🇳जो जीता वो चंद्रगुप्त not सिकंदर,@RaajeevSood,False,,,False
,,1338518365019590661,,,,,False,False,4,https://twitter.com/search?q=%23CopsFaceProbe,,,,,,,,,,,,,,,,,,,,,,,,,,,,,,,,,,,,,0,0,1,Masters,copsfaceprobe punishment erring cops political masters shut exemplary deter misadventures maharashtar anywhere country,2020-12-14T16:17:00.000Z,https://twitter.com/anilkum37576541/status/1338518365019590661,https://pbs.twimg.com/profile_images/546999484647878656/MKSSemNl.jpeg,,2012-11-10T07:19:00.000Z,"Chandigarh, India",1585,1705,83786,19874,https://twitter.com//anilkum37576541,anil kumar sharma,@anilkum37576541,False,,,False
,,1372418812323061760,,,,,True,False,0,,,,,,,,,,,,,,,,,,,Harish Puri 🇮🇳,,,,,,,,,,,,,,,"I retired as a Colonel in the Army, and could just about afford a Honda City.. Here’s an Assistant Police Inspector of the Mumbai Police driving a Mercedes.. and carrying a cash counting machine in it (who wants to lick their fingers to count bundles of cash..?) Seriously..??",2021-03-18T04:24:00.000Z,https://twitter.com/harishbpuri/status/1372403525758509059,@harishbpuri,0,0,0,Masters,sir correct compare esteemed self corrupt policemen shiv send extortion mission rich first make enough selves give target set political masters,2021-03-18T05:25:00.000Z,https://twitter.com/as_kapoor/status/1372418812323061760,https://pbs.twimg.com/profile_images/431666877094326272/REV8cWs2.jpeg,"Retired from Govt Service. 
Active Citizen of India.🇮🇳",2012-12-11T05:16:00.000Z,Mohali.,2171,155,49021,79065,https://twitter.com//as_kapoor,Avinder Singh Kapoor,@as_kapoor,False,,,False
,,1392036358059749377,,,,,False,False,2,,,,,,,,,,,,,,,,,,,,,,,,,,,,,,,,,,,,,,0,0,0,Masters,could fake gandhi criticize china chinese masters stop funding ref,2021-05-11T08:38:00.000Z,https://twitter.com/RaajeevSood/status/1392036358059749377,https://pbs.twimg.com/profile_images/1699106831203983361/3H-uxIBt.jpg,,2015-05-20T14:15:00.000Z,,189,208,30644,11971,https://twitter.com//RaajeevSood,raajeev 🇮🇳जो जीता वो चंद्रगुप्त not सिकंदर,@RaajeevSood,False,,,False
,,1368427089490112513,,,,,False,False,1,,,,,,,,,,,,,,,,,,,,,,,,,,,,,,,,,,,,,,0,0,0,phd,pod,2021-03-07T05:03:00.000Z,https://twitter.com/rameshgothwal7/status/1368427089490112513,https://pbs.twimg.com/profile_images/1573561285605994496/ZMwP9zlg.jpg,Ambedkarite,2020-06-01T08:26:00.000Z,"Chandigarh, India",690,1204,44676,3755,https://twitter.com//rameshgothwal7,Ramesh Gothwal 100%FB,@rameshgothwal7,False,,,False
,,1400105768238551044,https://pbs.twimg.com/media/E24sww3UcAQ-KVB.jpg,,,,False,False,1,,,,,,,,,,,,,,,,,,,,,,,,,,,,,,,,,,,,,,0,0,0,phd,great initiative pod chambers propagate importance startups great time sharing thoughts panelists,2021-06-02T15:03:00.000Z,https://twitter.com/GeetaGulati/status/1400105768238551044,https://pbs.twimg.com/profile_images/426812710789980160/d9uxMcJn.jpeg,Practising Lawyer (Corporate & Commercial Laws),2009-01-01T11:07:00.000Z,Chandigarh,202,1049,2712,1126,https://twitter.com//GeetaGulati,Geeta Gulati,@GeetaGulati,False,,,False
,,1422923177622085633,,,,,True,False,0,,,,,,,,,,,,,,,,,,,Arfa Khanum Sherwani,,,,,,,,,,,,,,,"9 year old Dalit girl allegedly gang-raped, murdered and forcibly cremated at Delhi Cantt crematorium. 
The accused is said to be an upper caste Pujari. 
The sheer absence of outrage on my timeline gives away the story. 
Now tell me again we aren’t a Casteist society ?",2021-08-04T08:22:00.000Z,https://twitter.com/khanumarfa/status/1422835343330402307,@khanumarfa,0,0,0,phd,pod bakchodi,2021-08-04T14:11:00.000Z,https://twitter.com/UmangSh34730640/status/1422923177622085633,https://pbs.twimg.com/profile_images/1665617098452901888/tPV8pVtu.jpg,,2019-02-09T06:37:00.000Z,,3836,3939,382229,14903,https://twitter.com//UmangSh34730640,Umang Sharma🇮🇳,@UmangSh34730640,False,,,True
,,1382202320507736065,https://pbs.twimg.com/media/Ey6Rr2sVEAAKMaa.jpg,,,,False,False,4,https://twitter.com/search?q=%23biomarkers,https://twitter.com/search?q=%23gcms,https://twitter.com/organicgeochem,https://twitter.com/paleoclimatesoc,https://twitter.com/IPA_ECN,https://twitter.com/theAGU,https://twitter.com/geochemsoc,,,,,,,,,,,,,,,,,,,,,,,,,,,,,,,0,0,0,phd,pod instruments friends lucky supervisor always trusted handling instrumentation facility lab biomarkers gems,2021-04-14T05:21:00.000Z,https://twitter.com/indian_scholar/status/1382202320507736065,https://pbs.twimg.com/profile_images/1694107512285302785/16zg2YSl.jpg,"Beamter, Akademischer Rat  @uniGoettingen, BS-MS+PhD @iisermohali, INSPIRE fellow @IndiaDST, IIT-JEE 2012 🇮🇳🇮🇱🇩🇪",2020-05-03T06:28:00.000Z,"Göttingen, Germany",998,490,9506,1252,https://twitter.com//indian_scholar,"Ankit Yadav (अंकित यादव), PhD 🇮🇳 🌏",@indian_scholar,False,uni-goettingen.de/de/668239.…,,False
,,1364204988029755392,,,,,False,False,1,https://twitter.com/nrendrabhaimodi,,,,,,,,,,,,,,,,,,,,,,,,,,,,,,,,,,,,,0,0,0,phd,acquiring mdsbds engrmscphddegreesyouths left option accept rs700010000 put agent bop days curse shame,2021-02-23T13:26:00.000Z,https://twitter.com/rajinder0280/status/1364204988029755392,https://abs.twimg.com/sticky/default_profile_images/default_profile.png,"critical analysis,justice for all &deliberately deficiencies by govt.",2017-11-19T12:19:00.000Z,",sector-21,India",0,26,256,2075,https://twitter.com//rajinder0280,rajinder pal sharma0280,@rajinder0280,False,,,False
,,1173504344194523136,,,,,False,False,1,https://www.instagram.com/p/B2dt2P0jkOW/?igshid=1aikeh1kly67q,,,,,,,,,,,,,,,,,,,,,,,,,,,,,,,,,,,,,0,0,0,phd,looking young lady pod becoming scientist couple years many kidding thought would like people profession bloody serious,2019-09-16T07:50:00.000Z,https://twitter.com/GursewakJassal/status/1173504344194523136,https://pbs.twimg.com/profile_images/1521840435336912896/s09O-20u.jpg,Entrepreneur 💲💸💰 life coach 🏝️⏳🎯 Global Business Owner 🌍🌎🌏,2012-08-26T18:42:00.000Z,"chandigarh,india",174,44,101,1130,https://twitter.com//GursewakJassal,gursewak jaisal,@GursewakJassal,False,gursewakjassal.wordpress.com…,,False
,,1267363745572851712,https://pbs.twimg.com/media/EZaUmL8UYAAzx7I.jpg,,,,False,False,4,https://twitter.com/search?q=%23nanoscience,https://twitter.com/search?q=%23osteoarthritis,https://thetoxicminds.wordpress.com/2020/05/27/beyond-lab-bench-a-phd-traveler-himadri-shekhar-roy-%f0%9f%8c%8f/,https://twitter.com/search?q=%23beyondlabbench,https://twitter.com/search?q=%23blog,https://twitter.com/search?q=%23blogger,,,,,,,,,,,,,,,,,,,,,,,,,,,,,,,,0,0,0,phd,talked nanoscience pod researcher institute nano science technology ist moral research looks understanding cartilaginous regeneration therapeutic approach osteoarthritis read beyondlabbench blog blogger,2020-06-01T07:53:00.000Z,https://twitter.com/ankitarathore02/status/1267363745572851712,https://pbs.twimg.com/profile_images/1554054386594115585/8J8ZJTMy.jpg,Dog lover and running person | Program Manager #scicomm @IndiaBioscience | PhD in S&T Communication @CSIR_NIScPR  | ☕📚🐕🌿 in my free time. Views personal.,2018-03-09T07:02:00.000Z,"Bengaluru, India",748,495,9841,1074,https://twitter.com//ankitarathore02,Ankita Rathore,@ankitarathore02,False,ankitarathore.in/,,False
,,1268989352094232576,,,,,False,False,0,,,,,,,,,,,,,,,,,,,,,,,,,,,,,,,,,,,,,,0,0,0,phd,many technical terms feels like reading pod thesis written impress professor sorry,2020-06-05T19:33:00.000Z,https://twitter.com/TCC82828796/status/1268989352094232576,https://pbs.twimg.com/profile_images/1256529630430822400/CKRv11L9.jpg,"career Guide, career help, plan, prepare career tips for students of class 8 onwards. Indian & Intl admission scientific tools, tests. thecareercurve.com",2020-05-02T10:22:00.000Z,"Chandigarh, India",185,654,848,799,https://twitter.com//TCC82828796,TCC Career Counselor,@TCC82828796,False,thecareercurve.com,,False
,,1168582257004752897,,,,,False,False,0,https://twitter.com/BU_Tweets,,,,,,,,,,,,,,,,,,,,,,,,,,,,,,,,,,,,,0,0,0,phd,join pod boston,2019-09-02T17:51:00.000Z,https://twitter.com/thakurnikhil07/status/1168582257004752897,https://pbs.twimg.com/profile_images/1675565598242381824/8SYFJItL.jpg,"Himachal Pradesh ❤️
Prisoner of my own dreams #
Anthropologist #
Blogger#
PhD Scholar",2016-02-21T07:16:00.000Z,"Kangra, India",300,2136,25862,12495,https://twitter.com//thakurnikhil07,Nikhil Thakur,@thakurnikhil07,False,nikhilthakur.in,,False
https://pbs.twimg.com/profile_images/1656932532196368384/TJseV7-f.jpg,Sumeet Gill بے مقصد گھومنا,1112373877479477248,,,,,False,False,1,https://twitter.com/PrakashJavdekar,https://www.facebook.com/SusuSwamy/videos/263111294643153/,,,,,,,,,,,,,,,,,,,,,,,,,,,,,,,,,,,,0,0,0,phd,3700 pod holders among 93000 applicants peons posts posts even know,2019-03-31T15:19:00.000Z,https://twitter.com/sumeetism/status/1112373877479477248,https://pbs.twimg.com/profile_images/1656932532196368384/TJseV7-f.jpg,"A lil weird,A lil crack,a lil imperfect,Cricket Buff & Political Satirist.Female chauvinist. UN Awardee for most non serious person on earth",2009-09-29T02:46:00.000Z,On a zoom call,1197,895,8231,48756,https://twitter.com//sumeetism,Sumeet Gill بے مقصد گھومنا,@sumeetism,False,dickoogill.blogspot.in,@sumeetism,False
,,1137390320268656640,,,,,False,False,0,https://twitter.com/Stanford,,,,,,,,,,,,,,,,,,,,,,,,,,,,,,,,,,,,,0,0,0,phd,pod anthropology,2019-06-08T16:05:00.000Z,https://twitter.com/thakurnikhil07/status/1137390320268656640,https://pbs.twimg.com/profile_images/1675565598242381824/8SYFJItL.jpg,"Himachal Pradesh ❤️
Prisoner of my own dreams #
Anthropologist #
Blogger#
PhD Scholar",2016-02-21T07:16:00.000Z,"Kangra, India",300,2136,25862,12495,https://twitter.com//thakurnikhil07,Nikhil Thakur,@thakurnikhil07,False,nikhilthakur.in,,False
https://pbs.twimg.com/profile_images/1694348745041932288/PEILXWnC.jpg,Rajesh Jaswal,1054753576499732481,,,,,False,False,0,https://twitter.com/BJYM,https://twitter.com/poonam_mahajan,https://twitter.com/search?q=%23VijayLaksh2019,,,,,,,,,,,,,,,,,,,,,,,,,,,,,,,,,,,0,0,0,phd,research fellowship scholarship worth 70000 80000 per month years lakh annual grant pod research vijaylaksh2019,2018-10-23T15:17:00.000Z,https://twitter.com/iJaswal4India/status/1054753576499732481,https://pbs.twimg.com/profile_images/1694348745041932288/PEILXWnC.jpg,Proud to be || Nationalist || Ram Bhakt || Himachali || BJPian || Rajput || Farmer || Sagittarius ||,2010-06-13T07:30:00.000Z,"Chandigarh, India",907,243,85473,93847,https://twitter.com//iJaswal4India,Rajesh Jaswal,@iJaswal4India,False,facebook.com/ijaswal4india/,@iJaswal4India,False
