avatar,fullname,id,images/0,images/1,images/2,images/3,isQuote,isRetweet,likes,links/0,links/1,links/2,links/3,links/4,links/5,links/6,links/7,links/8,links/9,links/10,links/11,links/12,links/13,links/14,links/15,links/16,quotedTweet/avatar,quotedTweet/fullname,quotedTweet/images/0,quotedTweet/images/1,quotedTweet/images/2,quotedTweet/links/0,quotedTweet/links/1,quotedTweet/links/2,quotedTweet/links/3,quotedTweet/links/4,quotedTweet/links/5,quotedTweet/links/6,quotedTweet/links/7,quotedTweet/links/8,quotedTweet/links/9,quotedTweet/links/10,quotedTweet/text,quotedTweet/timestamp,quotedTweet/url,quotedTweet/username,quotes,replies,retweets,searchQuery,text,timestamp,url,user/avatar,user/description,user/joinDate,user/location,user/totalFollowers,user/totalFollowing,user/totalLikes,user/totalTweets,user/url,user/userFullName,user/username,user/verified,user/website,username,verified
https://pbs.twimg.com/profile_images/1042014921003810816/bfGQQtp3.jpg,GSOI Educationals,1090221596479049728,https://pbs.twimg.com/media/DyE-nHtXQAAJNjs.jpg,,,,False,False,0,http://www.gsoi.in,,,,,,,,,,,,,,,,,,,,,,,,,,,,,,,,,,,,,0,0,0,Post Graduate,study australia new zealand pathfinder right career get admission top ranking universities undergraduate postgraduate courses highest visa ratio 7652808186 7626801006 web groin add sci level phase moral,2019-01-29T12:14:00.000Z,https://twitter.com/GSOI10/status/1090221596479049728,https://pbs.twimg.com/profile_images/1042014921003810816/bfGQQtp3.jpg,"GSOI Educationals is on Rampage, We are among the fastest growing Immigration-Consultants in the Region.101 New Colleges and Universities associated recently",2018-09-18T11:34:00.000Z,"Mohali, Punjab",25,57,79,690,https://twitter.com//GSOI10,GSOI Educationals,@GSOI10,False,gsoi.in,@GSOI10,False
,,1159093040025354241,https://pbs.twimg.com/media/EBXs90TW4AEiUde.jpg,,,,False,False,0,,,,,,,,,,,,,,,,,,,,,,,,,,,,,,,,,,,,,,0,0,0,Masters,ord masters commences,2019-08-07T13:24:00.000Z,https://twitter.com/edunomics/status/1159093040025354241,https://pbs.twimg.com/profile_images/1601864616321363968/wkUE5eis.jpg,AIME REGARDER LES DÉBATS  II AVENTURES II  LES TWEETS SONT UNE OPINION PERSONNELLE II RETWEET N'EST PAS ENDORSEMENT II,2010-03-22T07:12:00.000Z,"Chandigarh, India",516,1770,15802,8956,https://twitter.com//edunomics,AMAN UPPAL,@edunomics,False,,,False
https://pbs.twimg.com/profile_images/1042014921003810816/bfGQQtp3.jpg,GSOI Educationals,1089871879064690688,https://pbs.twimg.com/media/DyAAjl2XcAAYeYM.jpg,,,,False,False,0,https://twitter.com/search?q=%23destination,http://www.gsoi.in,,,,,,,,,,,,,,,,,,,,,,,,,,,,,,,,,,,,0,0,0,Post Graduate,choose dream study destination canada Canada usa get admission top ranking universities undergraduate postgraduate courses highest visa ratio 7652808186 7626801006 web groin add sci level phase moral,2019-01-28T13:04:00.000Z,https://twitter.com/GSOI10/status/1089871879064690688,https://pbs.twimg.com/profile_images/1042014921003810816/bfGQQtp3.jpg,"GSOI Educationals is on Rampage, We are among the fastest growing Immigration-Consultants in the Region.101 New Colleges and Universities associated recently",2018-09-18T11:34:00.000Z,"Mohali, Punjab",25,57,79,690,https://twitter.com//GSOI10,GSOI Educationals,@GSOI10,False,gsoi.in,@GSOI10,False
https://pbs.twimg.com/profile_images/1042014921003810816/bfGQQtp3.jpg,GSOI Educationals,1087698177661288449,https://pbs.twimg.com/media/DxhHcAyWoAAXvQ4.jpg,,,,False,False,0,http://www.gsoi.in,,,,,,,,,,,,,,,,,,,,,,,,,,,,,,,,,,,,,0,0,0,Post Graduate,study australia new zealand pathfinder right career get admission top ranking universities undergraduate postgraduate courses belts overall 7652808186 7626801006 web groin add sci level phase moral,2019-01-22T13:07:00.000Z,https://twitter.com/GSOI10/status/1087698177661288449,https://pbs.twimg.com/profile_images/1042014921003810816/bfGQQtp3.jpg,"GSOI Educationals is on Rampage, We are among the fastest growing Immigration-Consultants in the Region.101 New Colleges and Universities associated recently",2018-09-18T11:34:00.000Z,"Mohali, Punjab",25,57,79,690,https://twitter.com//GSOI10,GSOI Educationals,@GSOI10,False,gsoi.in,@GSOI10,False
https://pbs.twimg.com/profile_images/1042014921003810816/bfGQQtp3.jpg,GSOI Educationals,1085522039371431936,https://pbs.twimg.com/media/DxCMD1PXgAE7ee_.jpg,,,,False,False,0,http://www.gsoi.in,,,,,,,,,,,,,,,,,,,,,,,,,,,,,,,,,,,,,0,0,0,Post Graduate,choose provide canada Canada australia Australia get admission top ranking universities undergraduate postgraduate courses highest visa ratio belts overall 8288868885 7652808186 web groin add sci level phase moral,2019-01-16T12:59:00.000Z,https://twitter.com/GSOI10/status/1085522039371431936,https://pbs.twimg.com/profile_images/1042014921003810816/bfGQQtp3.jpg,"GSOI Educationals is on Rampage, We are among the fastest growing Immigration-Consultants in the Region.101 New Colleges and Universities associated recently",2018-09-18T11:34:00.000Z,"Mohali, Punjab",25,57,79,690,https://twitter.com//GSOI10,GSOI Educationals,@GSOI10,False,gsoi.in,@GSOI10,False
https://pbs.twimg.com/profile_images/1042014921003810816/bfGQQtp3.jpg,GSOI Educationals,1083696642694541315,https://pbs.twimg.com/media/DwoQHcpX0AElO-S.jpg,,,,False,False,0,https://twitter.com/search?q=%23STUDY,https://twitter.com/search?q=%23CANADA,https://twitter.com/search?q=%23studyvisa,https://twitter.com/search?q=%23canada,http://www.gsoi.in,,,,,,,,,,,,,,,,,,,,,,,,,,,,,,,,,0,0,0,Post Graduate,with graduation done next stop Canada canada Canada study canada get admission top ranking universities undergraduate postgraduate courses studyvisa canada phone 7652808186 7626801006 web groin add sci level phase moral,2019-01-11T12:06:00.000Z,https://twitter.com/GSOI10/status/1083696642694541315,https://pbs.twimg.com/profile_images/1042014921003810816/bfGQQtp3.jpg,"GSOI Educationals is on Rampage, We are among the fastest growing Immigration-Consultants in the Region.101 New Colleges and Universities associated recently",2018-09-18T11:34:00.000Z,"Mohali, Punjab",25,57,79,690,https://twitter.com//GSOI10,GSOI Educationals,@GSOI10,False,gsoi.in,@GSOI10,False
,,1455065093092220931,https://pbs.twimg.com/media/FDFt_HhUcAAJ5At.jpg,,,,False,False,1,,,,,,,,,,,,,,,,,,,,,,,,,,,,,,,,,,,,,,0,0,0,exams,online exams teachers one cheating exams students like,2021-11-01T06:52:00.000Z,https://twitter.com/whysorude_negi/status/1455065093092220931,https://pbs.twimg.com/profile_images/1632388161660923904/R1KldeIP.jpg,"llमोहित नेगीll
आवारा मुसाफ़िर हूं यारों 🖤
freedom👑_ride🏍️_click📸
किन्नौर🏡 🔄Chandigarh🏢
देवभूमि हिमाचल🗻
Traveler 🏕️",2020-11-03T17:15:00.000Z,from your imagination 📍,10,23,78,112,https://twitter.com//whysorude_negi,M O H I T__नेगी,@whysorude_negi,False,,,False
,,1166670866219843584,,,,,False,False,0,,,,,,,,,,,,,,,,,,,,,,,,,,,,,,,,,,,,,,0,0,0,Masters,already dancing tune masters leaders,2019-08-28T11:16:00.000Z,https://twitter.com/nsmaunder/status/1166670866219843584,https://pbs.twimg.com/profile_images/1082800232172113920/J3idgysD.jpg,"A liberal,I believe in human rights & gender equality .I hate ideologies & countries that violate human & gender rights .",2009-12-30T11:27:00.000Z,chandigarh,148,514,12884,3956,https://twitter.com//nsmaunder,M Nirmal singh,@nsmaunder,False,,,False
https://pbs.twimg.com/profile_images/1057246235055325188/QNFRMaDd.jpg,Global Refinement,1080787078659616768,https://pbs.twimg.com/media/Dv-6FTCX0AErHc5.jpg,,,,False,False,0,https://twitter.com/search?q=%23STUDY,https://twitter.com/search?q=%23CANADA,,,,,,,,,,,,,,,,,,,,,,,,,,,,,,,,,,,,0,0,0,Post Graduate,study canada get admission top ranking universities undergraduate postgraduate courses highest visa ratio scholarships available upcoming intake call 9888962674,2019-01-03T11:24:00.000Z,https://twitter.com/GRefinement/status/1080787078659616768,https://pbs.twimg.com/profile_images/1057246235055325188/QNFRMaDd.jpg,,2018-10-29T10:02:00.000Z,,15,0,1,44,https://twitter.com//GRefinement,Global Refinement,@GRefinement,False,,@GRefinement,False
,,1232256121013972998,,,,,False,False,0,https://twitter.com/search?q=%23TrumpInIndia,https://twitter.com/search?q=%23ZMA,,,,,,,,,,,,,,,,,,,,,,,,,,,,,,,,,,,,0,0,0,Masters,irony winning elections vilifying muslims mughals busy showing masters achievements masters ruled generations trumpinindia,2020-02-25T10:48:00.000Z,https://twitter.com/ZahidMajeed26/status/1232256121013972998,https://pbs.twimg.com/profile_images/1248213396572401665/0fmXczJP.jpg,My family is my life❤️ and everything else comes second as far as what's important to me❤️,2017-02-11T04:03:00.000Z,khiram,74,729,1203,472,https://twitter.com//ZahidMajeed26,ZAHID MAJEED,@ZahidMajeed26,False,,,False
,,1201418196332376070,,,,,False,False,0,https://twitter.com/SupriyaShrinate,https://thewire.in/rights/chidambaram-arrest-100-days-and-counting-yet-what-has-been-proven,,,,,,,,,,,,,,,,,,,,,,,,,,,,,,,,,,,,0,0,0,Masters,chidambaram arrest 100 days counting yet proven many glaring inaccuracies cbi contention point shoddy hasty job done instructions political masters,2019-12-02T08:29:00.000Z,https://twitter.com/KanwalChadha/status/1201418196332376070,https://pbs.twimg.com/profile_images/1669037834701873155/SxQsxIn6.jpg,"Entirely personal views.
Retired govt officer.
Congress supporter. 

RTs are not endorsements",2009-09-04T19:52:00.000Z,,3101,1825,116577,80994,https://twitter.com//KanwalChadha,Kanwal Chadha,@KanwalChadha,False,,,False
https://pbs.twimg.com/profile_images/1057246235055325188/QNFRMaDd.jpg,Global Refinement,1080785929319657473,https://pbs.twimg.com/media/Dv-5DFPXcAA6NVS.jpg,,,,False,False,0,https://twitter.com/search?q=%23STUDY,https://twitter.com/search?q=%23POLAND,,,,,,,,,,,,,,,,,,,,,,,,,,,,,,,,,,,,0,0,0,Post Graduate,study poland get admission top ranking universities undergraduate postgraduate courses highest visa ratio scholarships available upcoming intake contact information call 9888962674,2019-01-03T11:20:00.000Z,https://twitter.com/GRefinement/status/1080785929319657473,https://pbs.twimg.com/profile_images/1057246235055325188/QNFRMaDd.jpg,,2018-10-29T10:02:00.000Z,,15,0,1,44,https://twitter.com//GRefinement,Global Refinement,@GRefinement,False,,@GRefinement,False
,,1456303795848183810,,,,,False,False,0,https://twitter.com/KBByju,https://twitter.com/BYJUS,,,,,,,,,,,,,,,,,,,,,,,,,,,,,,,,,,,,0,0,0,exams,portray exams sort war advertisements unnecessary pressure kidsparents increase enrolment money,2021-11-04T16:54:00.000Z,https://twitter.com/m_shayin/status/1456303795848183810,https://pbs.twimg.com/profile_images/1621841049697267714/TJBDVghV.jpg,"MA (Kings College London) , Chevening Scholar. Michigan State University Alumni …….Illegitimi non carborundum......",2020-04-29T05:37:00.000Z,"London, England",4261,1002,17603,3712,https://twitter.com//m_shayin,M SHAYIN,@m_shayin,False,hpgcl.com,,False
https://pbs.twimg.com/profile_images/1057246235055325188/QNFRMaDd.jpg,Global Refinement,1080775319647334400,https://pbs.twimg.com/media/Dv-vXvdWwAIe0Zo.jpg,,,,False,False,0,https://twitter.com/search?q=%23STUDY,https://twitter.com/search?q=%23CANADA,https://twitter.com/search?q=%23studyvisa,https://twitter.com/search?q=%23canada,https://twitter.com/search?q=%23global,https://twitter.com/search?q=%23refinement,https://twitter.com/search?q=%23solution,https://twitter.com/search?q=%23studyvisaexpert,,,,,,,,,,,,,,,,,,,,,,,,,,,,,,0,0,0,Post Graduate,study canada get admission top ranking universities undergraduate postgraduate courses highest visa ratio scholarships available upcoming intake studyvisa canada global refinement solution studyvisaexpert 9888962674,2019-01-03T10:38:00.000Z,https://twitter.com/GRefinement/status/1080775319647334400,https://pbs.twimg.com/profile_images/1057246235055325188/QNFRMaDd.jpg,,2018-10-29T10:02:00.000Z,,15,0,1,44,https://twitter.com//GRefinement,Global Refinement,@GRefinement,False,,@GRefinement,False
https://pbs.twimg.com/profile_images/1355497049966305285/RAHjwPWm.jpg,Providers Overseas Consultants Private Limited,1075357557701652480,https://pbs.twimg.com/media/Duxv31qWoAE0rnb.jpg,,,,False,False,0,https://twitter.com/search?q=%23MAY2019,,,,,,,,,,,,,,,,,,,,,,,,,,,,,,,,,,,,,0,0,0,Post Graduate,hurry last chance apply may apply CanadaCanada study visa choose programmes certificate diploma undergraduate postgraduate dont let dreams dreams apply may2019 intake 917901977000 follow providers,2018-12-19T11:49:00.000Z,https://twitter.com/ProvidersMohali/status/1075357557701652480,https://pbs.twimg.com/profile_images/1355497049966305285/RAHjwPWm.jpg,"""Pioneers In Study Visa""

A Government Approved ISO 9001:2015 Certified Immigration Company",2018-04-07T07:44:00.000Z,Mohali | Barnala | Ludhiana,22,24,84,650,https://twitter.com//ProvidersMohali,Providers Overseas Consultants Private Limited,@ProvidersMohali,False,providers.pro,@ProvidersMohali,False
,,1445562994746814473,https://pbs.twimg.com/media/FA8k1TxVkAEanHV.jpg,,,,True,False,0,https://twitter.com/search?q=%23hssc_syllabus_fix_for_all_exam,,,,,,,,,,,,,,,,,,Shweta Dhull,https://pbs.twimg.com/media/FA8k1TxVkAEanHV.jpg,,,,,,,,,,,,,,"सब भाई ज़्यादा से ज़्यादा संख्या में कल 10 बजे HSSC पहुंचे ✊️✌️
शुभकामनायें",2021-10-05T15:44:00.000Z,https://twitter.com/ShweDhull/status/1445414516724932608,@ShweDhull,0,0,1,exams,hsscsyllabusfixforallexam,2021-10-06T01:34:00.000Z,https://twitter.com/Vishavjeet3131/status/1445562994746814473,https://pbs.twimg.com/profile_images/1396408939500040198/1URAgk9d.jpg,“अहिंसा परमो धर्मः,2020-02-09T09:59:00.000Z,"Chandigarh, India",20,147,69,254,https://twitter.com//Vishavjeet3131,Vishavjeet yadav,@Vishavjeet3131,False,,,False
,,1450351296075141121,,,,,False,False,1,https://twitter.com/search?q=%23RECONDUCT_HR_SI_EXAM,,,,,,,,,,,,,,,,,,,,,,,,,,,,,,,,,,,,,1,0,2,exams,reconducthrsiexam,2021-10-19T06:41:00.000Z,https://twitter.com/Vishavjeet3131/status/1450351296075141121,https://pbs.twimg.com/profile_images/1396408939500040198/1URAgk9d.jpg,“अहिंसा परमो धर्मः,2020-02-09T09:59:00.000Z,"Chandigarh, India",20,147,69,254,https://twitter.com//Vishavjeet3131,Vishavjeet yadav,@Vishavjeet3131,False,,,False
https://pbs.twimg.com/profile_images/1355497049966305285/RAHjwPWm.jpg,Providers Overseas Consultants Private Limited,1073902142962962432,https://pbs.twimg.com/media/DudERMjXgAEX5bI.jpg,,,,False,False,0,https://twitter.com/search?q=%23MAY2019,,,,,,,,,,,,,,,,,,,,,,,,,,,,,,,,,,,,,0,0,0,Post Graduate,apply CanadaCanada study visa choose programmes certificate diploma undergraduate postgraduate dont let dreams dreams apply visa may2019 intake 917901977000 follow providers,2018-12-15T11:26:00.000Z,https://twitter.com/ProvidersMohali/status/1073902142962962432,https://pbs.twimg.com/profile_images/1355497049966305285/RAHjwPWm.jpg,"""Pioneers In Study Visa""

A Government Approved ISO 9001:2015 Certified Immigration Company",2018-04-07T07:44:00.000Z,Mohali | Barnala | Ludhiana,22,24,84,650,https://twitter.com//ProvidersMohali,Providers Overseas Consultants Private Limited,@ProvidersMohali,False,providers.pro,@ProvidersMohali,False
https://pbs.twimg.com/profile_images/1622163216959954944/XI5gaGEk.jpg,Harinderjit Singh,1073548077728976896,,,,,False,False,0,https://twitter.com/ArvindKejriwal,https://twitter.com/narendramodi,https://twitter.com/RahulGandhi,,,,,,,,,,,,,,,,,,,,,,,,,,,,,,,,,,,0,0,0,Post Graduate,try new elected las elected las phds24 post graduates graduates includes engineers doctors lawyers government set record educated representatives history,2018-12-14T11:59:00.000Z,https://twitter.com/Harinderjit1/status/1073548077728976896,https://pbs.twimg.com/profile_images/1622163216959954944/XI5gaGEk.jpg,"Director, Saluja Motors Chandigarh, and retired Professor from Prod. Engg. Deptt. P.E.C.Chandigarh. Ph.D in Production Engineering.",2010-01-17T16:01:00.000Z,Chandigarh,184,505,891,19501,https://twitter.com//Harinderjit1,Harinderjit Singh,@Harinderjit1,False,,@Harinderjit1,False
https://pbs.twimg.com/profile_images/839076186756112386/tDJ3hykQ.jpg,Parminder Singh,1061160661210853376,,,,,False,False,0,https://twitter.com/search?q=%23STUDY,https://twitter.com/search?q=%23USA,https://www.instagram.com/p/Bp_d2gxl5bJ/?utm_source=ig_twitter_share&igshid=1uk0frk72q1lo,,,,,,,,,,,,,,,,,,,,,,,,,,,,,,,,,,,0,0,0,Post Graduate,study usa get admission top ranking universities undergraduate postgraduate courses highest visa ratio belts overall gap acceptable refuse cases,2018-11-10T07:36:00.000Z,https://twitter.com/param1406/status/1061160661210853376,https://pbs.twimg.com/profile_images/839076186756112386/tDJ3hykQ.jpg,,2012-04-26T10:20:00.000Z,,63,238,18,251,https://twitter.com//param1406,Parminder Singh,@param1406,False,,@param1406,False
https://pbs.twimg.com/profile_images/1042014921003810816/bfGQQtp3.jpg,GSOI Educationals,1056868212350971906,https://pbs.twimg.com/media/Dqq_9teU8AAYv2w.jpg,,,,False,False,1,https://twitter.com/search?q=%23STUDY,https://twitter.com/search?q=%23CANADA,http://www.gsoi.in,,,,,,,,,,,,,,,,,,,,,,,,,,,,,,,,,,,0,0,0,Post Graduate,study canada get admission top ranking universities undergraduate postgraduate courses highest visa ratio belts overall gap acceptable refuse cases apply 7652808186 7626801006 groin sci level phase moral,2018-10-29T11:19:00.000Z,https://twitter.com/GSOI10/status/1056868212350971906,https://pbs.twimg.com/profile_images/1042014921003810816/bfGQQtp3.jpg,"GSOI Educationals is on Rampage, We are among the fastest growing Immigration-Consultants in the Region.101 New Colleges and Universities associated recently",2018-09-18T11:34:00.000Z,"Mohali, Punjab",25,57,79,690,https://twitter.com//GSOI10,GSOI Educationals,@GSOI10,False,gsoi.in,@GSOI10,False
https://pbs.twimg.com/profile_images/1042014921003810816/bfGQQtp3.jpg,GSOI Educationals,1052902550586953729,https://pbs.twimg.com/media/DpypOn2WsAAH2Ya.jpg,,,,False,False,0,https://twitter.com/search?q=%23STUDY,https://twitter.com/search?q=%23AUSTRALIA,http://www.gsoi.in,,,,,,,,,,,,,,,,,,,,,,,,,,,,,,,,,,,0,0,0,Post Graduate,study australia get admission top ranking universities undergraduate postgraduate courses highest visa ratio scholarships available jan intake 2019 7652808186 7626801006 groin sci level phase moral punjab,2018-10-18T12:41:00.000Z,https://twitter.com/GSOI10/status/1052902550586953729,https://pbs.twimg.com/profile_images/1042014921003810816/bfGQQtp3.jpg,"GSOI Educationals is on Rampage, We are among the fastest growing Immigration-Consultants in the Region.101 New Colleges and Universities associated recently",2018-09-18T11:34:00.000Z,"Mohali, Punjab",25,57,79,690,https://twitter.com//GSOI10,GSOI Educationals,@GSOI10,False,gsoi.in,@GSOI10,False
https://pbs.twimg.com/profile_images/1231147505934422016/lSHS2Ozb.jpg,Vrinda International,1441369184965857280,,,,,False,False,0,https://piped.video/_1dCA6sRmbw,,,,,,,,,,,,,,,,,,,,,,,,,,,,,,,,,,,,,0,0,0,College,pipedvideo1dca6srmbw canada college visa,2021-09-24T11:49:00.000Z,https://twitter.com/VrindaInternat1/status/1441369184965857280,https://pbs.twimg.com/profile_images/1231147505934422016/lSHS2Ozb.jpg,Overseas education consultancy,2020-02-22T09:22:00.000Z,,46,136,127,482,https://twitter.com//VrindaInternat1,Vrinda International,@VrindaInternat1,False,,@VrindaInternat1,False
,,1450771191694872581,https://pbs.twimg.com/media/FCIssX-XMAozbo2.jpg,,,,False,False,3,https://twitter.com/search?q=%23RECONDUCT_HR_SI_EXAM,https://twitter.com/ShweDhull,https://twitter.com/HSSCorg_in,https://twitter.com/anilvijminister,https://twitter.com/dcmohry,https://twitter.com/rssurjewala,https://twitter.com/balrajkundu1,,,,,,,,,,,,,,,,,,,,,,,,,,,,,,,0,0,6,exams,reconducthrsiexam,2021-10-20T10:29:00.000Z,https://twitter.com/Vishavjeet3131/status/1450771191694872581,https://pbs.twimg.com/profile_images/1396408939500040198/1URAgk9d.jpg,“अहिंसा परमो धर्मः,2020-02-09T09:59:00.000Z,"Chandigarh, India",20,147,69,254,https://twitter.com//Vishavjeet3131,Vishavjeet yadav,@Vishavjeet3131,False,,,False
,,1152418966909808642,,,,,False,False,2,https://twitter.com/search?q=%23SaturdayThoughts,https://twitter.com/search?q=%23SaturdayMorning,,,,,,,,,,,,,,,,,,,,,,,,,,,,,,,,,,,,0,0,0,Masters,spiritual masters say faith small beautiful word takes less second hear takes many days understand takes much longer translate mind takes sometimes whole life prove saturdaythoughts saturdaymorning,2019-07-20T03:24:00.000Z,https://twitter.com/pathakbaba07/status/1152418966909808642,https://pbs.twimg.com/profile_images/1554030772725731328/az0EFPkA.jpg,"ji farmaea kaise aana hua.😍😍
inspired by @narendramodi ,@msdhoni,@iamsrk life ❤️❤️❤️🙏🙏🙏🙏
Electronic and communication Engineer 
🎓🎓🎓🎓",2017-11-08T06:38:00.000Z,"Chandigarh, India",139,468,11806,2213,https://twitter.com//pathakbaba07,Er Ayush pathak 🇮🇳,@pathakbaba07,False,instagram.com/invites/contac…,,False
,,1445138698769616896,,,,,False,False,0,,,,,,,,,,,,,,,,,,,,,,,,,,,,,,,,,,,,,,0,0,0,exams,bhai mere sudah exam aur whatsapp per link data agar sudah cha toh,2021-10-04T21:28:00.000Z,https://twitter.com/tusharjanagal25/status/1445138698769616896,https://pbs.twimg.com/profile_images/1397468594657660929/sz4cCy7O.jpg,Electrical Engineer and hobbyist photographer follow me on instagram. Photography account - @tj_clicked,2018-03-04T07:49:00.000Z,"Chandigarh, India",21,134,890,112,https://twitter.com//tusharjanagal25,Tushar Janagal,@tusharjanagal25,False,,,False
,,1238198379928141825,,,,,False,False,0,https://twitter.com/sardesairajdeep,,,,,,,,,,,,,,,,,,,,,,,,,,,,,,,,,,,,,0,0,0,Masters,right sushi barbaric besharm called journalists never say truth bark masters tell carry,2020-03-12T20:21:00.000Z,https://twitter.com/SANJUGUPTA06/status/1238198379928141825,https://pbs.twimg.com/profile_images/1191269292186095621/3r38W0lM.jpg,"सबके समान अधिकार  ,हिंदुस्तानी इन्सान",2012-08-03T11:52:00.000Z,"Ambala, India",268,498,4641,2582,https://twitter.com//SANJUGUPTA06,SANJU GUPTA,@SANJUGUPTA06,False,,,False
,,1454155469379956736,,,,,False,False,0,,,,,,,,,,,,,,,,,,,,,,,,,,,,,,,,,,,,,,0,0,0,exams,thats nice meant preparation exam,2021-10-29T18:37:00.000Z,https://twitter.com/abhijit_010/status/1454155469379956736,https://pbs.twimg.com/profile_images/1481252927461531652/GFnXna7m.jpg,"I am a cybersecurity student, and looking for people like me, dm me on insta @abhijeet_3192 to talk to me",2021-10-12T07:12:00.000Z,"Chandigarh, India",5,70,347,44,https://twitter.com//abhijit_010,Abhijit Singh,@abhijit_010,False,securitysecrets.in,,False
,,1152796046965137409,,,,,False,False,1,,,,,,,,,,,,,,,,,,,,,,,,,,,,,,,,,,,,,,0,0,0,Masters,masters say worldly life full stress strain best medicine patience lets think reflect patience actually cant practiced force perhaps learn adjust circumstances people coming life,2019-07-21T04:22:00.000Z,https://twitter.com/pathakbaba07/status/1152796046965137409,https://pbs.twimg.com/profile_images/1554030772725731328/az0EFPkA.jpg,"ji farmaea kaise aana hua.😍😍
inspired by @narendramodi ,@msdhoni,@iamsrk life ❤️❤️❤️🙏🙏🙏🙏
Electronic and communication Engineer 
🎓🎓🎓🎓",2017-11-08T06:38:00.000Z,"Chandigarh, India",139,468,11806,2213,https://twitter.com//pathakbaba07,Er Ayush pathak 🇮🇳,@pathakbaba07,False,instagram.com/invites/contac…,,False
,,1193524417399160832,https://pbs.twimg.com/media/EJBAHiHVAAAsvue.jpg,,,,False,False,13,https://twitter.com/search?q=%23Himalayas,https://twitter.com/search?q=%23XPulseXpedition,https://twitter.com/BunnyPunia,https://twitter.com/ShantonilNag,https://twitter.com/HeroMotoCorp,https://twitter.com/HeroMotoSports,https://twitter.com/bharatendukabi,https://twitter.com/KJ_tweetz,https://twitter.com/search?q=%23himalayas,https://twitter.com/search?q=%23IncredibleIndia,,,,,,,,,,,,,,,,,,,,,,,,,,,,1,1,3,Masters,guys masters comes riding himalayan fun first day travel xpulsexpedition himalayan incredibleindia,2019-11-10T13:42:00.000Z,https://twitter.com/ExploreWithRoy/status/1193524417399160832,https://pbs.twimg.com/profile_images/1728819181897007104/HHODUOyQ.jpg,"📷 𝐏𝐡𝐨𝐭𝐨𝐠𝐫𝐚𝐩𝐡𝐞𝐫
📽️ 𝐘𝐨𝐮𝐓𝐮𝐛𝐞𝐫
✍️  𝐖𝐫𝐢𝐭𝐞𝐫
☕ Coffee Lover
Youtube.com/BobbyRoy",2012-11-08T03:56:00.000Z,"New Delhi, India",1677,259,32182,21185,https://twitter.com//ExploreWithRoy,Bobby Roy,@ExploreWithRoy,False,instagram.com/thecanonfanboy,,False
https://pbs.twimg.com/profile_images/1590236094100287488/8vcsY8Ka.jpg,JAGTAR SINGH MANN,1438143614010286083,,,,,False,False,0,,,,,,,,,,,,,,,,,,,,,,,,,,,,,,,,,,,,,,0,0,0,exams,good get exams nana donot worry,2021-09-15T14:12:00.000Z,https://twitter.com/mann1043/status/1438143614010286083,https://pbs.twimg.com/profile_images/1590236094100287488/8vcsY8Ka.jpg,Interested  in economic&industry news .retd Officer.respect top industry icons and PM . conversant in finance issuesPROUD Indian Rt no endorsement .,2013-03-18T01:41:00.000Z,"Chandigarh, India",804,1935,14344,53216,https://twitter.com//mann1043,JAGTAR SINGH MANN,@mann1043,False,,@mann1043,False
,,1445141304556412930,,,,,False,False,0,,,,,,,,,,,,,,,,,,,,,,,,,,,,,,,,,,,,,,0,0,0,exams,buddy exam morning india,2021-10-04T21:38:00.000Z,https://twitter.com/tusharjanagal25/status/1445141304556412930,https://pbs.twimg.com/profile_images/1397468594657660929/sz4cCy7O.jpg,Electrical Engineer and hobbyist photographer follow me on instagram. Photography account - @tj_clicked,2018-03-04T07:49:00.000Z,"Chandigarh, India",21,134,890,112,https://twitter.com//tusharjanagal25,Tushar Janagal,@tusharjanagal25,False,,,False
