avatar,fullname,id,images/0,images/1,images/2,images/3,isQuote,isRetweet,likes,links/0,links/1,links/2,links/3,links/4,links/5,links/6,links/7,links/8,links/9,links/10,links/11,links/12,links/13,links/14,links/15,links/16,links/17,links/18,links/19,links/20,links/21,links/22,links/23,links/24,links/25,quotedTweet/avatar,quotedTweet/fullname,quotedTweet/images/0,quotedTweet/images/1,quotedTweet/images/2,quotedTweet/links/0,quotedTweet/links/1,quotedTweet/links/2,quotedTweet/links/3,quotedTweet/links/4,quotedTweet/links/5,quotedTweet/links/6,quotedTweet/links/7,quotedTweet/links/8,quotedTweet/links/9,quotedTweet/links/10,quotedTweet/text,quotedTweet/timestamp,quotedTweet/url,quotedTweet/username,quotes,replies,retweets,searchQuery,text,timestamp,url,user/avatar,user/description,user/joinDate,user/location,user/totalFollowers,user/totalFollowing,user/totalLikes,user/totalTweets,user/url,user/userFullName,user/username,user/verified,user/website,username,verified
,,1231826749035401216,,,,,False,False,0,,,,,,,,,,,,,,,,,,,,,,,,,,,,,,,,,,,,,,,,,,,,,,,0,0,0,Post Graduate,training hire program mics hello everyone greetings digihub technologies providing 100 job assurance training hire program ibm mainframesdevops graduate post graduate package min lakh per annum 9676167962,2020-02-24T06:22:00.000Z,https://twitter.com/brahmam47208986/status/1231826749035401216,https://pbs.twimg.com/profile_images/1228306323869065216/NCQw0SNZ.jpg,brahmi,2020-02-14T11:06:00.000Z,palavaram,2,20,18,29,https://twitter.com//brahmam47208986,brahmam,@brahmam47208986,False,brahminews9.blogspot.com/,,False
https://pbs.twimg.com/profile_images/1450753583628967939/SgWC-5S2.jpg,Adv Ravitheja Goud,1467709130454355979,,,,,False,False,0,https://www.instagram.com/p/CXIKsu_perj/?utm_medium=twitter,,,,,,,,,,,,,,,,,,,,,,,,,,,,,,,,,,,,,,,,,,,,,,0,0,0,University,university college arts social sciencesosmania university,2021-12-06T04:15:00.000Z,https://twitter.com/raviteja_burra/status/1467709130454355979,https://pbs.twimg.com/profile_images/1450753583628967939/SgWC-5S2.jpg,"Politician.
Job calendar year in telangana is my short term goal. M.Tech(KU, JNTUH campus),LLB,LLM OU campus,Worked in TCS, 
Contested MLA from",2011-05-22T08:06:00.000Z,vemulawada/OU campus,75,59,741,2132,https://twitter.com//raviteja_burra,Adv Ravitheja Goud,@raviteja_burra,False,piped.video/c/RavithejaBurra…,@raviteja_burra,False
https://pbs.twimg.com/profile_images/1690768407837474816/1eaGGCzD.jpg,sanjay bajaj,1467670378931580930,,,,,False,False,0,https://twitter.com/pbhushan1,https://twitter.com/search?q=%23JustAsking,,,,,,,,,,,,,,,,,,,,,,,,,,,,,,,,,,,,,,,,,,,,,0,0,0,University,university belong justasking,2021-12-06T01:41:00.000Z,https://twitter.com/iiirdi/status/1467670378931580930,https://pbs.twimg.com/profile_images/1690768407837474816/1eaGGCzD.jpg,"think of #Photography think of thirdidigital.in  #animallover 
#Hyderabad #loveindia",2009-11-04T07:23:00.000Z,ÜT,515,451,12020,36396,https://twitter.com//iiirdi,sanjay bajaj,@iiirdi,False,about.me/sanjay.bajaj,@iiirdi,False
https://pbs.twimg.com/profile_images/1719061118092500992/5ELutSU8.jpg,Frustrated Urban commuters,1466703969527353345,,,,,False,False,3,https://twitter.com/sahityaakademi,https://twitter.com/nfdcindia,https://twitter.com/kishanreddybjp,,,,,,,,,,,,,,,,,,,,,,,,,,,,,,,,,,,,,,,,,,,,0,0,0,University,telugu university brown center adapt etc need publish works literature digitize future use cultural filmhistory studies,2021-12-03T09:40:00.000Z,https://twitter.com/HydWatch/status/1466703969527353345,https://pbs.twimg.com/profile_images/1719061118092500992/5ELutSU8.jpg,News with Focus on people's problems in Sarcastic🙃 Tone for Better India with Public Transport Development🌲Political ReTweets r for Fun & GK 🌳 🌊🐢,2016-11-13T11:20:00.000Z,"Hitech City, Rajendra Nagar",7171,5635,211583,349693,https://twitter.com//HydWatch,Frustrated Urban commuters,@HydWatch,False,,@HydWatch,False
,,1469331435928522755,https://pbs.twimg.com/media/FGLmCodXsAQZW9h.jpg,,,,True,False,24,https://twitter.com/search?q=%23President,https://twitter.com/penn_state,https://twitter.com/search?q=%23Vizag,https://twitter.com/andhrauniversit,https://twitter.com/search?q=%23AndhraPradesh,https://twitter.com/TOIVizagNews,https://twitter.com/USCGHyderabad,https://twitter.com/USAndIndia,https://twitter.com/Andrew007Uk,https://twitter.com/RameshKolluru1,https://twitter.com/RameshPV2010,,,,,,,,,,,,,,,,,Penn State,https://pbs.twimg.com/media/FGLmCodXsAQZW9h.jpg,,,http://ow.ly/UFvp50H7hem,,,,,,,,,,,"Penn State names Dr. Neeli Bendapudi as its 19th president! 

Welcome, President-elect Bendapudi!
ow.ly/UFvp50H7hem",2021-12-09T17:02:00.000Z,https://twitter.com/penn_state/status/1468989363266719752,@penn_state,2,1,7,University,congratulations neely bendapudi guru elected president university hailing vital alumnus andhrapradesh,2021-12-10T15:41:00.000Z,https://twitter.com/khwajamoinddin/status/1469331435928522755,https://pbs.twimg.com/profile_images/1732082839938613248/uATswBjN.jpg,Transport and Protocol Officer. British Deputy High Commission.  Views Own,2017-09-29T06:57:00.000Z,"Hyderabad, India",2432,400,145328,9133,https://twitter.com//khwajamoinddin,Khwaja Moinuddin,@khwajamoinddin,False,linkedin.com/in/khwaja-moinu…,,False
,,1368670965173952512,https://pbs.twimg.com/media/Ev4BShJVkAYLSi1.jpg,,,,True,False,0,,,,,,,,,,,,,,,,,,,,,,,,,,,,Spirit of Congress✋,https://pbs.twimg.com/media/Ev4BShJVkAYLSi1.jpg,,,,,,,,,,,,,,Oh Modi 😂😂😂😂,2021-03-07T12:03:00.000Z,https://twitter.com/SpiritOfCongres/status/1368532756695642118,@SpiritOfCongres,0,0,0,phd,pod saying lies awarded nobel prize telling lies without hesitation,2021-03-07T21:12:00.000Z,https://twitter.com/Voleti5/status/1368670965173952512,https://pbs.twimg.com/profile_images/1566093801416171520/VCMEre2Y.jpg,"Play your role in life with such a passion, so that even curtains are down, applause should not stop.",2017-01-01T03:57:00.000Z,India,201,301,27054,45348,https://twitter.com//Voleti5,Voleti,@Voleti5,False,,,True
,,1233040939062456320,,,,,False,False,1,,,,,,,,,,,,,,,,,,,,,,,,,,,,,,,,,,,,,,,,,,,,,,,0,0,1,Post Graduate,training hire program mics hello everyone greetings digihub technologies providing 100job assurance traininghire program ibm mainframesdevops graduate post graduate package mind lakh per annum ply contact brahma 9676167962,2020-02-27T14:47:00.000Z,https://twitter.com/brahmam47208986/status/1233040939062456320,https://pbs.twimg.com/profile_images/1228306323869065216/NCQw0SNZ.jpg,brahmi,2020-02-14T11:06:00.000Z,palavaram,2,20,18,29,https://twitter.com//brahmam47208986,brahmam,@brahmam47208986,False,brahminews9.blogspot.com/,,False
,,1363469131261960196,,,,,False,False,0,,,,,,,,,,,,,,,,,,,,,,,,,,,,,,,,,,,,,,,,,,,,,,,0,0,0,phd,bro pod lives sentinalese,2021-02-21T12:42:00.000Z,https://twitter.com/MadelkarVijay/status/1363469131261960196,https://pbs.twimg.com/profile_images/844959321599295488/qqjeCfaw.jpg,Dharma is here to stay till eternity,2017-03-19T15:41:00.000Z,"Hyderabad, India",98,1206,31680,7754,https://twitter.com//MadelkarVijay,Elon Masth,@MadelkarVijay,False,,,False
,,1124344831843586048,,,,,False,False,3,https://twitter.com/search?q=%23CycloneFani,,,,,,,,,,,,,,,,,,,,,,,,,,,,,,,,,,,,,,,,,,,,,,0,0,0,Undergraduate,gods might video clip roof blown undergraduate hostel aims bhubaneshwar due cyclonefani,2019-05-03T16:07:00.000Z,https://twitter.com/SattarFarooqui/status/1124344831843586048,https://pbs.twimg.com/profile_images/1600775108679053313/03nEMnL8.jpg,Secretary @MPJTelangana | Senior-Member IEEE | NPTEL Star | NIT Warangal Alumnus | Human Rights' Activist | मेरा भारत महान,2013-10-25T18:30:00.000Z,"Hyderabad, Telangana, India",23756,23122,15858,44831,https://twitter.com//SattarFarooqui,Mohd Abdul Sattar,@SattarFarooqui,True,mpjtelangana.com/,,True
,,1069529887235403776,https://pbs.twimg.com/media/Dte6olZU0AAVtYe.jpg,https://pbs.twimg.com/media/Dte6olQVsAUi0ht.jpg,https://pbs.twimg.com/media/Dte6oeuU0AADfWE.jpg,,False,False,3,https://twitter.com/SPolwatta,https://twitter.com/search?q=%23QGIS,https://twitter.com/search?q=%23srilankaresearch,,,,,,,,,,,,,,,,,,,,,,,,,,,,,,,,,,,,,,,,,,,,0,0,3,Undergraduate,read research assistant time undergraduate research project facebook page week attended course geospatial techniques coastal mapping monitoring using gis oceanteacher global academy srilankaresearch,2018-12-03T09:52:00.000Z,https://twitter.com/blue_resources/status/1069529887235403776,https://pbs.twimg.com/profile_images/1061179120082575360/2IGEcbi7.jpg,"Blue Resources Trust is a marine research & consultancy organisation based in Sri Lanka. We focus on elasmobranchs, corals, seagrass, & sustainable fisheries.",2016-04-12T03:23:00.000Z,Sri Lanka,839,374,1403,924,https://twitter.com//blue_resources,Blue Resources Trust,@blue_resources,False,BlueResources.org,,False
,,1363899157388222464,,,,,True,False,0,https://twitter.com/PHDcomics,https://twitter.com/PhD_Guru,https://twitter.com/PhDForum,https://twitter.com/Mito_News,https://twitter.com/mitochondria,,,,,,,,,,,,,,,,,,,,,,,Piyush Daga,,,,https://twitter.com/search?q=%23viral,https://twitter.com/search?q=%23science,https://twitter.com/search?q=%23research,https://twitter.com/search?q=%23Mitochondria,https://twitter.com/search?q=%23powerhouse,https://twitter.com/search?q=%23party,,,,,,"Bringing #viral things into #science and #research 
Middle Panel: #Mitochondria also known as the #powerhouse of the cell
First panel: Motor proteins act as a CAR driving ""mitochondria"" around the cell
Last panel: Dynamic mitochondria having a #party by fusing and dividing.",2021-02-22T17:06:00.000Z,https://twitter.com/piyushdaga4892/status/1363897931737100289,@piyushdaga4892,0,0,0,phd,,2021-02-22T17:11:00.000Z,https://twitter.com/piyushdaga4892/status/1363899157388222464,https://pbs.twimg.com/profile_images/1215977406881599488/bBGD_5PA.jpg,"Science
Films
Music
And Puns",2009-06-14T11:35:00.000Z,"Hyderabad, India",570,1010,21072,8508,https://twitter.com//piyushdaga4892,Piyush Daga,@piyushdaga4892,False,piyushdaga4892.wordpress.com…,,False
https://pbs.twimg.com/profile_images/1543615198724243456/Up25fBqY.jpg,Devina Sarwatay,1352460947428790272,,,,,False,False,1,https://twitter.com/AdityaDeshbandu,https://twitter.com/IIM_I,https://twitter.com/symbiosistweets,https://twitter.com/aaftindia,https://twitter.com/FLAMEUniversity,https://twitter.com/uniofguyana,https://twitter.com/HydUniv,,,,,,,,,,,,,,,,,,,,,,,,,,,,,,,,,,,,,,,,0,1,0,phd,panelists pod students lecturers assistant professors india iguana arcana kumar central jammy neha samaddar sari arm taijrani rampersaud,2021-01-22T03:39:00.000Z,https://twitter.com/DevinaSarwatay/status/1352460947428790272,https://pbs.twimg.com/profile_images/1543615198724243456/Up25fBqY.jpg,I study young people and digital cultures,2014-06-30T16:42:00.000Z,"Hyderabad, India",1640,5001,30987,21924,https://twitter.com//DevinaSarwatay,Devina Sarwatay,@DevinaSarwatay,False,linkedin.com/pub/devina-sarw…,@DevinaSarwatay,False
https://pbs.twimg.com/profile_images/1732001451612966913/xZBHqwwY.jpg,Kalyani Sharma,1348220686460850180,,,,,False,False,23,,,,,,,,,,,,,,,,,,,,,,,,,,,,,,,,,,,,,,,,,,,,,,,0,0,1,phd,pod,2021-01-10T10:50:00.000Z,https://twitter.com/KalyaniMuktevi/status/1348220686460850180,https://pbs.twimg.com/profile_images/1732001451612966913/xZBHqwwY.jpg,"Mother of 2 wonderful humans.     
#సుందరకాండ  @localcassette on Spotify open.spotify.com/artist/7qzn…",2010-09-21T12:24:00.000Z,"Hyderabad, India",7321,1223,164234,81433,https://twitter.com//KalyaniMuktevi,Kalyani Sharma,@KalyaniMuktevi,False,,@KalyaniMuktevi,False
https://pbs.twimg.com/profile_images/1701212080240832512/IWk5-s2p.jpg,Dr. IVNS Raju,1346055028704829441,,,,,False,False,2,https://twitter.com/RMCpost,https://twitter.com/narendramodi,https://twitter.com/DrRPNishank,http://www.mediacrooks.com/2021/01/mba-delusions.html?m=1,,,,,,,,,,,,,,,,,,,,,,,,,,,,,,,,,,,,,,,,,,,1,0,2,phd,exposed shallowest mba education add salt injury learned wanted mba courses teach inclusion days far away offers pig pod secularism,2021-01-04T11:25:00.000Z,https://twitter.com/ivnsraju65/status/1346055028704829441,https://pbs.twimg.com/profile_images/1701212080240832512/IWk5-s2p.jpg,"HR & OD Pro with 30+yrs of experience, a Nija VaishNava. Passionately help Organizations, Business Leaders & People in achieving their goals.",2012-06-27T06:29:00.000Z,"Hyderabad, India",1401,554,106301,68564,https://twitter.com//ivnsraju65,Dr. IVNS Raju,@ivnsraju65,False,blogger.com/blogger.g?blogID…,@ivnsraju65,False
https://pbs.twimg.com/profile_images/1701212080240832512/IWk5-s2p.jpg,Dr. IVNS Raju,1344207338228469767,,,,,True,False,1,,,,,,,,,,,,,,,,,,,,,,,,,,,,Dr Tamilisai Soundararajan,,,,,,,,,,,,,,,I will be meeting VC of Kaloji Narayana Rao University of Health Sciences today to clarify medical  admissions  held this year as I received several representations from ourTelengana students about denial of admissions & better colleges in the state to local meritorious students,2020-12-30T08:51:00.000Z,https://twitter.com/DrTamilisaiGuv/status/1344204465914531841,@DrTamilisaiGuv,1,0,1,phd,please look pod teachers engineering colleges mba courses names used complying norms also salaries paid sad education institutions telling lies quality education expect,2020-12-30T09:02:00.000Z,https://twitter.com/ivnsraju65/status/1344207338228469767,https://pbs.twimg.com/profile_images/1701212080240832512/IWk5-s2p.jpg,"HR & OD Pro with 30+yrs of experience, a Nija VaishNava. Passionately help Organizations, Business Leaders & People in achieving their goals.",2012-06-27T06:29:00.000Z,"Hyderabad, India",1401,554,106301,68564,https://twitter.com//ivnsraju65,Dr. IVNS Raju,@ivnsraju65,False,blogger.com/blogger.g?blogID…,@ivnsraju65,True
,,1365941824691474432,,,,,False,False,1,https://twitter.com/search?q=%23JobKiBaat,,,,,,,,,,,,,,,,,,,,,,,,,,,,,,,,,,,,,,,,,,,,,,0,0,2,phd,jobkibaat 3700 pod holders 50000 graduates 28000 postgraduate applied posts peons police post required minimum eligibility class raise voice today else could turn tomorrow,2021-02-28T08:28:00.000Z,https://twitter.com/ipradeepkmr/status/1365941824691474432,https://pbs.twimg.com/profile_images/1546904629849427969/zUzIaFrv.jpg,"Ready to give my life for @RSPraveenSwaero sir ,please support the change in society by donating here rsp4ts.org and",2020-07-10T09:20:00.000Z,"Hyderabad, India",2315,1412,16827,17127,https://twitter.com//ipradeepkmr,Dr.RS Praveen Kumar Follower 🗯,@ipradeepkmr,False,nitter.net/i/lists/149280484…,,False
,,1473571637853253632,https://pbs.twimg.com/media/FHMtmCOVkAM0b3R.jpg,,,,False,False,0,,,,,,,,,,,,,,,,,,,,,,,,,,,,,,,,,,,,,,,,,,,,,,,0,0,0,college,sir seen social media 555 route acceptable cant increasing buses college routes,2021-12-22T08:30:00.000Z,https://twitter.com/chandugummadi07/status/1473571637853253632,https://pbs.twimg.com/profile_images/1482258129253695488/b5R5xLqX.jpg,,2015-03-22T14:41:00.000Z,"Hyderabad, India",15,229,1395,143,https://twitter.com//chandugummadi07,Chandu Gummadi,@chandugummadi07,False,,,False
,,1400819730663952384,,,,,False,False,0,,,,,,,,,,,,,,,,,,,,,,,,,,,,,,,,,,,,,,,,,,,,,,,0,0,0,Bachelors,immature fully grown confused bachelor forever thats rail andi,2021-06-04T14:20:00.000Z,https://twitter.com/ubvijman/status/1400819730663952384,https://pbs.twimg.com/profile_images/1554387897234534400/v4Y4XyXQ.jpg,"BJP activist, Proud NaMo Bhakt.",2014-04-28T11:16:00.000Z,Bhagyanagar.,3161,4952,308436,58855,https://twitter.com//ubvijman,Manindra 🇮🇳🚩,@ubvijman,False,,,False
,,1473563276852142082,,,,,False,False,35,,,,,,,,,,,,,,,,,,,,,,,,,,,,,,,,,,,,,,,,,,,,,,,0,0,49,college,vacancy post lab assistant college immediate requirement knowledge autocrat candor staadpro preferable please apply posting resume contact details hodcivileduin qualification beseech diploma civil,2021-12-22T07:57:00.000Z,https://twitter.com/SriRenikunta/status/1473563276852142082,https://pbs.twimg.com/profile_images/1658156219109101568/azX-nFq5.jpg,"Asst. Prof. @mcethyderabad || PhD (Scholor) || Civil Engineer Alumnus of @kstate, @of_vasavi @osmania1917 || Teaching is not a profession – it is a passion.",2016-07-03T09:52:00.000Z,"Hyderabad, India",708,2536,24275,5362,https://twitter.com//SriRenikunta,Srikanth Renikunta,@SriRenikunta,False,orcid.org/0000-0003-2742-963…,,False
,,1360609370740989954,,,,,False,False,2,,,,,,,,,,,,,,,,,,,,,,,,,,,,,,,,,,,,,,,,,,,,,,,0,1,1,phd,pod thesis raysinger torsion,2021-02-13T15:18:00.000Z,https://twitter.com/rauindia/status/1360609370740989954,https://pbs.twimg.com/profile_images/1610296082541711360/OKstM13t.jpg,,2011-04-25T04:45:00.000Z,,454,3353,109063,17157,https://twitter.com//rauindia,Srinivas Rau,@rauindia,False,,,False
,,1361736418721079296,,,,,False,False,3,https://www.instagram.com/p/CLXL4y5AdG-/?igshid=e9byl6ur7spu,,,,,,,,,,,,,,,,,,,,,,,,,,,,,,,,,,,,,,,,,,,,,,0,0,0,phd,finally received much awaited pod degree jodhpur hyderabad,2021-02-16T17:57:00.000Z,https://twitter.com/x007rahul/status/1361736418721079296,https://pbs.twimg.com/profile_images/1461388712869175298/VncqDwbx.jpg,"Research Scientist II, Amazon Prime Video
PhD, IIT Jodhpur",2010-06-14T16:33:00.000Z,"Hyderabad, India",62,131,41,316,https://twitter.com//x007rahul,KUMAR RAHUL,@x007rahul,False,,,False
,,1473276067448168454,https://pbs.twimg.com/media/FHIgwttVcAE95aS.jpg,https://pbs.twimg.com/media/FHIgwtrUcAECaSw.jpg,https://pbs.twimg.com/media/FHIgwttUYAAYvni.jpg,https://pbs.twimg.com/media/FHIgwt4UcAMohB0.jpg,False,False,0,https://twitter.com/HYDTP,,,,,,,,,,,,,,,,,,,,,,,,,,,,,,,,,,,,,,,,,,,,,,0,1,0,college,bike 3138no helmetrash drivinghit run stand girls college mehdipatnam caused damage car also hit pedestrians drove rashly escaperequesting strict actionfine compensation car damagethanking,2021-12-21T12:56:00.000Z,https://twitter.com/drzion/status/1473276067448168454,https://pbs.twimg.com/profile_images/1689477403976822786/TZHu5TRn.jpg,"Head&Professor,Consultant Pediatrician&Neonatologist. Guide,Research Adviser and exams assessor for MBBS,MD(Ped.),Dch under Medical Council Of India,New Delhi.",2009-11-03T17:32:00.000Z,"Hyderabad,India",1019,2485,2888,6739,https://twitter.com//drzion,Prof Dr Zion Eluzai Gaddam 🇮🇳,@drzion,False,,,False
https://pbs.twimg.com/profile_images/642007353886294016/9ury1_Pb.jpg,Regency College of Culinary Arts & Hotel Mgt,1472783578740183052,,,,,False,False,0,https://www.instagram.com/p/CXsOSlIhWtt/?utm_medium=twitter,,,,,,,,,,,,,,,,,,,,,,,,,,,,,,,,,,,,,,,,,,,,,,0,0,0,college,regmatesthe freshers2021 regency college culinary arts hotel management,2021-12-20T04:19:00.000Z,https://twitter.com/rchmct/status/1472783578740183052,https://pbs.twimg.com/profile_images/642007353886294016/9ury1_Pb.jpg,,2015-09-10T16:08:00.000Z,"Hyderabad, India",286,133,6,1137,https://twitter.com//rchmct,Regency College of Culinary Arts & Hotel Mgt,@rchmct,False,rchmct.org,@rchmct,False
https://pbs.twimg.com/profile_images/642007353886294016/9ury1_Pb.jpg,Regency College of Culinary Arts & Hotel Mgt,1472563133436678146,,,,,False,False,0,https://www.instagram.com/p/CXqqC06hEmF/?utm_medium=twitter,,,,,,,,,,,,,,,,,,,,,,,,,,,,,,,,,,,,,,,,,,,,,,0,0,0,college,towel artsy regents regency college culinary arts hotel management,2021-12-19T13:43:00.000Z,https://twitter.com/rchmct/status/1472563133436678146,https://pbs.twimg.com/profile_images/642007353886294016/9ury1_Pb.jpg,,2015-09-10T16:08:00.000Z,"Hyderabad, India",286,133,6,1137,https://twitter.com//rchmct,Regency College of Culinary Arts & Hotel Mgt,@rchmct,False,rchmct.org,@rchmct,False
https://pbs.twimg.com/profile_images/642007353886294016/9ury1_Pb.jpg,Regency College of Culinary Arts & Hotel Mgt,1472562867320803332,,,,,False,False,0,https://www.instagram.com/p/CXqp66whcax/?utm_medium=twitter,,,,,,,,,,,,,,,,,,,,,,,,,,,,,,,,,,,,,,,,,,,,,,0,0,0,college,fresher party2020 regency college culinary arts hotel management,2021-12-19T13:42:00.000Z,https://twitter.com/rchmct/status/1472562867320803332,https://pbs.twimg.com/profile_images/642007353886294016/9ury1_Pb.jpg,,2015-09-10T16:08:00.000Z,"Hyderabad, India",286,133,6,1137,https://twitter.com//rchmct,Regency College of Culinary Arts & Hotel Mgt,@rchmct,False,rchmct.org,@rchmct,False
https://pbs.twimg.com/profile_images/1681862623799967744/bhI9qAFw.jpg,Aravind,1472551450379112448,https://pbs.twimg.com/media/FG-JcgdVEAA3C5N.jpg,,,,True,False,6,,,,,,,,,,,,,,,,,,,,,,,,,,,,Surya Guptha - Born for Farmers & cows,https://pbs.twimg.com/media/FG-JcgdVEAA3C5N.jpg,,,https://twitter.com/DrTamilisaiGuv,,,,,,,,,,,"To attract youth towards agriculture & to improve horticulture presence in Telangana we are starting Horticulture Polytechnic college at Nalgonda this 24th Dec at 11 AM & the college would be inaugurated by none other than her highness @DrTamilisaiGuv madam 

You all are invited",2021-12-19T12:46:00.000Z,https://twitter.com/contactsurya1/status/1472548780792713216,@contactsurya1,0,0,1,college,congratulations best wishes drama bharathi horticulture polytechnic college nalgonda hope many graduate help farming society,2021-12-19T12:56:00.000Z,https://twitter.com/acuuac/status/1472551450379112448,https://pbs.twimg.com/profile_images/1681862623799967744/bhI9qAFw.jpg,Bharatwasi. Tweets personal. RTs and Likes are not endorsements.,2015-10-30T05:34:00.000Z,,124,329,2764,2808,https://twitter.com//acuuac,Aravind,@acuuac,False,,@acuuac,False
,,1398221962271289350,,,,,False,False,1,,,,,,,,,,,,,,,,,,,,,,,,,,,,,,,,,,,,,,,,,,,,,,,0,0,0,Bachelors,andhari playlist latest songs tuna lena anita anita song math parka anita anita song emotional bachelor room songs petty enjoy chesevalam aptly dedication ala vundedhu playlist kudu quite oka like esukondi,2021-05-28T10:17:00.000Z,https://twitter.com/prasannaaa_here/status/1398221962271289350,https://pbs.twimg.com/profile_images/1687546477084819457/w7OzDEtJ.jpg,introvert trying to be extremely extrovert,2021-05-27T15:17:00.000Z,"Hyderabad, India",8,36,379,108,https://twitter.com//prasannaaa_here,Papaya_face,@prasannaaa_here,False,,,False
,,1473271755699470336,https://pbs.twimg.com/media/FHIcvbpUUAAOBYP.jpg,https://pbs.twimg.com/media/FHIcvbzUcAIpAOg.jpg,https://pbs.twimg.com/media/FHIcvb5VQAID3mL.jpg,https://pbs.twimg.com/media/FHIcvcPUYAA7gLw.jpg,False,False,0,https://twitter.com/HYDTP,,,,,,,,,,,,,,,,,,,,,,,,,,,,,,,,,,,,,,,,,,,,,,0,1,0,college,bike 3138no helmetrash drivinghit run stand girls college mehdipatnam caused damage car also hit pedestrians drove rashly escaperequesting strict action compensation car damagethanking,2021-12-21T12:38:00.000Z,https://twitter.com/drzion/status/1473271755699470336,https://pbs.twimg.com/profile_images/1689477403976822786/TZHu5TRn.jpg,"Head&Professor,Consultant Pediatrician&Neonatologist. Guide,Research Adviser and exams assessor for MBBS,MD(Ped.),Dch under Medical Council Of India,New Delhi.",2009-11-03T17:32:00.000Z,"Hyderabad,India",1019,2485,2888,6739,https://twitter.com//drzion,Prof Dr Zion Eluzai Gaddam 🇮🇳,@drzion,False,,,False
,,1466051464791531522,,,,,False,False,0,,,,,,,,,,,,,,,,,,,,,,,,,,,,,,,,,,,,,,,,,,,,,,,0,0,0,exams,please sir change mode exam online offline dont postpone exam,2021-12-01T14:28:00.000Z,https://twitter.com/K32859788Naveen/status/1466051464791531522,https://pbs.twimg.com/profile_images/1376150398814273538/Uo2nSsB6.jpg,Be a student entire the life.,2019-12-12T02:22:00.000Z,"Korba, India",2,14,25,14,https://twitter.com//K32859788Naveen,veennkr_,@K32859788Naveen,False,,,False
https://pbs.twimg.com/profile_images/1558412206659710976/p8COA6XH.jpg,P.CHANDU,1472413146828603395,,,,,False,False,0,,,,,,,,,,,,,,,,,,,,,,,,,,,,,,,,,,,,,,,,,,,,,,,0,0,0,college,sir saw devastation and wave negligence main reason and wave sir schoolscolleges sensitive honking willing bring qualitative restrictions enforcing couid app behavior brining restrictions public moments essential,2021-12-19T03:47:00.000Z,https://twitter.com/pcdhyd/status/1472413146828603395,https://pbs.twimg.com/profile_images/1558412206659710976/p8COA6XH.jpg,"HYDERABAD/AHMADABAD
INDIA",2012-10-11T06:20:00.000Z,AHMADABAD/HYDERABAD,53,457,240,14475,https://twitter.com//pcdhyd,P.CHANDU,@pcdhyd,False,,@pcdhyd,False
https://pbs.twimg.com/profile_images/642007353886294016/9ury1_Pb.jpg,Regency College of Culinary Arts & Hotel Mgt,1472296839323996161,,,,,False,False,0,https://www.instagram.com/p/CXow8eHBNJJ/?utm_medium=twitter,,,,,,,,,,,,,,,,,,,,,,,,,,,,,,,,,,,,,,,,,,,,,,0,0,0,college,posted photo regency college culinary arts hotel management,2021-12-18T20:04:00.000Z,https://twitter.com/rchmct/status/1472296839323996161,https://pbs.twimg.com/profile_images/642007353886294016/9ury1_Pb.jpg,,2015-09-10T16:08:00.000Z,"Hyderabad, India",286,133,6,1137,https://twitter.com//rchmct,Regency College of Culinary Arts & Hotel Mgt,@rchmct,False,rchmct.org,@rchmct,False
https://pbs.twimg.com/profile_images/1558412206659710976/p8COA6XH.jpg,P.CHANDU,1471648481404022788,,,,,False,False,0,,,,,,,,,,,,,,,,,,,,,,,,,,,,,,,,,,,,,,,,,,,,,,,0,0,0,college,need much sincerely seriously work cases started spreading even though knew well advance efforts prevent insufficient schoolscolleges highly sensitive monitoring authorities couid app beta lower minimal,2021-12-17T01:08:00.000Z,https://twitter.com/pcdhyd/status/1471648481404022788,https://pbs.twimg.com/profile_images/1558412206659710976/p8COA6XH.jpg,"HYDERABAD/AHMADABAD
INDIA",2012-10-11T06:20:00.000Z,AHMADABAD/HYDERABAD,53,457,240,14475,https://twitter.com//pcdhyd,P.CHANDU,@pcdhyd,False,,@pcdhyd,False
