avatar,fullname,id,images/0,images/1,images/2,images/3,isQuote,isRetweet,likes,links/0,links/1,links/2,links/3,links/4,links/5,links/6,links/7,links/8,links/9,links/10,links/11,links/12,links/13,links/14,links/15,links/16,links/17,links/18,links/19,links/20,links/21,links/22,links/23,links/24,links/25,quotedTweet/avatar,quotedTweet/fullname,quotedTweet/images/0,quotedTweet/images/1,quotedTweet/images/2,quotedTweet/links/0,quotedTweet/links/1,quotedTweet/links/2,quotedTweet/links/3,quotedTweet/links/4,quotedTweet/links/5,quotedTweet/links/6,quotedTweet/links/7,quotedTweet/links/8,quotedTweet/links/9,quotedTweet/links/10,quotedTweet/text,quotedTweet/timestamp,quotedTweet/url,quotedTweet/username,quotes,replies,retweets,searchQuery,text,timestamp,url,user/avatar,user/description,user/joinDate,user/location,user/totalFollowers,user/totalFollowing,user/totalLikes,user/totalTweets,user/url,user/userFullName,user/username,user/verified,user/website,username,verified
,,1475636362195849217,https://pbs.twimg.com/media/FHqDcQAVkAAkf5R.jpg,,,,False,False,3,https://twitter.com/RGIAHyd,https://twitter.com/search?q=%23Delhi,https://twitter.com/vkmrao41,https://twitter.com/search?q=%23TSBC,https://twitter.com/NCBC_INDIA,,,,,,,,,,,,,,,,,,,,,,,,,,,,,,,,,,,,,,,,,,0,0,1,Masters,enough electors necessary lawmakers otherwise lawmakers masters electors ambedkar travelling delhi along chairman tube meet chairman,2021-12-28T01:14:00.000Z,https://twitter.com/srinu1966/status/1475636362195849217,https://pbs.twimg.com/profile_images/1667748500225019904/_2cPsLhX.jpg,OSD to Former Union Civil Aviation Minister Govt of India.Did Post graduation in Journalism and Law from Osmania University and love to be a global citizen.,2010-01-04T11:41:00.000Z,"Hyderabad, India",916,3538,12460,10613,https://twitter.com//srinu1966,NOMULA SRINIVAS RAO,@srinu1966,True,facebook.com/nomula.rao.7/,,True
,,1472472443956596737,,,,,False,False,1,,,,,,,,,,,,,,,,,,,,,,,,,,,,,,,,,,,,,,,,,,,,,,,0,1,0,Masters,chicago typewriter hear voice inspector koo lawless lawyer mad mystic pop bar search sisyphus myth masters sun tale nod,2021-12-19T07:42:00.000Z,https://twitter.com/prasanth_ro45/status/1472472443956596737,https://pbs.twimg.com/profile_images/1732059653423689728/w4dJJ4dX.jpg,"Korean Dramas 😍
Mahesh Babu ❤️
Rohit Sharma 🥰
Ji Chang wook 🫰
Love traveling 🌍
mydramalist.com/profile/8908…",2011-08-10T13:32:00.000Z,KDrama - 179 Kmovie - 70,1025,376,53395,27218,https://twitter.com//prasanth_ro45,Chingu,@prasanth_ro45,False,,,False
,,1474754971631423489,,,,,False,False,1,,,,,,,,,,,,,,,,,,,,,,,,,,,,,,,,,,,,,,,,,,,,,,,0,0,0,Masters,amazing jealous lol love last year got jurassic world lego set helicopter raptor watch lego masters,2021-12-25T14:52:00.000Z,https://twitter.com/harshitdave/status/1474754971631423489,https://pbs.twimg.com/profile_images/1588464001570459652/-xp9ldro.jpg,"Father, Family man, Artist 
Featured by @photoshop on IG.
5 SOLD OUT series

FND - foundation.app/@harshitdave
KO - knownorigin.io/harshitdave",2009-07-30T03:06:00.000Z,India,19799,1385,229864,161495,https://twitter.com//harshitdave,Harshit Dave,@harshitdave,True,harshitdave.eth.co,,True
,,1470470023948947461,https://pbs.twimg.com/media/FGgodzHXoAgUpr9.jpg,,,,False,False,41,http://M.Sc,https://twitter.com/search?q=%23लीडर,https://twitter.com/search?q=%23AmbedkarInLondon,https://twitter.com/search?q=%23SujatAmbedkar,,,,,,,,,,,,,,,,,,,,,,,,,,,,,,,,,,,,,,,,,,,0,0,9,Masters,congratulations suit ambedkar masters mic election campaign democracy royal holloway university london ambedkarinlondon sujatambedkar,2021-12-13T19:05:00.000Z,https://twitter.com/Aakshay_Bansode/status/1470470023948947461,https://pbs.twimg.com/profile_images/1728689570005598208/eBjmTi2x.jpg,"| State Member Yuva @VBAforIndia |  | Law Student @Uni_Mumbai | Avid Reader | Anti-Caste | He/Him

Instagram: instagram.com/p/CetbBq4jpuH/…",2016-01-31T02:27:00.000Z,"Nanded-Waghala, India",5025,934,12572,5546,https://twitter.com//Aakshay_Bansode,Aakshay Bansode,@Aakshay_Bansode,True,,,True
,,1470635835854766083,https://pbs.twimg.com/media/FGi_f4GVUAI5li8.jpg,,,,False,False,36,https://twitter.com/search?q=%23USICON2022,https://twitter.com/OTRAXER,https://twitter.com/sbinhamrii,https://twitter.com/drganpuleuro,https://twitter.com/drragoori,https://twitter.com/drharprit,https://twitter.com/UroZedman,https://twitter.com/YouthUSI,https://twitter.com/DrPKandarp,,,,,,,,,,,,,,,,,,,,,,,,,,,,,,,,,,,,,,3,6,14,Masters,usicon2022 ahmedabad endourology session with jan 1400 1700 ist experience cross fire learn tricks hear masters innovations black pearls,2021-12-14T06:04:00.000Z,https://twitter.com/usioffice/status/1470635835854766083,https://pbs.twimg.com/profile_images/838649560499019778/Ko4IK_GB.jpg,The official Twitter handle of The Urological society of India !,2017-03-06T07:06:00.000Z,New Delhi,3042,337,710,388,https://twitter.com//usioffice,Urological Society of India 🇮🇳,@usioffice,False,usi.org.in,,False
,,1464215426754220036,https://pbs.twimg.com/media/FFHwKuMVkAI3mAa.jpg,,,,False,False,8,https://twitter.com/sardesairajdeep,https://twitter.com/BJYM,,,,,,,,,,,,,,,,,,,,,,,,,,,,,,,,,,,,,,,,,,,,,0,0,2,Masters,another day life halal habitual offender going overly crazy every sniff masters movement youd wondering keeps night answer,2021-11-26T12:52:00.000Z,https://twitter.com/SolankySrinivas/status/1464215426754220036,https://pbs.twimg.com/profile_images/1575752260969467904/0aDiq8ZB.jpg,Official Spokesperson - @BJP4Telangana | National Executive Member - @BJYM | Incharge Tamilnadu - @BJYMinTN | Proud Swayamsevak | Karyakarta @ABVPVoice,2016-12-10T16:39:00.000Z,"Bhagyanagar, Telangana",1687,90,3541,4968,https://twitter.com//SolankySrinivas,Dr.B.L.Sreenivas Solanky,@SolankySrinivas,True,facebook.com/Dr.SolankySreen…,,True
,,1470636790860042240,https://pbs.twimg.com/media/FGjAW-sVEAAC6sH.jpg,https://pbs.twimg.com/media/FGjAXOeUUAAtBYo.jpg,https://pbs.twimg.com/media/FGjAXdmUYAAG2Yx.jpg,,False,False,4,https://twitter.com/search?q=%23HappyHyderabad,https://twitter.com/search?q=%23swimming,https://twitter.com/HiHyderabad,,,,,,,,,,,,,,,,,,,,,,,,,,,,,,,,,,,,,,,,,,,,0,1,0,Masters,happyhyderabad swimming wishes best luck mars queen victoria mars queen came with ski masters mars queen gives best eligible japan going held 2022 world master games,2021-12-14T06:08:00.000Z,https://twitter.com/happy_hyderabad/status/1470636790860042240,https://pbs.twimg.com/profile_images/1403755927891636227/QKtC3bWn.jpg,"#HappyHyderabad is #Cycling Group aimed Promote Cycling  #Happiness ❤ #Hyderabad
 #Running #volleyball #badminton #bookclubs  #volunteering
9701744814",2021-06-12T16:43:00.000Z,"Hyderabad, India",1093,474,6863,2677,https://twitter.com//happy_hyderabad,🇮🇳 HappyHyderabad,@happy_hyderabad,False,,,False
,,1467455703405133825,,,,,False,False,0,,,,,,,,,,,,,,,,,,,,,,,,,,,,,,,,,,,,,,,,,,,,,,,0,0,0,Masters,many aspects dont like nizam three important times supported british one anglo more war 1790s tip sultan 1857 revolt masters mughals empire third one world war send army ottoman empire,2021-12-05T11:27:00.000Z,https://twitter.com/MuhammadArifAli/status/1467455703405133825,https://pbs.twimg.com/profile_images/1619238349415530496/J7XYdka_.jpg,"Practicing Advocate @ Civil, Criminal, High Court for the state of Telangana & Family Court 👨‍⚖️",2017-04-29T02:03:00.000Z,"Hyderabad, India",1525,38,18283,13380,https://twitter.com//MuhammadArifAli,Advocate Mohd Arif وکیل محمد عارف ( B.A.L.L.B ),@MuhammadArifAli,False,instagram.com/mohammedarifal…,,False
,,1463425736614682628,,,,,False,False,0,,,,,,,,,,,,,,,,,,,,,,,,,,,,,,,,,,,,,,,,,,,,,,,0,0,0,Masters,use always welcomed masters cabinet minister journalist,2021-11-24T08:34:00.000Z,https://twitter.com/KaleemS9/status/1463425736614682628,https://pbs.twimg.com/profile_images/1730685442356641792/F5i5OIw4.jpg,Babri Masjid,2011-12-01T04:43:00.000Z,حیدرآباد فرخندہ بنیاد,688,32,52849,59520,https://twitter.com//KaleemS9,बेरोजगार भारत,@KaleemS9,False,,,False
,,1467362831037190147,,,,,False,False,0,,,,,,,,,,,,,,,,,,,,,,,,,,,,,,,,,,,,,,,,,,,,,,,0,0,0,Masters,religion imposed colonial masters racist exploitative suppressive centuries islam solution race caste class problem whatsoever propaganda white christian europeans islam fastest growing religion world,2021-12-05T05:18:00.000Z,https://twitter.com/mferozkhan19/status/1467362831037190147,https://pbs.twimg.com/profile_images/1346352779804041217/F1WbaeGH.jpg,,2013-04-02T06:31:00.000Z,,84,399,6871,23277,https://twitter.com//mferozkhan19,Hamza bin Hamid,@mferozkhan19,False,,,False
,,1463172062466486278,https://pbs.twimg.com/media/FE47PF2XIBMiycz.jpg,,,,False,False,0,https://twitter.com/SGanguly99,https://twitter.com/virendersehwag,https://twitter.com/BCCI,https://twitter.com/MFA_SriLanka,https://twitter.com/RealCricket20,,,,,,,,,,,,,,,,,,,,,,,,,,,,,,,,,,,,,,,,,,0,1,0,Masters,india masters mass innings india masters srilanka masters 200 overs 4154 22761 14944,2021-11-23T15:46:00.000Z,https://twitter.com/SaiKumarPower7/status/1463172062466486278,https://pbs.twimg.com/profile_images/1698013651108802560/x3q0HT4f.jpg,✊,2018-12-07T09:57:00.000Z,"Hyderabad, India",643,554,6699,44555,https://twitter.com//SaiKumarPower7,Sai Kumar Power,@SaiKumarPower7,False,,,False
,,1463834846996807690,https://pbs.twimg.com/media/FFCWB3tVEAQOtgE.jpg,,,,False,False,45,https://twitter.com/HyderabadMetro,https://twitter.com/narendramodi,,,,,,,,,,,,,,,,,,,,,,,,,,,,,,,,,,,,,,,,,,,,,0,3,6,Masters,meet priya played football masters mechanical engineering fascinated pillars came made company went extensive training pilot inaugural service aboard promotion,2021-11-25T11:39:00.000Z,https://twitter.com/Andrew007Uk/status/1463834846996807690,https://pbs.twimg.com/profile_images/1503614640982437889/OTIHecnZ.jpg,"Diplomat: Dy. High Commissioner to East & N.E. 🇮🇳, ex 🇺🇬🇬🇭🇳🇬.
#Traveller 👀 117 lands & 870 ⚽ 🏟 #Foodie #Dad #MillwallFC #DisabilityChampion, own views",2015-12-09T19:52:00.000Z,Kolkata,48210,2679,95303,68776,https://twitter.com//Andrew007Uk,Dr Andrew Fleming 🇬🇧 🏴󠁧󠁢󠁳󠁣󠁴󠁿,@Andrew007Uk,False,gov.uk/government/people/and…,,False
,,1462405062550904834,https://pbs.twimg.com/media/FEuBpN9VEAQI0Qv.jpg,,,,False,False,2,,,,,,,,,,,,,,,,,,,,,,,,,,,,,,,,,,,,,,,,,,,,,,,0,0,1,Masters,you looking perfect opportunity settle career industry search ends right join careerchanging full stack web development masters program powered infochord technologies put led contact 918099636946,2021-11-21T12:58:00.000Z,https://twitter.com/ravirajgir/status/1462405062550904834,https://pbs.twimg.com/profile_images/714325574097965056/bMs-G6KA.jpg,Founder & CEO At Infochord Technologies Pvt. Ltd.,2011-03-03T20:56:00.000Z,Hyderabad,253,236,872,1224,https://twitter.com//ravirajgir,RAVI SHANKAR KUMAR,@ravirajgir,False,infochord.com,,False
,,1457757677807751168,,,,,False,False,0,,,,,,,,,,,,,,,,,,,,,,,,,,,,,,,,,,,,,,,,,,,,,,,0,0,0,Masters,rationale convincing masters lakh crore printed ready across border unfortunately didn time cash moms masters introduced serial currency fbi,2021-11-08T17:11:00.000Z,https://twitter.com/kvgreddy/status/1457757677807751168,https://pbs.twimg.com/profile_images/515237048064557056/pCLgcXS-.jpeg,,2009-11-24T10:51:00.000Z,Hyderabad India,27,60,368,1029,https://twitter.com//kvgreddy,KV Gopal Reddy,@kvgreddy,False,,,False
,,1454612867001438216,,,,,False,False,0,,,,,,,,,,,,,,,,,,,,,,,,,,,,,,,,,,,,,,,,,,,,,,,0,0,0,Masters,know cousins bought masters medical seats ocr paid pass exam amen,2021-10-31T00:55:00.000Z,https://twitter.com/bhsriram/status/1454612867001438216,https://pbs.twimg.com/profile_images/3129797346/5bd083b678e7bbc9396a1d447e05a33e.jpeg,"Anthropologist, Art/Culture Enthusiast, Carnatic Fan

Ex:Traveler,Kuchipudi Student, Runner, Cyclist, MBA.

Alumnus: UoHyd, IIT-H.

AndhraBornConfusedDesi",2009-04-19T04:41:00.000Z,"Hyderabad, India",782,1398,18169,14944,https://twitter.com//bhsriram,Ram Bhupathiraju,@bhsriram,False,,,False
,,1426443316900483073,,,,,False,False,0,,,,,,,,,,,,,,,,,,,,,,,,,,,,,,,,,,,,,,,,,,,,,,,0,0,0,Undergrad,ditto already biotech undergrad program book sealed deal,2021-08-14T07:19:00.000Z,https://twitter.com/aartvi42/status/1426443316900483073,https://pbs.twimg.com/profile_images/934464851119763456/E0y7SlJs.jpg,"Researcher (RNA (reagents, expression, aptamers), Rare diseases, tech platforms, hands-on PI). Traveller, Mom and DIY-enthusiast. Tweets my own.",2011-07-18T06:22:00.000Z,"Hyderabad, India",122,434,4216,2109,https://twitter.com//aartvi42,Aarti Sevilimedu,@aartvi42,False,adviaa.wordpress.com/,,False
https://pbs.twimg.com/profile_images/515237048064557056/pCLgcXS-.jpeg,KV Gopal Reddy,1447651705277980673,,,,,False,False,0,,,,,,,,,,,,,,,,,,,,,,,,,,,,,,,,,,,,,,,,,,,,,,,0,0,0,Masters,true keep dreaming happen masters never come back power,2021-10-11T19:53:00.000Z,https://twitter.com/kvgreddy/status/1447651705277980673,https://pbs.twimg.com/profile_images/515237048064557056/pCLgcXS-.jpeg,,2009-11-24T10:51:00.000Z,Hyderabad India,27,60,368,1029,https://twitter.com//kvgreddy,KV Gopal Reddy,@kvgreddy,False,,@kvgreddy,False
,,1419290797824937985,https://pbs.twimg.com/media/E7JVb2TVEAkkawe.jpg,https://pbs.twimg.com/media/E7JVcQOVoAIkWU9.jpg,https://pbs.twimg.com/media/E7JVcs_VcAEFuwg.jpg,https://pbs.twimg.com/media/E7JVdGpUUA48NE8.jpg,False,False,4,https://twitter.com/search?q=%23gurupurnima,https://twitter.com/search?q=%23backtolab,https://twitter.com/search?q=%23Covid_19,https://twitter.com/search?q=%23chemistrylab,https://twitter.com/search?q=%23organicsynthesis,https://twitter.com/search?q=%23sustainablechemistry,https://twitter.com/search?q=%23womeninscience,https://twitter.com/search?q=%23phdlife,https://twitter.com/search?q=%23phdresearch,https://twitter.com/search?q=%23graduateschool,https://twitter.com/IITHyderabad,,,,,,,,,,,,,,,,,,,,,,,,,,,,,,,,,,,,0,1,0,Undergrad,happy gurupurnima pleased see graduate undergrad students backtolab challenging times and wave covid19 chemistrylab organicsynthesis sustainablechemistry lab womeninscience midlife phdresearch graduateschool,2021-07-25T13:37:00.000Z,https://twitter.com/MolE_Lab_OhMEGA/status/1419290797824937985,https://pbs.twimg.com/profile_images/1462820138609111040/iLLeVDNH.jpg,"Molecular Eng. Lab. Organic/Hybrid Materials for Energy Applications| Professor Green Energy Technology, @PondiUnivPro | Former Prof. in Chemistry @IITHyderabad",2014-06-04T07:13:00.000Z,"Pondicherry, India",505,1705,933,575,https://twitter.com//MolE_Lab_OhMEGA,Sharada,@MolE_Lab_OhMEGA,False,pondiuni.edu.in/faculy_profi…,,False
,,1455843532481056781,,,,,True,False,0,https://twitter.com/search?q=%23Kashmir,,,,,,,,,,,,,,,,,,,,,,,,,,,,,,,,,,,,,,,,,,,,https://twitter.comnull,,0,0,0,Masters,kashmir read decide masters,2021-11-03T10:25:00.000Z,https://twitter.com/RamMaravajhala/status/1455843532481056781,https://pbs.twimg.com/profile_images/1631736414596657152/wWi8PZI9.jpg,"Proud Hindu, proud Indian  🇮🇳 movie buff, cycling",2010-05-23T11:30:00.000Z,India,261,702,20811,22915,https://twitter.com//RamMaravajhala,Ram Maravajhala,@RamMaravajhala,False,,,False
,,1476420140648386560,,,,,False,False,1,,,,,,,,,,,,,,,,,,,,,,,,,,,,,,,,,,,,,,,,,,,,,,,0,1,0,School,many uru medium govt schools closed old city one bothers either,2021-12-30T05:09:00.000Z,https://twitter.com/PVSIVAKUMAR1/status/1476420140648386560,https://pbs.twimg.com/profile_images/1708477149513129984/epNKhTI2.jpg,Former Photo Journalist -at Indian Express(1985-1993) & The Hindu ( 1993-2015) Hyderabadi since 1971,2012-05-12T15:55:00.000Z,"Hyderabad, India",2405,1471,51156,49381,https://twitter.com//PVSIVAKUMAR1,P.V.SIVAKUMAR 🇮🇳,@PVSIVAKUMAR1,False,,,False
,,1476837874469277697,,,,,False,False,0,,,,,,,,,,,,,,,,,,,,,,,,,,,,,,,,,,,,,,,,,,,,,,,0,0,0,School,plus read class school numbers,2021-12-31T08:49:00.000Z,https://twitter.com/PANDARAJATH/status/1476837874469277697,https://pbs.twimg.com/profile_images/1685841859678220289/3Bbbh3ce.jpg,,2010-05-03T21:30:00.000Z,,681,1036,22384,15961,https://twitter.com//PANDARAJATH,Rajat Panda,@PANDARAJATH,False,,,False
,,1477009723123658759,,,,,False,False,0,,,,,,,,,,,,,,,,,,,,,,,,,,,,,,,,,,,,,,,,,,,,,,,0,0,0,School,since iam single school still iam searching life partner 2022 mae single problem lab solve hog yeh,2021-12-31T20:12:00.000Z,https://twitter.com/akbar08755/status/1477009723123658759,https://pbs.twimg.com/profile_images/1731355707851898880/glRNUIT7.jpg,"🤗allah ham sabki hifazat kare🤗
😇 Alhamdulillah",2019-10-11T14:29:00.000Z,"Hyderabad, India",40,397,6681,801,https://twitter.com//akbar08755,Mohd akbar,@akbar08755,False,,,False
,,1476513335851974656,https://pbs.twimg.com/media/FH2g_6bVEAEaBOq.jpg,https://pbs.twimg.com/media/FH2hBC7UUAAXIv3.jpg,https://pbs.twimg.com/media/FH2hCGRVEAMbvoR.jpg,https://pbs.twimg.com/media/FH2hDUUUcAAh4UC.jpg,False,False,6,https://twitter.com/search?q=%23AndhraPradesh,,,,,,,,,,,,,,,,,,,,,,,,,,,,,,,,,,,,,,,,,,,,,,0,0,1,School,distribution dry ration kits persons disabilities benevolent support ski card peel sasha sea volunteers andhrapradesh plant siddharth residential school duttalur manual spur deplore district,2021-12-30T11:19:00.000Z,https://twitter.com/SAKSHAM4Divyang/status/1476513335851974656,https://pbs.twimg.com/profile_images/1341194160573874177/hCxLVxpt.jpg,"Samadrishti, Kshamata Vikas Evam Anusandhan Mandal (SAKSHAM) is a charitable, non government, non profittable national organization for Divyangjan.",2020-12-22T01:15:00.000Z,"Nagpur, India",290,13,2402,2408,https://twitter.com//SAKSHAM4Divyang,SAKSHAM SEVA,@SAKSHAM4Divyang,False,,,False
,,1476836217375248386,,,,,False,False,4,https://twitter.com/search?q=%23COVID19,,,,,,,,,,,,,,,,,,,,,,,,,,,,,,,,,,,,,,,,,,,,,,0,1,0,School,school asking send kids offline said one covid19 affected girl school asking offline participants test,2021-12-31T08:42:00.000Z,https://twitter.com/PANDARAJATH/status/1476836217375248386,https://pbs.twimg.com/profile_images/1685841859678220289/3Bbbh3ce.jpg,,2010-05-03T21:30:00.000Z,,681,1036,22384,15961,https://twitter.com//PANDARAJATH,Rajat Panda,@PANDARAJATH,False,,,False
https://pbs.twimg.com/profile_images/1708477149513129984/epNKhTI2.jpg,P.V.SIVAKUMAR 🇮🇳,1476110331621478405,,,,,False,False,0,,,,,,,,,,,,,,,,,,,,,,,,,,,,,,,,,,,,,,,,,,,,,,,0,0,0,School,colony nearby little children roam roads forgotten school long ago surely must case loyalties slums sad story post pandemic education india,2021-12-29T08:38:00.000Z,https://twitter.com/PVSIVAKUMAR1/status/1476110331621478405,https://pbs.twimg.com/profile_images/1708477149513129984/epNKhTI2.jpg,Former Photo Journalist -at Indian Express(1985-1993) & The Hindu ( 1993-2015) Hyderabadi since 1971,2012-05-12T15:55:00.000Z,"Hyderabad, India",2405,1471,51156,49381,https://twitter.com//PVSIVAKUMAR1,P.V.SIVAKUMAR 🇮🇳,@PVSIVAKUMAR1,False,,@PVSIVAKUMAR1,False
,,1476208229457678336,,,,,False,False,0,,,,,,,,,,,,,,,,,,,,,,,,,,,,,,,,,,,,,,,,,,,,,,,0,0,0,School,dont need liquor scheme need quality roads good govt schools almost states reduce vat petrolwhy didn't state reduce vat petrol,2021-12-29T15:07:00.000Z,https://twitter.com/NAGA14949367/status/1476208229457678336,https://abs.twimg.com/sticky/default_profile_images/default_profile.png,,2020-09-11T15:21:00.000Z,,0,35,12,82,https://twitter.com//NAGA14949367,NAGA,@NAGA14949367,False,,,False
,,1476192864115707904,,,,,False,False,0,https://twitter.com/AgerwalNidhhi,https://twitter.com/search?q=%23AskNidhhi,,,,,,,,,,,,,,,,,,,,,,,,,,,,,,,,,,,,,,,,,,,,,0,0,0,School,completed school maam asknidhhi,2021-12-29T14:06:00.000Z,https://twitter.com/Israelp21721605/status/1476192864115707904,https://pbs.twimg.com/profile_images/1592697268767186944/eI3aMl92.jpg,Don't wait the perfect moment😊😊...take the moment And make it perfect.✌😉,2020-03-26T04:23:00.000Z,"Secunderabad, Hyderabad",26,339,169,153,https://twitter.com//Israelp21721605,Israelprince,@Israelp21721605,False,,,False
,,1475475195993501700,,,,,False,False,5,https://twitter.com/HydUniv,http://acad.uohyd.ac.in/eephdjan22.html,,,,,,,,,,,,,,,,,,,,,,,,,,,,,,,,,,,,,,,,,,,,,0,0,2,phd,equally excited motivated look endolysosomal trafficking neuronal health disease apply pod program join,2021-12-27T14:34:00.000Z,https://twitter.com/tamminenilab/status/1475475195993501700,https://pbs.twimg.com/profile_images/1304674756537364481/gk_5LlQU.jpg,We study how neurons handle proteins aggregates and dysfunctional organelles and apply these principles to understand Neurodegeneration.,2020-09-08T06:35:00.000Z,"University of Hyderabad, India",382,381,665,536,https://twitter.com//tamminenilab,Tamminenilab,@tamminenilab,False,sls.uohyd.ac.in/new/fac_deta…,,False
,,1476432290997620739,,,,,False,False,7,,,,,,,,,,,,,,,,,,,,,,,,,,,,,,,,,,,,,,,,,,,,,,,0,0,0,School,didn't felt school college experienced office saying something pawn alan sir whole office looking,2021-12-30T05:57:00.000Z,https://twitter.com/Satya_Nandikola/status/1476432290997620739,https://pbs.twimg.com/profile_images/1614812462842548229/8f01jYu1.jpg,,2013-07-30T05:47:00.000Z,,32,154,3654,2369,https://twitter.com//Satya_Nandikola,శివయ్యనాయుడు గారి అబ్బాయ్,@Satya_Nandikola,False,,,False
,,1476125999574106115,https://pbs.twimg.com/media/FHxAxL7VcAYZVJZ.jpg,,,,False,False,5,http://bit.ly/3z6mzcx,https://twitter.com/search?q=%23music,https://twitter.com/search?q=%23passion,https://twitter.com/search?q=%23journey,https://twitter.com/search?q=%23Inspire,https://twitter.com/search?q=%23hyderabad,https://twitter.com/search?q=%23humansofhyderabad,,,,,,,,,,,,,,,,,,,,,,,,,,,,,,,,,,,,,,,,0,0,3,School,started singing school used actively participate cultural activities however never thought singing could one careers life full story bitly3z6mzcx music passion journey inspire hyderabad humansofhyderabad,2021-12-29T09:40:00.000Z,https://twitter.com/HumansofHyd/status/1476125999574106115,https://pbs.twimg.com/profile_images/1178562426083504128/vUSjbsHa.jpg,HOH is an attempt to create a photographic census of the city in the best possible way with the help of quotes & short stories from people across the city.,2016-04-07T10:29:00.000Z,"Hyderabad, India",2077,5,149,2424,https://twitter.com//HumansofHyd,Humans of Hyderabad,@HumansofHyd,True,humansofhyderabad.co.in,,True
,,1476074696206471170,,,,,False,False,0,,,,,,,,,,,,,,,,,,,,,,,,,,,,,,,,,,,,,,,,,,,,,,,0,0,0,phd,pod passing heavy difficulty lab lords last benches one uncles gave funny acronyms,2021-12-29T06:16:00.000Z,https://twitter.com/esesve/status/1476074696206471170,https://pbs.twimg.com/profile_images/705337550588645376/NRijAcD9.jpg,"Business Leader, Identity (IAM) & InfoSec always close to heart; TechnoEnthusiast; A Leo; Founder of ENH group of Organizations",2007-12-14T19:13:00.000Z,"Hyderabad, Andhra Pradesh",332,546,1993,1999,https://twitter.com//esesve,Esesve Digumarthi,@esesve,False,esesve.blogspot.com,,False
,,1466802765988958216,,,,,False,False,1,,,,,,,,,,,,,,,,,,,,,,,,,,,,,,,,,,,,,,,,,,,,,,,0,0,0,phd,genius idea emma steal get teaching pod although thats,2021-12-03T16:13:00.000Z,https://twitter.com/DevinaSarwatay/status/1466802765988958216,https://pbs.twimg.com/profile_images/1543615198724243456/Up25fBqY.jpg,I study young people and digital cultures,2014-06-30T16:42:00.000Z,"Hyderabad, India",1640,5001,30987,21924,https://twitter.com//DevinaSarwatay,Devina Sarwatay,@DevinaSarwatay,False,linkedin.com/pub/devina-sarw…,,False
,,1467753053801508864,https://pbs.twimg.com/media/FF51KCRVEAAeCeQ.jpg,,,,True,False,7,https://twitter.com/search?q=%23BJP,,,,,,,,,,,,,,,,,,,,,,,,,,,Mahesh⚪🇮🇳,https://pbs.twimg.com/media/FF51KCRVEAAeCeQ.jpg,,,,,,,,,,,,,,"మనం చేసినవి చెప్పుకోడానికి ఏమీ లేనపుడు ఇలా పక్క వాళ్ళవి కాపీ కొట్టి మనవి అని చెప్పుకోవాలి, అదే మ్యాజిక్కు",2021-12-06T06:15:00.000Z,https://twitter.com/Maheshpatil975/status/1467739346895663104,@Maheshpatil975,0,1,0,phd,snickering propagandajoomla giovanni bop vaatu university pod chesaaru,2021-12-06T07:09:00.000Z,https://twitter.com/trs_sandy/status/1467753053801508864,https://pbs.twimg.com/profile_images/1554647407626838016/2zKKgjMB.jpg,#TelanganaWithKCR #TRSism #ScottCycling #BergamontMyFirstCrush #CyclingMyPassion #EnduranceRider #HomeChef #ResetHyderabadWithCycling,2009-09-08T06:17:00.000Z,Hyderabad,1961,1789,72405,17828,https://twitter.com//trs_sandy,Sandeep,@trs_sandy,False,,,False
,,1468435998568697859,,,,,True,False,11,https://twitter.com/ajay_duseja,https://twitter.com/docMPK,https://twitter.com/BawejaSukriti,https://twitter.com/DivyaKumar182,https://twitter.com/TejSowpati,https://twitter.com/savykaur3,https://twitter.com/vikasverma20,https://twitter.com/AshishKumarVya1,https://twitter.com/search?q=%23livertwitter,,,,,,,,,,,,,,,,,,,Petra Hirsova,,,,https://twitter.com/search?q=%23postdoc,https://jobs.mayoclinic.org/job/rochester/research-fellow-gastroenterology/33647/19510896496,,,,,,,,,,"It’s official! We are hiring for a #postdoc position. More info 👇

jobs.mayoclinic.org/job/roch…",2021-12-07T01:11:00.000Z,https://twitter.com/PetraHirsova/status/1468025463977263108,@PetraHirsova,0,4,2,phd,tagging great pod mentors india livertwitter,2021-12-08T04:23:00.000Z,https://twitter.com/AnandVKulkarni2/status/1468435998568697859,https://pbs.twimg.com/profile_images/1373337341725528064/OW8rlCs1.jpg,Hepatologist @ Asian Institute of Gastroenterology.,2016-04-28T00:07:00.000Z,"Hyderabad, India",2984,2529,10671,3577,https://twitter.com//AnandVKulkarni2,Anand V Kulkarni,@AnandVKulkarni2,False,,,False
