avatar,fullname,id,images/0,images/1,images/2,images/3,isQuote,isRetweet,likes,links/0,links/1,links/2,links/3,links/4,links/5,links/6,links/7,links/8,links/9,links/10,links/11,links/12,links/13,links/14,links/15,links/16,links/17,links/18,links/19,links/20,links/21,links/22,links/23,links/24,links/25,quotedTweet/avatar,quotedTweet/fullname,quotedTweet/images/0,quotedTweet/images/1,quotedTweet/images/2,quotedTweet/links/0,quotedTweet/links/1,quotedTweet/links/2,quotedTweet/links/3,quotedTweet/links/4,quotedTweet/links/5,quotedTweet/links/6,quotedTweet/links/7,quotedTweet/links/8,quotedTweet/links/9,quotedTweet/links/10,quotedTweet/text,quotedTweet/timestamp,quotedTweet/url,quotedTweet/username,quotes,replies,retweets,searchQuery,text,timestamp,url,user/avatar,user/description,user/joinDate,user/location,user/totalFollowers,user/totalFollowing,user/totalLikes,user/totalTweets,user/url,user/userFullName,user/username,user/verified,user/website,username,verified
,,1455120609067757572,,,,,False,False,5,,,,,,,,,,,,,,,,,,,,,,,,,,,,,,,,,,,,,,,,,,,,,,,0,2,0,exams,remember entering building climbing steps walking across dunbar hall first class morning many cultural programs college held hall regular participant even exams held,2021-11-01T10:32:00.000Z,https://twitter.com/Ilovehyderabad/status/1455120609067757572,https://pbs.twimg.com/profile_images/1724387234202443776/04aPfe_2.jpg,"Singer,Social activist.I cannot tolerate corruption and injustice. Heritage activist. Trainer in perfect Bengali pronunciation, lover of good cinema.",2010-09-22T14:57:00.000Z,Hyderabad,1787,315,41320,65475,https://twitter.com//Ilovehyderabad,Sanghamitra Malik,@Ilovehyderabad,False,nitter.net,,False
,,1465584862761406466,,,,,False,False,3,https://twitter.com/osmania1917,https://twitter.com/Osmania_Univ,https://twitter.com/TelanganaCMO,https://twitter.com/TelanganaCOPs,https://twitter.com/TelanganaDGP,,,,,,,,,,,,,,,,,,,,,,,,,,,,,,,,,,,,,,,,,,0,1,1,exams,mania sem exams haha,2021-11-30T07:33:00.000Z,https://twitter.com/laxmikanthchou7/status/1465584862761406466,https://pbs.twimg.com/profile_images/1418390822240677890/BWiW60Um.png,,2021-07-23T02:01:00.000Z,,0,3,3,105,https://twitter.com//laxmikanthchou7,laxmikanth choubey,@laxmikanthchou7,False,,,False
,,1465166011343245314,,,,,False,False,0,https://twitter.com/aks_ias,https://www.instagram.com/p/CW2GONlpL2I/?utm_medium=twitter,,,,,,,,,,,,,,,,,,,,,,,,,,,,,,,,,,,,,,,,,,,,,0,0,0,exams,want crack ups civil services exam join right guidance hyderabad,2021-11-29T03:49:00.000Z,https://twitter.com/aks_ias/status/1465166011343245314,https://pbs.twimg.com/profile_images/1295079007700922373/8uZk1qml.jpg,AKS IAS - India’s leading Institution for Competitive Examinations,2020-08-16T19:23:00.000Z,"Hyderabad, India",99,57,2,514,https://twitter.com//aks_ias,AKS IAS,@aks_ias,False,aksias.com,,False
,,1472888046395609088,,,,,False,False,53,https://twitter.com/search?q=%23CBI,https://twitter.com/TelanganaHealth,https://twitter.com/trsharish,https://twitter.com/drgsrao,https://twitter.com/MoHFW_INDIA,,,,,,,,,,,,,,,,,,,,,,,,,,,,,,,,,,,,,,,,,,4,2,54,college,complained cbi irregularities purchasing medicinespostings transfers promotions commissioner vidya vivian principal gandhi medical college posts ramesh ready,2021-12-20T11:14:00.000Z,https://twitter.com/zson_bakka/status/1472888046395609088,https://pbs.twimg.com/profile_images/1627572401755291648/H5JF0-Eo.jpg,Average Congress Leader,2011-12-03T10:49:00.000Z,Wardhannapet,2114,84,5843,4858,https://twitter.com//zson_bakka,Judson Bakka Official,@zson_bakka,False,,,False
,,1456211610129690632,,,,,False,False,0,https://www.instagram.com/p/CV2A5wJpilm/?utm_medium=share_sheet,,,,,,,,,,,,,,,,,,,,,,,,,,,,,,,,,,,,,,,,,,,,,,0,0,0,exams,request everyone please pray days board exams results going come may allah pass exams good marks good grades amen,2021-11-04T10:47:00.000Z,https://twitter.com/MOHAMMA68626066/status/1456211610129690632,https://pbs.twimg.com/profile_images/1492082103219265537/Q-cv3qRd.jpg,"cricket lover 🏏
Favourite ipl team RCB 🔥✌️",2021-01-05T09:24:00.000Z,,47,3147,415,1471,https://twitter.com//MOHAMMA68626066,MD ABDUL RAZZAK,@MOHAMMA68626066,False,,,False
,,1455085321939349507,,,,,False,False,24,https://twitter.com/tsrtcmdoffice,https://twitter.com/TSRTCHQ,,,,,,,,,,,,,,,,,,,,,,,,,,,,,,,,,,,,,,,,,,,,,0,1,1,exams,exam completed sir since minutes erragadda buses sir borabanda please increase buses borabanda sir,2021-11-01T08:12:00.000Z,https://twitter.com/itsashwaan7/status/1455085321939349507,https://pbs.twimg.com/profile_images/1296683667117371392/fGfG9DRF.jpg,😀Official Account 🏨Hyderabadi❤️ @beingsalmankhan Fan 😁 Retweets are not endorsement,2018-04-25T13:42:00.000Z,"Hyderabad, India",73,275,29788,3044,https://twitter.com//itsashwaan7,Mohammad Ashwaan,@itsashwaan7,False,,,False
,,882820774868000768,https://pbs.twimg.com/media/DEBlRxEWsAESI81.jpg,,,,False,False,1,https://twitter.com/search?q=%23RKUFaculty,https://twitter.com/search?q=%23CyberJournalism,https://twitter.com/search?q=%23PGDiploma,,,,,,,,,,,,,,,,,,,,,,,,,,,,,,,,,,,,,,,,,,,,0,0,0,Post Graduate,suntan bhattacharyajee journalism postgraduate symbiosis institute media communication rkufaculty cyberjournalism diploma,2017-07-06T04:37:00.000Z,https://twitter.com/ramojikrianuni/status/882820774868000768,https://pbs.twimg.com/profile_images/849591698199937024/5XpyH4yQ.jpg,"A prospective institute of excellence aspiring to redefine media, design and management education in India; Ramoji Krian University is still a work in progress.",2017-04-05T11:52:00.000Z,"Hyderabad, India",270,539,7,504,https://twitter.com//ramojikrianuni,Ramoji Krian Uni,@ramojikrianuni,False,rku.net.in,,False
https://pbs.twimg.com/profile_images/1706021673370361856/SBRN0uI9.jpg,Amjed Ullah Khan MBT,1452489361522446336,,,,,False,False,109,https://twitter.com/ktrtrs,,,,,,,,,,,,,,,,,,,,,,,,,,,,,,,,,,,,,,,,,,,,,,3,7,29,exams,sirreceiving lot complaints intermediate students given hall tickets college management due nonpayment fees denied writing annual examsthis criminal act damaging academic year student,2021-10-25T04:17:00.000Z,https://twitter.com/amjedmbt/status/1452489361522446336,https://pbs.twimg.com/profile_images/1706021673370361856/SBRN0uI9.jpg,"Spokesman - Majlis Bachao Tahreek (MBT) |
Ex-Corporator GHMC (Chanchalguda & Azampura)",2009-12-27T07:04:00.000Z,"Hyderabad, India",38409,236,8905,41891,https://twitter.com//amjedmbt,Amjed Ullah Khan MBT,@amjedmbt,True,,@amjedmbt,True
,,956393797658685440,https://pbs.twimg.com/media/DUXLFbnVMAEERg9.jpg,,,,False,False,0,https://twitter.com/ktrtrs,https://twitter.com/TelanganaCMO,,,,,,,,,,,,,,,,,,,,,,,,,,,,,,,,,,,,,,,,,,,,,0,0,0,Post Graduate,good mug sir would like bring notice regarding officer tspdcl regarding qualification required shown apart ply allow even mba fin graduates apply post ply consider major concern,2018-01-25T05:10:00.000Z,https://twitter.com/NainiRk/status/956393797658685440,https://pbs.twimg.com/profile_images/1252548487259930624/NNI8hqNg.jpg,"Corporate Employee#Happily Married, A Happy Husband,Responsible Son,#Man United Fan#Mumbai Indians Fan#Sachin Tendulkar#Rohit Sharma#NTR",2012-07-09T11:36:00.000Z,"Hyderabad, India",39,437,4785,157,https://twitter.com//NainiRk,Ranjith Kumar Naini,@NainiRk,False,,,False
,,890504829826588673,,,,,False,False,0,https://twitter.com/yadavtejashwi,,,,,,,,,,,,,,,,,,,,,,,,,,,,,,,,,,,,,,,,,,,,,,0,0,0,Post Graduate,yes post graduate computer science unlike rahul gandhi,2017-07-27T09:31:00.000Z,https://twitter.com/yedramiarun/status/890504829826588673,https://pbs.twimg.com/profile_images/1663929762031734785/UOS8QXdN.jpg,"Politics is my passion, Nature lover",2010-07-18T08:06:00.000Z,"Bengaluru, India",125,123,11717,10425,https://twitter.com//yedramiarun,Arun kumar,@yedramiarun,False,,,False
,,808311125456494596,,,,,False,False,0,,,,,,,,,,,,,,,,,,,,,,,,,,,,,,,,,,,,,,,,,,,,,,,0,0,0,Post Graduate,basic literacy rate among telangana muslims high national average fare worse case graduate postgraduate education,2016-12-12T14:02:00.000Z,https://twitter.com/NJayandar/status/808311125456494596,https://pbs.twimg.com/profile_images/786200581966659585/xK-PvZlv.jpg,"An advocate.  But not active practice, doing legal documents since 25 years.

Interested in political analysis and having vast experience of so many fields,",2016-10-11T08:48:00.000Z,"Kukatpally, Hyderabad-500 072",560,4222,160,796,https://twitter.com//NJayandar,Jayandar Rao N,@NJayandar,False,,,False
,,942322019437125632,,,,,False,False,0,https://twitter.com/passportsevamea,,,,,,,,,,,,,,,,,,,,,,,,,,,,,,,,,,,,,,,,,,,,,,0,1,0,Post Graduate,1978 born postgraduate radar card full date birth serve date birth proof also address proof thanks,2017-12-17T09:14:00.000Z,https://twitter.com/bhaveen78/status/942322019437125632,https://pbs.twimg.com/profile_images/827365551429218304/5LKdJVaa.jpg,,2009-05-16T05:25:00.000Z,"Hyderabad, India",242,3326,43322,8651,https://twitter.com//bhaveen78,Bhaveen Lathia,@bhaveen78,False,,,False
,,936147452624637954,https://pbs.twimg.com/media/DP3btBQVQAEzsQn.jpg,https://pbs.twimg.com/media/DP3dIQSU8AAuoYL.jpg,,,False,False,0,,,,,,,,,,,,,,,,,,,,,,,,,,,,,,,,,,,,,,,,,,,,,,,1,0,0,Post Graduate,internship internship est dec 2017 graduateundergraduatepostgraduate good english comm skills paid months months performance reviewed offered fixed salary continuation offers 9030231199,2017-11-30T08:18:00.000Z,https://twitter.com/IT_ADMCHYD/status/936147452624637954,https://pbs.twimg.com/profile_images/934070424752734208/LLGBrC3x.jpg,"ADM Consulting is a Corporate HR Consulting &Training Firm, specialized in Manpower Consulting& Out-sourcing Services, Training and Human Capital Development.",2017-11-24T12:53:00.000Z,"Hyderabad, India",49,71,399,539,https://twitter.com//IT_ADMCHYD,ADM CONSULTING,@IT_ADMCHYD,False,admitsolution.com,,False
,,859721641202286592,,,,,False,False,0,https://twitter.com/search?q=%23MBA,,,,,,,,,,,,,,,,,,,,,,,,,,,,,,,,,,,,,,,,,,,,,,0,0,0,Post Graduate,mba done dustednow post graduate,2017-05-03T10:49:00.000Z,https://twitter.com/pav_teja/status/859721641202286592,https://pbs.twimg.com/profile_images/1051420082130341888/nYyMkgs6.jpg,,2012-05-14T05:57:00.000Z,"Hyderabad, India",20,96,96,3235,https://twitter.com//pav_teja,pavan teja,@pav_teja,False,,,False
https://pbs.twimg.com/profile_images/1667748500225019904/_2cPsLhX.jpg,NOMULA SRINIVAS RAO,1451886451667267586,https://pbs.twimg.com/media/FCYjBuHVgAIGLff.jpg,,,,False,False,1,https://twitter.com/search?q=%23IntermediateExams,https://twitter.com/search?q=%23Telangana,https://twitter.com/search?q=%23ExamCentreExamination,https://twitter.com/search?q=%23EastMaredpalli,https://twitter.com/search?q=%23Secunderabad,,,,,,,,,,,,,,,,,,,,,,,,,,,,,,,,,,,,,,,,,,0,0,0,exams,intermediateexams telangana examcentreexamination prima formula look exam center eastmaredpalli secunderabad exams starting mondayhigh court cleared way exams oil withdrawn requested cancellation time decide,2021-10-23T12:21:00.000Z,https://twitter.com/srinu1966/status/1451886451667267586,https://pbs.twimg.com/profile_images/1667748500225019904/_2cPsLhX.jpg,OSD to Former Union Civil Aviation Minister Govt of India.Did Post graduation in Journalism and Law from Osmania University and love to be a global citizen.,2010-01-04T11:41:00.000Z,"Hyderabad, India",916,3538,12460,10613,https://twitter.com//srinu1966,NOMULA SRINIVAS RAO,@srinu1966,True,facebook.com/nomula.rao.7/,@srinu1966,True
https://pbs.twimg.com/profile_images/1492082103219265537/Q-cv3qRd.jpg,MD ABDUL RAZZAK,1451850440757313542,,,,,False,False,5,https://twitter.com/TelanganaCMO,https://twitter.com/ktrtrs,https://twitter.com/search?q=%23cancelinterexams,,,,,,,,,,,,,,,,,,,,,,,,,,,,,,,,,,,,,,,,,,,,0,1,4,exams,please cancel inter est exams ready exams get sufficient time prepare exams please try understand problem students depression due exams decision cancelinterexams,2021-10-23T09:58:00.000Z,https://twitter.com/MOHAMMA68626066/status/1451850440757313542,https://pbs.twimg.com/profile_images/1492082103219265537/Q-cv3qRd.jpg,"cricket lover 🏏
Favourite ipl team RCB 🔥✌️",2021-01-05T09:24:00.000Z,,47,3147,415,1471,https://twitter.com//MOHAMMA68626066,MD ABDUL RAZZAK,@MOHAMMA68626066,False,,@MOHAMMA68626066,False
https://pbs.twimg.com/profile_images/1492082103219265537/Q-cv3qRd.jpg,MD ABDUL RAZZAK,1451847926666313734,,,,,False,False,1,https://twitter.com/TelanganaCMO,https://twitter.com/search?q=%23cancelinterexams,https://twitter.com/PMOIndia,,,,,,,,,,,,,,,,,,,,,,,,,,,,,,,,,,,,,,,,,,,,0,0,3,exams,request please cancel inter est exams ready exams please try understand problem day left exams get sufficient time prepare exams cancelinterexams,2021-10-23T09:48:00.000Z,https://twitter.com/MOHAMMA68626066/status/1451847926666313734,https://pbs.twimg.com/profile_images/1492082103219265537/Q-cv3qRd.jpg,"cricket lover 🏏
Favourite ipl team RCB 🔥✌️",2021-01-05T09:24:00.000Z,,47,3147,415,1471,https://twitter.com//MOHAMMA68626066,MD ABDUL RAZZAK,@MOHAMMA68626066,False,,@MOHAMMA68626066,False
https://pbs.twimg.com/profile_images/1569369470099165184/E3FVM2sp.jpg,Marri Rajasekhar Reddy,1360591319786115073,https://pbs.twimg.com/media/EuHKlKxVcAIOkVp.jpg,https://pbs.twimg.com/media/EuHKlLCVoAAcI84.jpg,https://pbs.twimg.com/media/EuHKlLAVcAAGPzJ.jpg,https://pbs.twimg.com/media/EuHKlLCVEAEt96M.jpg,False,False,64,https://twitter.com/search?q=%23Championship,https://twitter.com/search?q=%23athletes,,,,,,,,,,,,,,,,,,,,,,,,,,,,,,,,,,,,,,,,,,,,,0,2,14,Masters,inaugurated ith maa masters athletic championship mar institute technology age number athletes made presence today encouraging youth follow footsteps leading healthy lifestyle,2021-02-13T14:07:00.000Z,https://twitter.com/MarriRajasekar/status/1360591319786115073,https://pbs.twimg.com/profile_images/1569369470099165184/E3FVM2sp.jpg,Member of Legislative Assembly - #Malkajigiri Constituency,2014-04-01T10:14:00.000Z,India,18568,150,18963,5018,https://twitter.com//MarriRajasekar,Marri Rajasekhar Reddy,@MarriRajasekar,True,instagram.com/marrirajasekar…,@MarriRajasekar,True
,,1464051690559004675,,,,,False,False,1,,,,,,,,,,,,,,,,,,,,,,,,,,,,,,,,,,,,,,,,,,,,,,,0,0,0,exams,absolutely unfortunately got mug exams cause didn't sufficient time understand concepts,2021-11-26T02:01:00.000Z,https://twitter.com/Kaushik_Eyunni/status/1464051690559004675,https://pbs.twimg.com/profile_images/1637432914865713152/ZzmWScPL.jpg,व्यासय विष्णु रूपया व्यासरूपाय विशनवे!,2016-05-13T12:53:00.000Z,,140,120,6352,4715,https://twitter.com//Kaushik_Eyunni,Kaushik Eyunni,@Kaushik_Eyunni,False,,,False
https://pbs.twimg.com/profile_images/1600715897068744705/pKXMnBn9.jpg,శ్రీనివాస్ రాచకొండ,1347997385260060673,,,,,False,False,1,,,,,,,,,,,,,,,,,,,,,,,,,,,,,,,,,,,,,,,,,,,,,,,0,0,0,Masters,super fights masala credit ram lawman masters,2021-01-09T20:03:00.000Z,https://twitter.com/its_srinu/status/1347997385260060673,https://pbs.twimg.com/profile_images/1600715897068744705/pKXMnBn9.jpg,"Telugu movies.....
SAP ABAP developer. All RTs not endorsements.",2010-06-04T15:20:00.000Z,"Hyderabad, India",419,124,109831,94610,https://twitter.com//its_srinu,శ్రీనివాస్ రాచకొండ,@its_srinu,True,,@its_srinu,True
https://pbs.twimg.com/profile_images/1578990555245473796/8mQJStjY.jpg,Konda Vishweshwar Reddy,1346926050698088448,,,,,False,False,3,,,,,,,,,,,,,,,,,,,,,,,,,,,,,,,,,,,,,,,,,,,,,,,0,1,1,Masters,cowards like masters hide identities fake accounts,2021-01-06T21:06:00.000Z,https://twitter.com/KVishReddy/status/1346926050698088448,https://pbs.twimg.com/profile_images/1578990555245473796/8mQJStjY.jpg,"Engineer, Social Activist, Public Representative. Former Member of Parliament. Fan of Adam Smith",2013-01-27T13:44:00.000Z,Hyderabad,93963,979,79259,24513,https://twitter.com//KVishReddy,Konda Vishweshwar Reddy,@KVishReddy,True,kvrformp.org/,@KVishReddy,True
https://pbs.twimg.com/profile_images/1336574163083902976/2fbC_I-Q.jpg,SPIC MACAY in TELANGANA,1344551793439608833,https://pbs.twimg.com/media/EqjOsX_UUAEe_uP.jpg,https://pbs.twimg.com/media/EqjOs-6UwAE2ApQ.jpg,https://pbs.twimg.com/media/EqjOt_kVgAEkWtt.jpg,,False,False,2,https://twitter.com/search?q=%23Friday,https://twitter.com/search?q=%23CINEMACLASSICS,http://bit.ly/smcinemaclassic,https://twitter.com/search?q=%23Saturday,http://bit.ly/smlivezoom,https://twitter.com/search?q=%23CLASSICAL,http://bit.ly/smlivezoom,https://twitter.com/search?q=%23Sunday,https://twitter.com/search?q=%23craft,http://bit.ly/smvolunteermeet,,,,,,,,,,,,,,,,,,,,,,,,,,,,,,,,,,,,,0,1,1,Masters,friday evening cinemaclassics 530 onwards bitlysmcinemaclassic saturday great masters series onwards bitlysmlivezoom saturday evening classical evening series onwards bitlysmlivezoom sunday craft noon bitlysmvolunteermeet,2020-12-31T07:51:00.000Z,https://twitter.com/smtelangana/status/1344551793439608833,https://pbs.twimg.com/profile_images/1336574163083902976/2fbC_I-Q.jpg,"Support for #SPICMACAY in #TELANGANA State comprising of #Hyderabad Chapter & various Sub-Chapters,Heritage Clubs & Nodal Centers.
Curator @aedee a #Volunteer",2018-08-12T13:20:00.000Z,"Hyderabad, India",316,189,7592,1877,https://twitter.com//smtelangana,SPIC MACAY in TELANGANA,@smtelangana,False,spicmacay.org,@smtelangana,False
,,740157842213068802,,,,,False,False,0,,,,,,,,,,,,,,,,,,,,,,,,,,,,,,,,,,,,,,,,,,,,,,,0,0,0,Post Graduate,recently visited village see president elect post graduate woman seldom come officer husband though,2016-06-07T12:25:00.000Z,https://twitter.com/NAGYARRAGUNTA/status/740157842213068802,https://pbs.twimg.com/profile_images/735443658065862656/fAh4FSuO.jpg,,2015-06-24T12:42:00.000Z,,18,44,1,89,https://twitter.com//NAGYARRAGUNTA,NAGESWARARAO,@NAGYARRAGUNTA,False,,,False
,,774243191994273792,https://pbs.twimg.com/media/Cr6p8zKUAAA04NL.jpg,,,,False,False,3,http://apex.isb.edu/,https://twitter.com/UniMelb,,,,,,,,,,,,,,,,,,,,,,,,,,,,,,,,,,,,,,,,,,,,,0,0,1,Post Graduate,apex isbuniversity melbourne post graduate case challenge register apexisbedu,2016-09-09T13:48:00.000Z,https://twitter.com/ISBedu/status/774243191994273792,https://pbs.twimg.com/profile_images/1608078395879075843/6h03wLnQ.jpg,Research-driven B-school that grooms future leaders for India and the world.,2009-06-19T03:48:00.000Z,Hyderabad | Mohali,152983,384,2562,10915,https://twitter.com//ISBedu,Indian School of Business (ISB),@ISBedu,True,isb.edu,,True
,,1466419043573944333,https://pbs.twimg.com/media/FFnEMetWUAg5cLr.jpg,https://pbs.twimg.com/media/FFnEVENXIBUXf-x.jpg,https://pbs.twimg.com/media/FFnEWKvXoA4AeEb.jpg,,False,False,13,https://twitter.com/ABVPTelangana,https://twitter.com/search?q=%23ABVPForStudents,,,,,,,,,,,,,,,,,,,,,,,,,,,,,,,,,,,,,,,,,,,,,0,0,0,University,karyakartas organized dharma front state universities submitted memorandum demanding reduce increased fee engineering pig courses abvpforstudents,2021-12-02T14:48:00.000Z,https://twitter.com/SriRajashekhar/status/1466419043573944333,https://pbs.twimg.com/profile_images/1686628309906690048/lDgX73Tr.jpg,B Com LL.M | Alumnus #Osmania #NALSAR #G20ItalyYouthSummit,2015-12-25T06:54:00.000Z,"Hyderabad, India",979,361,2576,432,https://twitter.com//SriRajashekhar,Rajashekhar Sadineni (రాజశేఖర్),@SriRajashekhar,False,,,False
,,786795984705552385,,,,,False,False,0,https://twitter.com/teriin,https://twitter.com/NIRDPR_India,,,,,,,,,,,,,,,,,,,,,,,,,,,,,,,,,,,,,,,,,,,,,0,0,0,Post Graduate,post graduate student rural development management chances part energy sector,2016-10-14T05:09:00.000Z,https://twitter.com/janaabzeo/status/786795984705552385,https://pbs.twimg.com/profile_images/1696232375972188160/4SBjbXRw.jpg,"Rural development Professional |TEST Cricketmaniac, @ManUTD Blood Corpuscles | Historian Daman and Diu @narendramodi supporter | Finished watchin @youtube",2010-01-27T16:29:00.000Z,"Diu, Daman And Diu",911,2885,35671,107042,https://twitter.com//janaabzeo,socialscientist,@janaabzeo,False,,,False
https://pbs.twimg.com/profile_images/1503614640982437889/OTIHecnZ.jpg,Dr Andrew Fleming 🇬🇧 🏴󠁧󠁢󠁳󠁣󠁴󠁿,1473659480462135296,https://pbs.twimg.com/media/FHN9eBGUYAAOSpN.jpg,https://pbs.twimg.com/media/FHN9eZaVcAAF7Ha.jpg,https://pbs.twimg.com/media/FHN9exyVUAIjpMe.jpg,https://pbs.twimg.com/media/FHN9fJcUUAAmw_A.jpg,False,False,87,https://twitter.com/SwmrtBengaluru,https://twitter.com/search?q=%23Siddipet,,,,,,,,,,,,,,,,,,,,,,,,,,,,,,,,,,,,,,,,,,,,,1,6,9,School,monday met shanti tummala siddipet introduced swachabadi school solid waste management first telangana second nationally fantastic concept educating entire community understand aspects process,2021-12-22T14:19:00.000Z,https://twitter.com/Andrew007Uk/status/1473659480462135296,https://pbs.twimg.com/profile_images/1503614640982437889/OTIHecnZ.jpg,"Diplomat: Dy. High Commissioner to East & N.E. 🇮🇳, ex 🇺🇬🇬🇭🇳🇬.
#Traveller 👀 117 lands & 870 ⚽ 🏟 #Foodie #Dad #MillwallFC #DisabilityChampion, own views",2015-12-09T19:52:00.000Z,Kolkata,48210,2679,95303,68776,https://twitter.com//Andrew007Uk,Dr Andrew Fleming 🇬🇧 🏴󠁧󠁢󠁳󠁣󠁴󠁿,@Andrew007Uk,False,gov.uk/government/people/and…,@Andrew007Uk,False
,,1465221473858048005,,,,,False,False,0,,,,,,,,,,,,,,,,,,,,,,,,,,,,,,,,,,,,,,,,,,,,,,,0,1,0,University,andhbhakt dont know actual difference meaning minorities majorities believe was app university fake lectureship people dont believe facts proves believe silly meaningless agendas topics spread hate,2021-11-29T07:29:00.000Z,https://twitter.com/Factbuddy2/status/1465221473858048005,https://pbs.twimg.com/profile_images/1599932015499177984/Wv_dsBs3.jpg,,2021-11-20T14:29:00.000Z,"Hyderabad, India",16,71,4982,1459,https://twitter.com//Factbuddy2,LogicsNFacts,@Factbuddy2,False,,,False
https://pbs.twimg.com/profile_images/1305645355388694529/Qs7nyKqe.jpg,Majlis Bachao Tehreek (MBT),1473527444871151617,https://pbs.twimg.com/media/FHMFXTLVcAEwd_7.jpg,https://pbs.twimg.com/media/FHMFYLSUUAISkwz.jpg,https://pbs.twimg.com/media/FHMFZJzVQAsrjnV.jpg,,False,False,30,https://twitter.com/amjedmbt,,,,,,,,,,,,,,,,,,,,,,,,,,,,,,,,,,,,,,,,,,,,,,0,0,3,School,seen attending valid ceremony daughter mohammed mujer khan put school correspondent held palace pop mir alarm tank,2021-12-22T05:34:00.000Z,https://twitter.com/MBTparty/status/1473527444871151617,https://pbs.twimg.com/profile_images/1305645355388694529/Qs7nyKqe.jpg,"Official Account: Based in #Hyderabad, #Telangana representing downtrodden and poor masses. Party President: Majeed Ullah Khan, Party Spokesman @amjedmbt",2018-11-12T18:26:00.000Z,"Hyderabad, India",4685,34,1763,4815,https://twitter.com//MBTparty,Majlis Bachao Tehreek (MBT),@MBTparty,False,facebook.com/MajlisBachaoTeh…,@MBTparty,False
https://pbs.twimg.com/profile_images/1390676677412364288/a4VU_QJs.jpg,Orane International School of Beauty & Wellness,1473515542505943040,,,,,False,False,0,https://www.instagram.com/p/CXxbJWGPj4Y/?utm_medium=twitter,,,,,,,,,,,,,,,,,,,,,,,,,,,,,,,,,,,,,,,,,,,,,,0,0,0,School,posted photo orange international school beauty wellness hyderabad,2021-12-22T04:47:00.000Z,https://twitter.com/HyderabadOrane/status/1473515542505943040,https://pbs.twimg.com/profile_images/1390676677412364288/a4VU_QJs.jpg,Professional beautician courses in Telangana offered by Orane Beauty Institute lay a strong foundation for a rewarding career in the beauty and wellness industr,2021-04-27T15:03:00.000Z,Hyderabad,3,24,49,174,https://twitter.com//HyderabadOrane,Orane International School of Beauty & Wellness,@HyderabadOrane,False,oranehyderabad.in,@HyderabadOrane,False
https://pbs.twimg.com/profile_images/1390676677412364288/a4VU_QJs.jpg,Orane International School of Beauty & Wellness,1473515194022187009,,,,,False,False,0,https://www.instagram.com/oraneinternational.hyderabad/p/CXxa_TKv4-1/?utm_medium=twitter,,,,,,,,,,,,,,,,,,,,,,,,,,,,,,,,,,,,,,,,,,,,,,0,0,0,School,posted photo orange international school beauty wellness hyderabad,2021-12-22T04:46:00.000Z,https://twitter.com/HyderabadOrane/status/1473515194022187009,https://pbs.twimg.com/profile_images/1390676677412364288/a4VU_QJs.jpg,Professional beautician courses in Telangana offered by Orane Beauty Institute lay a strong foundation for a rewarding career in the beauty and wellness industr,2021-04-27T15:03:00.000Z,Hyderabad,3,24,49,174,https://twitter.com//HyderabadOrane,Orane International School of Beauty & Wellness,@HyderabadOrane,False,oranehyderabad.in,@HyderabadOrane,False
https://pbs.twimg.com/profile_images/1336574163083902976/2fbC_I-Q.jpg,SPIC MACAY in TELANGANA,1473296601439358981,https://pbs.twimg.com/media/FHIzR4AVIAA-_aH.jpg,https://pbs.twimg.com/media/FHIzVUaUYAEDI8e.jpg,https://pbs.twimg.com/media/FHIzYCpVQAEakwv.jpg,https://pbs.twimg.com/media/FHIza7zVEAICM3u.jpg,False,False,1,https://twitter.com/search?q=%23Cheriyal,https://twitter.com/jaywantguitar,,,,,,,,,,,,,,,,,,,,,,,,,,,,,,,,,,,,,,,,,,,,,0,1,0,School,sharing photographs progress workshop chemical painting received today school photos courtesy,2021-12-21T14:17:00.000Z,https://twitter.com/smtelangana/status/1473296601439358981,https://pbs.twimg.com/profile_images/1336574163083902976/2fbC_I-Q.jpg,"Support for #SPICMACAY in #TELANGANA State comprising of #Hyderabad Chapter & various Sub-Chapters,Heritage Clubs & Nodal Centers.
Curator @aedee a #Volunteer",2018-08-12T13:20:00.000Z,"Hyderabad, India",316,189,7592,1877,https://twitter.com//smtelangana,SPIC MACAY in TELANGANA,@smtelangana,False,spicmacay.org,@smtelangana,False
