"avatar","fullname","id","images/0","images/1","images/2","images/3","isQuote","isRetweet","likes","links/0","links/1","links/2","links/3","links/4","links/5","links/6","links/7","links/8","links/9","links/10","links/11","links/12","links/13","links/14","links/15","links/16","links/17","links/18","links/19","links/20","links/21","links/22","links/23","quotedTweet/avatar","quotedTweet/fullname","quotedTweet/images/0","quotedTweet/images/1","quotedTweet/images/2","quotedTweet/images/3","quotedTweet/links/0","quotedTweet/links/1","quotedTweet/links/2","quotedTweet/links/3","quotedTweet/links/4","quotedTweet/links/5","quotedTweet/links/6","quotedTweet/links/7","quotedTweet/text","quotedTweet/timestamp","quotedTweet/url","quotedTweet/username","quotes","replies","retweets","searchQuery","text","timestamp","url","user/avatar","user/description","user/joinDate","user/location","user/totalFollowers","user/totalFollowing","user/totalLikes","user/totalTweets","user/url","user/userFullName","user/username","user/verified","user/website","username","verified"
,,"1438753269090643970","https://pbs.twimg.com/media/E_d6d4hUYAAetpm.jpg",,,,"false","false","4","https://twitter.com/search?q=%23HPUShimla","https://twitter.com/search?q=%23HPU","https://twitter.com/search?q=%23shimla","https://twitter.com/search?q=%23himachalpradesh",,,,,,,,,,,,,,,,,,,,,,,,,,,,,,,,,,,,,,,"0","0","1","Bachelors","Counselling Notice for admissions to Bachelor of Library & Information Science and Master of Library & Information Science for academic session 2021-22.
#HPUShimla #HPU #shimla #himachalpradesh","2021-09-17T06:34:00.000Z","https://twitter.com/hpu_shimla/status/1438753269090643970","https://pbs.twimg.com/profile_images/1506931921900957700/_QoDfl6G.jpg","Office of Honbl. Vice Chancellor, Himachal Pradesh University Shimla","2021-08-12T11:38:00.000Z","Shimla Urban, India","963","28","115","424","https://twitter.com//hpu_shimla","HPU Vice Chancellor Secretariat","@hpu_shimla","false","hpuniv.ac.in/",,"false"
"https://pbs.twimg.com/profile_images/1506931921900957700/_QoDfl6G.jpg","HPU Vice Chancellor Secretariat","1440341814158905351","https://pbs.twimg.com/media/E_0fPs3VUAweeCc.jpg",,,,"false","false","16","https://twitter.com/search?q=%23HPUShimla","https://twitter.com/search?q=%23HPU","https://twitter.com/search?q=%23shimla","https://twitter.com/search?q=%23himachalpradesh",,,,,,,,,,,,,,,,,,,,,,,,,,,,,,,,,,,,,,,"0","0","3","exams","Notification regarding change of B.Ed exam centres
#HPUShimla #HPU #shimla #himachalpradesh","2021-09-21T15:47:00.000Z","https://twitter.com/hpu_shimla/status/1440341814158905351","https://pbs.twimg.com/profile_images/1506931921900957700/_QoDfl6G.jpg","Office of Honbl. Vice Chancellor, Himachal Pradesh University Shimla","2021-08-12T11:38:00.000Z","Shimla Urban, India","963","28","115","424","https://twitter.com//hpu_shimla","HPU Vice Chancellor Secretariat","@hpu_shimla","false","hpuniv.ac.in/","@hpu_shimla","false"
"https://pbs.twimg.com/profile_images/1506931921900957700/_QoDfl6G.jpg","HPU Vice Chancellor Secretariat","1437313259535618049","https://pbs.twimg.com/media/E_Jcx_mVgAgzgdH.jpg",,,,"false","false","20","https://twitter.com/search?q=%23HPUShimla","https://twitter.com/search?q=%23HPU","https://twitter.com/search?q=%23shimla","https://twitter.com/search?q=%23himachalpradesh",,,,,,,,,,,,,,,,,,,,,,,,,,,,,,,,,,,,,,,"0","0","4","college","Regarding UG Academic Session 2021-22 in the College of State
#HPUShimla #HPU #shimla #himachalpradesh","2021-09-13T07:12:00.000Z","https://twitter.com/hpu_shimla/status/1437313259535618049","https://pbs.twimg.com/profile_images/1506931921900957700/_QoDfl6G.jpg","Office of Honbl. Vice Chancellor, Himachal Pradesh University Shimla","2021-08-12T11:38:00.000Z","Shimla Urban, India","963","28","115","424","https://twitter.com//hpu_shimla","HPU Vice Chancellor Secretariat","@hpu_shimla","false","hpuniv.ac.in/","@hpu_shimla","false"
"https://pbs.twimg.com/profile_images/1506931921900957700/_QoDfl6G.jpg","HPU Vice Chancellor Secretariat","1437310852906897410","https://pbs.twimg.com/media/E_JalBrVEAMKt-i.jpg","https://pbs.twimg.com/media/E_JalzHVIAEhdAc.jpg",,,"false","false","5","https://twitter.com/search?q=%23HPUShimla","https://twitter.com/search?q=%23HPU","https://twitter.com/search?q=%23shimla","https://twitter.com/search?q=%23himachalpradesh",,,,,,,,,,,,,,,,,,,,,,,,,,,,,,,,,,,,,,,"0","2","1","college","Regarding Implementation of Reservation Policy of the Government of India in Universities Colleges and Other Grant-in-aid Institutions
#HPUShimla #HPU #shimla #himachalpradesh","2021-09-13T07:03:00.000Z","https://twitter.com/hpu_shimla/status/1437310852906897410","https://pbs.twimg.com/profile_images/1506931921900957700/_QoDfl6G.jpg","Office of Honbl. Vice Chancellor, Himachal Pradesh University Shimla","2021-08-12T11:38:00.000Z","Shimla Urban, India","963","28","115","424","https://twitter.com//hpu_shimla","HPU Vice Chancellor Secretariat","@hpu_shimla","false","hpuniv.ac.in/","@hpu_shimla","false"
"https://pbs.twimg.com/profile_images/1506931921900957700/_QoDfl6G.jpg","HPU Vice Chancellor Secretariat","1431213422264213509","https://pbs.twimg.com/media/E9yw_5pUcAYmCUs.jpg","https://pbs.twimg.com/media/E9yxA0lVcAstcPf.jpg",,,"false","false","4","https://twitter.com/search?q=%23hpu","https://twitter.com/search?q=%23shimla","https://twitter.com/search?q=%23hpushimla","https://twitter.com/search?q=%23himachalpradaesh",,,,,,,,,,,,,,,,,,,,,,,,,,,,,,,,,,,,,,,"0","0","1","exams","Entrance exam result of BTech UIT
(2/2)
#hpu #shimla #hpushimla #himachalpradaesh","2021-08-27T11:14:00.000Z","https://twitter.com/hpu_shimla/status/1431213422264213509","https://pbs.twimg.com/profile_images/1506931921900957700/_QoDfl6G.jpg","Office of Honbl. Vice Chancellor, Himachal Pradesh University Shimla","2021-08-12T11:38:00.000Z","Shimla Urban, India","963","28","115","424","https://twitter.com//hpu_shimla","HPU Vice Chancellor Secretariat","@hpu_shimla","false","hpuniv.ac.in/","@hpu_shimla","false"
"https://pbs.twimg.com/profile_images/1506931921900957700/_QoDfl6G.jpg","HPU Vice Chancellor Secretariat","1431213292832243712","https://pbs.twimg.com/media/E9yw2mYVcAQoqWQ.jpg","https://pbs.twimg.com/media/E9yw3WTVQAMJBCI.jpg","https://pbs.twimg.com/media/E9yw4WLVgAI3KVJ.jpg","https://pbs.twimg.com/media/E9yw5MAVIAAQP6s.jpg","false","false","14","https://twitter.com/search?q=%23hpu","https://twitter.com/search?q=%23shimla","https://twitter.com/search?q=%23hpushimla","https://twitter.com/search?q=%23himachalpradaesh",,,,,,,,,,,,,,,,,,,,,,,,,,,,,,,,,,,,,,,"0","1","2","exams","Entrance exam result of BTech UIT
(1/2)
#hpu #shimla #hpushimla #himachalpradaesh","2021-08-27T11:13:00.000Z","https://twitter.com/hpu_shimla/status/1431213292832243712","https://pbs.twimg.com/profile_images/1506931921900957700/_QoDfl6G.jpg","Office of Honbl. Vice Chancellor, Himachal Pradesh University Shimla","2021-08-12T11:38:00.000Z","Shimla Urban, India","963","28","115","424","https://twitter.com//hpu_shimla","HPU Vice Chancellor Secretariat","@hpu_shimla","false","hpuniv.ac.in/","@hpu_shimla","false"
"https://pbs.twimg.com/profile_images/1506931921900957700/_QoDfl6G.jpg","HPU Vice Chancellor Secretariat","1434845340465721352","https://pbs.twimg.com/media/E-mYOl2VEAQiMlA.jpg",,,,"false","false","11","https://twitter.com/search?q=%23HPU","https://twitter.com/search?q=%23shimla","https://twitter.com/search?q=%23HPUShimla","https://twitter.com/search?q=%23HimachalPradesh",,,,,,,,,,,,,,,,,,,,,,,,,,,,,,,,,,,,,,,"0","0","3","college","Regarding admission to Under Graduate classes 1st year to 3rd Year in College of the state.
#HPU #shimla #HPUShimla #HimachalPradesh","2021-09-06T11:46:00.000Z","https://twitter.com/hpu_shimla/status/1434845340465721352","https://pbs.twimg.com/profile_images/1506931921900957700/_QoDfl6G.jpg","Office of Honbl. Vice Chancellor, Himachal Pradesh University Shimla","2021-08-12T11:38:00.000Z","Shimla Urban, India","963","28","115","424","https://twitter.com//hpu_shimla","HPU Vice Chancellor Secretariat","@hpu_shimla","false","hpuniv.ac.in/","@hpu_shimla","false"
,,"1476081223327879171","https://pbs.twimg.com/media/FHwYDKWVQAMtiQm.jpg",,,,"false","false","8","https://twitter.com/search?q=%23JalJeevanMissiion",,,,,,,,,,,,,,,,,,,,,,,,,,,,,,,,,,,,,,,,,,"0","0","1","School","Save water,Save Earth
A painting by a school child during awareness program  regarding importance of water under JJM among students of Himachal
#JalJeevanMissiion
Jal Shakti Vibhag Himachal Pradesh","2021-12-29T06:42:00.000Z","https://twitter.com/JalVibhag/status/1476081223327879171","https://pbs.twimg.com/profile_images/1658357887368941571/pDTku_MR.jpg",,"2021-07-14T11:31:00.000Z","Shimla Himachal Pradesh","270","27","5357","2762","https://twitter.com//JalVibhag","Jal Shakti Vibhag HP","@JalVibhag","false","hpiph.org",,"false"
,,"1472535447943405575",,,,,"false","false","0","https://twitter.com/search?q=%234BHK","https://twitter.com/search?q=%23ForSale","https://twitter.com/search?q=%23Shimla","https://twitter.com/search?q=%23Apartment","https://twitter.com/search?q=%23Flat","https://twitter.com/search?q=%23Bhattakuffar","https://twitter.com/search?q=%23Residential","https://twitter.com/search?q=%23Property","http://prpt.in/P85227492",,,,,,,,,,,,,,,,,,,,,,,,,,,,,,,,,,"0","0","0","School","#4BHK Duplex #ForSale in Chhakrhail near IVY School ( Bhatakufar) #Shimla #Apartment #Flat #Bhattakuffar #Residential #Property
prpt.in/P85227492","2021-12-19T11:53:00.000Z","https://twitter.com/propertiesindia/status/1472535447943405575","https://pbs.twimg.com/profile_images/556355330/propertywala_icon_64_bigger_1_.png","India's Premium Real Estate Network","2009-11-07T11:03:00.000Z","India","6142","23","0","2396175","https://twitter.com//propertiesindia","PropertyWala.com","@propertiesindia","false","propertywala.com",,"false"
,,"1474267621436497920",,,,,"false","false","1",,,,,,,,,,,,,,,,,,,,,,,,,,,,,,,,,,,,,,,,,,,"0","1","1","Masters","Who is taking you seriously?

Abusing is your habit. Cursing is your quality.

Insulting excellence is in your DNA. You must have picked up from your masters in last 1000+ years.

Time to unlearn and awaken. Decide what to unlearn and what to learn.","2021-12-24T06:36:00.000Z","https://twitter.com/kamekish/status/1474267621436497920","https://pbs.twimg.com/profile_images/1700760137177477120/m278bIcV.jpg","I help people Unlearn, a new idea to keep pace with change.
Unlearn means forget, discard & remove. Unlearn is the need of hour. Follow me to know Unlearn.","2009-08-05T10:11:00.000Z","Delhi NCR India","1945","77","6387","20969","https://twitter.com//kamekish","Wing Commander KK Verma","@kamekish","false","facebook.com/NAFIndia.Org",,"false"
,,"1474376061018206208","https://pbs.twimg.com/media/FHYJNQjVgAAsbvh.jpg",,,,"false","false","10","https://twitter.com/search?q=%23मेरी_संस्कृति_मेरा_गौरव",,,,,,,,,,,,,,,,,,,,,,,,,,,,,,,,,,,,,,,,,,"0","0","9","School","Our education system included environmental study in  school curriculum then the festival like Tulsi Pujan Divas which is directly associated with this , should be celebrated officially instead Cristmas which is totally anti environmental.
#मेरी_संस्कृति_मेरा_गौरव","2021-12-24T13:47:00.000Z","https://twitter.com/Ajaykum76580903/status/1474376061018206208","https://pbs.twimg.com/profile_images/1608324254856282113/vDIGjXrx.jpg",,"2018-01-30T11:40:00.000Z","Shimla, India","1841","1650","34285","37713","https://twitter.com//Ajaykum76580903","Ajay kumar","@Ajaykum76580903","false",,,"false"
,,"1474372952028188672",,,,,"false","false","1","https://twitter.com/LokKalyanSetu/status/1474289554848768005/video/1","https://twitter.com/search?q=%23मेरी_संस्कृति_मेरा_गौरव",,,,,,,,,,,,,,,,,,,,,,,,,,,,,,,,,,,,,,,,,"0","0","1","School","Yes,Tulsi Pujan Divas should also be performed in school.
nitter.net/LokKalyanSetu/st…
#मेरी_संस्कृति_मेरा_गौरव","2021-12-24T13:34:00.000Z","https://twitter.com/Ajaykum76580903/status/1474372952028188672","https://pbs.twimg.com/profile_images/1608324254856282113/vDIGjXrx.jpg",,"2018-01-30T11:40:00.000Z","Shimla, India","1841","1650","34285","37713","https://twitter.com//Ajaykum76580903","Ajay kumar","@Ajaykum76580903","false",,,"false"
,,"1474352165539880960",,,,,"false","false","8","https://twitter.com/Asharamjiashrm/status/1474290715760807939/video/1","https://twitter.com/search?q=%23मेरी_संस्कृति_मेरा_गौरव",,,,,,,,,,,,,,,,,,,,,,,,,,,,,,,,,,,,,,,,,"0","0","8","School","Absolutely right question, school's such double standard is not good for progressive society,they should celebrate Tulsi Pujan Divas as well.
nitter.net/Asharamjiashrm/s…
#मेरी_संस्कृति_मेरा_गौरव","2021-12-24T12:12:00.000Z","https://twitter.com/Ajaykum76580903/status/1474352165539880960","https://pbs.twimg.com/profile_images/1608324254856282113/vDIGjXrx.jpg",,"2018-01-30T11:40:00.000Z","Shimla, India","1841","1650","34285","37713","https://twitter.com//Ajaykum76580903","Ajay kumar","@Ajaykum76580903","false",,,"true"
,,"1419879206536695808","https://pbs.twimg.com/media/E7RsnM7VIAEyFQO.jpg",,,,"false","false","77","https://twitter.com/search?q=%23strength","https://twitter.com/search?q=%23wisdom","https://twitter.com/search?q=%23glorious","https://twitter.com/search?q=%23vedic","https://twitter.com/search?q=%23Masters","https://twitter.com/search?q=%23ArtofLiving","https://twitter.com/search?q=%23GuruPurnima2021","https://twitter.com/SriSri",,,,,,,,,,,,,,,,,,,,,,,,,,,,,,,,,,,"0","1","16","Masters","हमें रास्तों की जरूरत नहीं है..
हमें तेरे पैरों के निशान मिल गए हैं..!!

May we always have the #strength & the #wisdom to follow the #glorious lineage of the #vedic #Masters 🙏🏽

#ArtofLiving #GuruPurnima2021 @SriSri","2021-07-27T04:35:00.000Z","https://twitter.com/aakashavani/status/1419879206536695808","https://pbs.twimg.com/profile_images/1592465531948654592/wXQ4Ti2L.jpg","Disciple of Sri Sri Ravi Shankar..
Art Of Living Faculty..
Lover of the Himalayas..
Motivator, Trekker & a great Cook :)","2010-12-17T13:07:00.000Z","ÜT","15309","96","975","7103","https://twitter.com//aakashavani","Akash Barwal","@aakashavani","false","facebook.com/aolakash",,"false"
,,"1346613553965326336",,,,,"false","false","2","https://twitter.com/search?q=%23Boycott_Patanjali","https://twitter.com/search?q=%23PatanjaliProducts","https://twitter.com/search?q=%23बाबा_रामदेव","https://twitter.com/search?q=%23BabaRamdev","https://twitter.com/search?q=%23स्वामीरामदेव","https://twitter.com/search?q=%23पतंजलि_स्वदेशी_की_पहचान",,,,,,,,,,,,,,,,,,,,,,,,,,,,,,,,,,,,,"0","0","3","Masters","#Boycott_Patanjali
And buy only Chinese. They are our masters. 
 बाबा रामदेव, अदानी, अंबानी और मोदी सरकार को ट्रेलर दिखाएंगे
 योगेंद्र यादव
(समस्त ब्रह्मांड के किसानों के स्वघोषित निर्विवाद नेता)
#PatanjaliProducts 
#बाबा_रामदेव #BabaRamdev #स्वामीरामदेव #पतंजलि_स्वदेशी_की_पहचान","2021-01-06T00:24:00.000Z","https://twitter.com/NarulaManoj/status/1346613553965326336","https://pbs.twimg.com/profile_images/1401838779321622528/CY5lTKI4.jpg","Journalist...Live for the nation.. speak truth...speak loud...aim for #atmanirbharbharat","2013-02-25T01:17:00.000Z","Sarita Vihar, New Delhi","1345","43","23107","33578","https://twitter.com//NarulaManoj","manoj narula","@NarulaManoj","false",,,"false"
,,"1436271914104745989","https://pbs.twimg.com/media/E-6psCpVcAAeQoF.jpg",,,,"false","false","3","https://twitter.com/search?q=%23HPUShimla","https://twitter.com/search?q=%23HPU","https://twitter.com/search?q=%23shimla","https://twitter.com/search?q=%23himachalpradesh",,,,,,,,,,,,,,,,,,,,,,,,,,,,,,,,,,,,,,,"0","0","1","Post Graduate","Notice regarding counseling for admission in Post Graduate Diploma in Ambedkar Studies
#HPUShimla #HPU #shimla #himachalpradesh","2021-09-10T10:14:00.000Z","https://twitter.com/hpu_shimla/status/1436271914104745989","https://pbs.twimg.com/profile_images/1506931921900957700/_QoDfl6G.jpg","Office of Honbl. Vice Chancellor, Himachal Pradesh University Shimla","2021-08-12T11:38:00.000Z","Shimla Urban, India","963","28","115","424","https://twitter.com//hpu_shimla","HPU Vice Chancellor Secretariat","@hpu_shimla","false","hpuniv.ac.in/",,"false"
,,"1469503783059148800","https://pbs.twimg.com/media/FGS55siUUAA2ury.jpg",,,,"false","false","28",,,,,,,,,,,,,,,,,,,,,,,,,,,,,,,,,,,,,,,,,,,"1","3","4","School","Just came to know CDS Bipin Rawat's Schooling was from my School in Shimla","2021-12-11T03:06:00.000Z","https://twitter.com/ShimlaHelpline/status/1469503783059148800","https://pbs.twimg.com/profile_images/1615177322440830976/insLooeM.jpg","🕉️Hindu 🌐 Websites/CMS/Joomla/WordPress 🌍 Earth without 'ART' is just 'EH'","2009-08-17T13:54:00.000Z","Himachal 🇮🇳India 🌍Earth","5724","5924","13713","9792","https://twitter.com//ShimlaHelpline","MissMatch!","@ShimlaHelpline","false","hindubliss.blogspot.com/",,"false"
,,"1388722921976123392",,,,,"false","false","0","https://twitter.com/Jairam_Ramesh","https://twitter.com/ShashiTharoor",,,,,,,,,,,,,,,,,,,,,,,,,,,,,,,,,,,,,,,,,"0","0","0","Masters","Sleeping is art of @Jairam_Ramesh and @ShashiTharoor and their masters.. they think everyone else are like them.. but it’s new India under the leadership of Modi and BJP governance has increased as stupid ppl like them are in opposition.","2021-05-02T05:12:00.000Z","https://twitter.com/ajitbellad/status/1388722921976123392","https://pbs.twimg.com/profile_images/1554450645893128193/vyW32atU.jpg","simple living high thinking","2009-09-25T03:33:00.000Z","Mumbai, India","113","457","20538","2179","https://twitter.com//ajitbellad","Ajit Bellad","@ajitbellad","false",,,"false"
,,"1476902065347567625","https://pbs.twimg.com/media/FH8ClmRUUAARRjX.jpg",,,,"false","false","10","https://twitter.com/search?q=%23ABVPForStudents",,,,,,,,,,,,,,,,,,,,,,,,,,,,,,,,,,,,,,,,,,"0","0","3","University","Today, ABVP District Solan's UHF Nauni Unit gave memorandum to the Hon'ble Vice Chancellor and Registrar of university about increase in possible number of seats for MSc and Ph.D programme. 
#ABVPForStudents","2021-12-31T13:04:00.000Z","https://twitter.com/abvp4solan/status/1476902065347567625","https://pbs.twimg.com/profile_images/1588215292672757760/QW_DJ6Z6.jpg",,"2017-03-01T10:06:00.000Z",,"1747","110","16234","15100","https://twitter.com//abvp4solan","ABVP District Solan","@abvp4solan","false",,,"false"
,,"1388526229343522816",,,,,"false","false","0",,,,,,,,,,,,,,,,,,,,,,,,,,,,,,,,,,,,,,,,,,,"0","0","0","Masters","In this pandemic not even you or ur masters would have done .001% of what Modi or his Governance has done.. guess what you would have done scam in O2 supply as well.. So don’t be a bitch and help ppl around.. you are also an elected member to serve the ppl of this country..","2021-05-01T16:10:00.000Z","https://twitter.com/ajitbellad/status/1388526229343522816","https://pbs.twimg.com/profile_images/1554450645893128193/vyW32atU.jpg","simple living high thinking","2009-09-25T03:33:00.000Z","Mumbai, India","113","457","20538","2179","https://twitter.com//ajitbellad","Ajit Bellad","@ajitbellad","false",,,"false"
,,"1360139324281348105",,,,,"false","false","0","https://twitter.com/taapsee","https://twitter.com/AahanaKumra","https://twitter.com/anuragkashyap72",,,,,,,,,,,,,,,,,,,,,,,,,,,,,,,,,,,,,,,,"0","0","0","Masters","@taapsee @AahanaKumra oops 🙊 you are hiding why? You don’t have words ?? Or your masters are not paying you to express or protest against lunching of Hindu lives ? Your guru @anuragkashyap72 se tips lo..","2021-02-12T08:10:00.000Z","https://twitter.com/ajitbellad/status/1360139324281348105","https://pbs.twimg.com/profile_images/1554450645893128193/vyW32atU.jpg","simple living high thinking","2009-09-25T03:33:00.000Z","Mumbai, India","113","457","20538","2179","https://twitter.com//ajitbellad","Ajit Bellad","@ajitbellad","false",,,"false"
,,"1324029877058596865",,,,,"false","false","6","https://twitter.com/IPS_Association",,,,,,,,,,,,,,,,,,,,,,,,,,,,,,,,,,,,,,,,,,"0","0","0","Masters","@IPS_Association Very unfortunate that only force in India which wears the national emblem on headgear is subservient to the political masters! The custodian of constitution our subservient to brokers of power!!","2020-11-04T16:44:00.000Z","https://twitter.com/drharpalselhi/status/1324029877058596865","https://pbs.twimg.com/profile_images/802532026796691456/PEjp7wrC.jpg","Professor & Unit Head of Orthopaedic Surgery @DayanandMedical. Joint Replacement @NUSingapore. Sports Med @HopkinsMedicine. Pioneer of #Ilizarov . Investor📈","2015-06-11T03:58:00.000Z","Ludhiana, India","1954","703","44034","7685","https://twitter.com//drharpalselhi","Prof.(Dr.)Harpal Singh Selhi","@drharpalselhi","false","drharpalsingh.com",,"false"
,,"1435201657000759300","https://pbs.twimg.com/media/E-rcS2pUUAYCK6u.jpg",,,,"false","false","6","https://twitter.com/search?q=%23HPUShimla","https://twitter.com/search?q=%23HPU","https://twitter.com/search?q=%23shimla","https://twitter.com/search?q=%23himachalpradesh",,,,,,,,,,,,,,,,,,,,,,,,,,,,,,,,,,,,,,,"0","0","2","Post Graduate","Postgraduate Admissions HPUDES
#HPUShimla #HPU #shimla #himachalpradesh","2021-09-07T11:21:00.000Z","https://twitter.com/hpu_shimla/status/1435201657000759300","https://pbs.twimg.com/profile_images/1506931921900957700/_QoDfl6G.jpg","Office of Honbl. Vice Chancellor, Himachal Pradesh University Shimla","2021-08-12T11:38:00.000Z","Shimla Urban, India","963","28","115","424","https://twitter.com//hpu_shimla","HPU Vice Chancellor Secretariat","@hpu_shimla","false","hpuniv.ac.in/",,"false"
,,"1468275902282747904","https://pbs.twimg.com/media/FGBdJr2VcAE3cpz.jpg",,,,"false","false","4",,,,,,,,,,,,,,,,,,,,,,,,,,,,,,,,,,,,,,,,,,,"0","0","1","School","Posters awarding protection of natural Water source in various schools and aangnwaris of Himachal under IEC activities
Jal Jeevan Misson 💧
Jal Shakti Vibhag Himachal Pradesh","2021-12-07T17:47:00.000Z","https://twitter.com/JalVibhag/status/1468275902282747904","https://pbs.twimg.com/profile_images/1658357887368941571/pDTku_MR.jpg",,"2021-07-14T11:31:00.000Z","Shimla Himachal Pradesh","270","27","5357","2762","https://twitter.com//JalVibhag","Jal Shakti Vibhag HP","@JalVibhag","false","hpiph.org",,"false"
,,"1475469044669030400","https://pbs.twimg.com/media/FHnrQcWUcAIikSE.jpg",,,,"false","false","8","https://twitter.com/search?q=%23abvphpu","https://twitter.com/search?q=%23abvpforeducation",,,,,,,,,,,,,,,,,,,,,,,,,,,,,,,,,,,,,,,,,"0","0","8","University","Himachal Pradesh University has released the notification for the special chance for the students.
#abvphpu
#abvpforeducation","2021-12-27T14:10:00.000Z","https://twitter.com/abvp4hpu/status/1475469044669030400","https://pbs.twimg.com/profile_images/1634370879894458368/_quOj5x0.jpg","Official Handle of the ABVP HPU Unit Shimla | Official State handle is @abvphp | facebook.com/abvp4hpu | Instagram.com/abvp4hpu","2017-12-19T16:43:00.000Z","Summer Hilis, Shimla","2851","40","3557","6935","https://twitter.com//abvp4hpu","ABVP HPU Shimla","@abvp4hpu","false","abvp.org",,"false"
,,"1417028414662340609","https://pbs.twimg.com/media/E6pLz9JVgAMlWK0.jpg",,,,"false","false","0","https://twitter.com/Delhiuniversit","https://twitter.com/search?q=%23careercounselling","https://twitter.com/search?q=%23career","https://twitter.com/search?q=%23careerguidance","https://twitter.com/search?q=%23careercoach","https://twitter.com/search?q=%23education","https://twitter.com/search?q=%23careeradvice","https://twitter.com/search?q=%23careergoals","https://twitter.com/search?q=%23careerdevelopment","https://twitter.com/search?q=%23studyabroad",,,,,,,,,,,,,,,,,,,,,,,,,,,,,,,,,"0","0","0","Post Graduate","The @Delhiuniversit on Saturday announced the dates of registrations for its undergraduate and post-graduate programs for the current academic year.
.
.

#careercounselling #career #careerguidance #careercoach #education #careeradvice #careergoals #careerdevelopment #studyabroad","2021-07-19T07:47:00.000Z","https://twitter.com/careerraasta/status/1417028414662340609","https://pbs.twimg.com/profile_images/1396786635560288257/ewKGhawO.jpg","CareerRaasta focuses on providing UNBIASED career counselling & guidance services to students of classes 8th to 12th & guidance to undergrad. & college students","2021-05-24T11:01:00.000Z","Dehradun, India","5","0","2","152","https://twitter.com//careerraasta","careerraasta","@careerraasta","false","careerraasta.com",,"false"
,,"1468270983354015744","https://pbs.twimg.com/media/FGBYrY2VcAMicVc.jpg",,,,"false","false","4",,,,,,,,,,,,,,,,,,,,,,,,,,,,,,,,,,,,,,,,,,,"0","0","1","School","Hordings regarding awernees of Jal Jeevan Misson are being installed at various govt institutions,schools, important tourist places and prominent points under IEC activities
Jal Jeevan Misson 💧
Jal Shakti Vibhag Himachal Pradesh","2021-12-07T17:27:00.000Z","https://twitter.com/JalVibhag/status/1468270983354015744","https://pbs.twimg.com/profile_images/1658357887368941571/pDTku_MR.jpg",,"2021-07-14T11:31:00.000Z","Shimla Himachal Pradesh","270","27","5357","2762","https://twitter.com//JalVibhag","Jal Shakti Vibhag HP","@JalVibhag","false","hpiph.org",,"false"
