"avatar","fullname","id","images/0","images/1","images/2","images/3","isQuote","isRetweet","likes","links/0","links/1","links/2","links/3","links/4","links/5","links/6","links/7","links/8","links/9","links/10","links/11","links/12","links/13","quotedTweet/avatar","quotedTweet/fullname","quotedTweet/images/0","quotedTweet/images/1","quotedTweet/images/2","quotedTweet/images/3","quotedTweet/links/0","quotedTweet/links/1","quotedTweet/links/2","quotedTweet/links/3","quotedTweet/links/4","quotedTweet/links/5","quotedTweet/links/6","quotedTweet/links/7","quotedTweet/text","quotedTweet/timestamp","quotedTweet/url","quotedTweet/username","quotes","replies","retweets","searchQuery","text","timestamp","url","user/avatar","user/description","user/joinDate","user/location","user/totalFollowers","user/totalFollowing","user/totalLikes","user/totalTweets","user/url","user/userFullName","user/username","user/verified","user/website","username","verified"
,,"609714624745705473",,,,,"true","false","0",,,,,,,,,,,,,,,"","AKSHAT SOLANKI",,,,,,,,,,,,,"@FLAKE_TheNovel it's captivating.","2015-06-13T13:28:00.000Z","https://twitter.com/imakshatsolanki/status/609713853518118912","@imakshatsolanki","0","1","0","Bachelors","@akshatpt95, author of best-selling novel ""The Bachelor's marriage"" comments on FLAKE.. :-)","2015-06-13T13:31:00.000Z","https://twitter.com/_PankajGiri/status/609714624745705473","https://pbs.twimg.com/profile_images/921679841681842176/igfVsdBd.jpg","Bestselling author of 'The Fragile Thread of Hope'. My latest book 'The Unforgettable Woman' is now available at a bookstore near you and Amazon:","2014-12-18T06:33:00.000Z","Gangtok, India","3352","2356","6854","16573","https://twitter.com//_PankajGiri","Pankaj Giri","@_PankajGiri","false","amzn.to/3sCdZDf",,"false"
,,"1159678939612102656","https://pbs.twimg.com/media/EBgBzfNU4AAYza5.jpg",,,,"false","false","12","https://twitter.com/DBTIndia",,,,,,,,,,,,,,,,,,,,,,,,,,,,,,,,"0","0","0","University","Shannon here in a beautiful traditionally designed hall to hear about chemical ecology in Sikkim with Sikkim University! @DBTIndia","2019-08-09T04:12:00.000Z","https://twitter.com/odorobjects/status/1159678939612102656","https://pbs.twimg.com/profile_images/3543331353/692377f22c13f63317c65a0d9d2b182e.jpeg","Naturalist-Inspired Chemical Ecology","2013-04-18T14:51:00.000Z","Bengaluru, India","861","175","527","1269","https://twitter.com//odorobjects","NICE Group","@odorobjects","false","nicelab.science",,"false"
,,"1197498572867956737","https://pbs.twimg.com/media/EJ5CzV5UYAEIv0H.jpg",,,,"true","false","20","https://twitter.com/dEstInEdnOmAd",,,,,,,,,,,,,,"","CKL","https://pbs.twimg.com/media/EJ5CzV5UYAEIv0H.jpg",,,,"https://twitter.com/WaterThe_Planet","https://twitter.com/GJosephRoche","https://twitter.com/search?q=%23SikkimUniversity",,,,,,"The LaTrobe Himalaya gang ⁦@AlexEDavisNGN⁩ ⁦@WaterThe_Planet⁩ ⁦@GJosephRoche⁩ (hopefully) feeling at home #SikkimUniversity discussing “Melting Opportunities: Managing Climate Change and Conflict in the Himalaya“","2019-11-21T10:53:00.000Z","https://twitter.com/dEstInEdnOmAd/status/1197468039014305792","@dEstInEdnOmAd","0","0","0","University","So great to be visiting Sikkim University again. Thanks @dEstInEdnOmAd","2019-11-21T12:54:00.000Z","https://twitter.com/WaterThe_Planet/status/1197498572867956737","https://pbs.twimg.com/profile_images/878236482443632641/uQNcxTN2.jpg","Ecologies, Histories, Himalaya, and Rivers.

Based at #LaTrobe University in #Naarm on #Wurundjeri Country.","2017-02-08T12:22:00.000Z","Melbourne, Victoria","1340","1450","3496","1692","https://twitter.com//WaterThe_Planet","Ruth Gamble","@WaterThe_Planet","false",,,"false"
"https://pbs.twimg.com/profile_images/1559784619796414465/nxH9J6h-.jpg","Indra Hang Subba","1347513499547652099","https://pbs.twimg.com/media/ErNUX96UcAgULFy.jpg","https://pbs.twimg.com/media/ErNUX97VgAgXIoA.jpg","https://pbs.twimg.com/media/ErNUX9-VoAIC8An.jpg","https://pbs.twimg.com/media/ErNUX96VoAAoeSe.jpg","false","false","24",,,,,,,,,,,,,,,,,,,,,,,,,,,,,,,,,"0","0","1","School","It was great pleasure for me to have attended Chief Minister’s One Mile Golden Run event organised by Govt Sr Sec School Hee Yangthang West Sikkim. Students from different schools participated in the event.","2021-01-08T12:00:00.000Z","https://twitter.com/IndraHangSubba1/status/1347513499547652099","https://pbs.twimg.com/profile_images/1559784619796414465/nxH9J6h-.jpg","Member of Parliament, 17th Lok Sabha.","2014-03-08T14:24:00.000Z","Sikkim, India","4038","322","973","2807","https://twitter.com//IndraHangSubba1","Indra Hang Subba","@IndraHangSubba1","false",,"@IndraHangSubba1","false"
"https://pbs.twimg.com/profile_images/1661385600950214663/sMCCuX4K.jpg","The Voice of Sikkim","1316882245521756160",,,,,"false","false","0","https://piped.video/hQRn_Rx_t1w",,,,,,,,,,,,,,,,,,,,,,,,,,,,,,,,"0","0","0","School","Entertainment 
School Going After 8 Months Lockdown 

piped.video/hQRn_Rx_t1w","2020-10-15T23:22:00.000Z","https://twitter.com/thevoicesikkim/status/1316882245521756160","https://pbs.twimg.com/profile_images/1661385600950214663/sMCCuX4K.jpg","Sikkim’s Most Tweeting News Media","2009-02-09T12:44:00.000Z","Pakyong","9194","302","273","55222","https://twitter.com//thevoicesikkim","The Voice of Sikkim","@thevoicesikkim","false","voiceofsikkim.com","@thevoicesikkim","false"
,,"1054229957105209344","https://pbs.twimg.com/media/DqFgizgUcAAORAK.jpg","https://pbs.twimg.com/media/DqFgjmRU4AAOv6W.jpg",,,"false","false","5","https://twitter.com/pawanchamling5",,,,,,,,,,,,,,,,,,,,,,,,,,,,,,,,"0","0","1","University","Chief Minister Shri @pawanchamling5 visited Bologna University, the oldest University of the world in Bologna, Italy. He was accorded warm welcome by the staff & Vice Rector for International Relations  who conducted a brief tour of the University.","2018-10-22T04:36:00.000Z","https://twitter.com/SanjeetGurung7/status/1054229957105209344","https://pbs.twimg.com/profile_images/1022531980313821186/y7INo3AG.jpg","I am a simple ,hardworking and a humble man, I like to study books, travel new places and learn new things from others. 
I believe in karma.","2018-07-26T17:11:00.000Z","Gangtok","32","93","140","32","https://twitter.com//SanjeetGurung7","Sanjeet Gurung","@SanjeetGurung7","false","sanjeet.com",,"false"
,,"1117407646435479554",,,,,"false","false","0","https://www.instagram.com/p/BwPHb81nuYgp8J4nHHDQ-9nbj5jSWEWGyKRTGk0/?utm_source=ig_twitter_share&igshid=18iype0567tkb",,,,,,,,,,,,,,,,,,,,,,,,,,,,,,,,"0","0","0","University","Reacting Poetry during Workshop taken from Dushyant_Kumar @ Sikkim University instagram.com/p/BwPHb81nuYgp…","2019-04-14T12:41:00.000Z","https://twitter.com/kmpatel99/status/1117407646435479554","https://pbs.twimg.com/profile_images/1235449284243283971/h6km6cb_.jpg","I love to play with sensor and love to design a security Architecture, Now highly motivated for PhD and my AIM is make a better and comfortable digital Society.","2012-02-06T07:40:00.000Z","Bengaluru, India","89","162","127","225","https://twitter.com//kmpatel99","Krishan Mohan Patel","@kmpatel99","false","iotistic.blogpost.com",,"false"
,,"996694822172835842",,,,,"false","false","0","https://twitter.com/netanyahu",,,,,,,,,,,,,,,,,,,,,,,,,,,,,,,,"0","0","0","University","@netanyahu 
Sir Namaskar 
My Son is persuing M-Tech on Water Resourse and Governance from TERI University New Delhi India, now he wants to continue his higher studies on the subject in your good country ,is there any facility or will you permit my son Sir ?","2018-05-16T10:12:00.000Z","https://twitter.com/Somnath44/status/996694822172835842","https://pbs.twimg.com/profile_images/473034907724156928/HnoYlrxR.jpeg","Social Work Dedicated to Sincere People who love themself","2011-07-01T16:42:00.000Z",,"144","282","54","334","https://twitter.com//Somnath44","Indialovers","@Somnath44","false",,,"false"
,,"1069052761617063936","https://pbs.twimg.com/media/DtYJydGU0AAAE3r.jpg",,,,"false","false","3","https://twitter.com/search?q=%23RachnaBooks","https://twitter.com/search?q=%23smalltown","https://twitter.com/search?q=%23bookshop","https://twitter.com/search?q=%23fiction",,,,,,,,,,,,,,,,,,,,,,,,,,,,,"0","0","0","University","#RachnaBooks featured in state public service exam question paper sometime back/ now it has made an appearance in a university student’s answer paper/ (sent over by the lecturer checking the paper) #smalltown #bookshop #fiction","2018-12-02T02:16:00.000Z","https://twitter.com/cafe_fiction/status/1069052761617063936","https://pbs.twimg.com/profile_images/488534838765305857/LrfGLNHV.jpeg","• bookseller + publisher @rachnabooks®• just a guy trying to sell some books • @cafe_fiction®• Innkeeper #BookmansBnB® (Gangtok,Sikkim)","2013-02-21T16:12:00.000Z","Gangtok, Sikkim, INDIA","590","226","4174","3251","https://twitter.com//cafe_fiction","Raman Shresta","@cafe_fiction","false","rachnabooks.com",,"false"
,,"1088779291217850368",,,,,"true","false","1",,,,,,,,,,,,,,,"","Zee News",,,,,"https://twitter.com/search?q=%23NonStopNews","https://twitter.com/sudhirchaudhary","https://twitter.com/search?q=%23DNA",,,,,,"#NonStopNews में देखें- अलीगढ़ मुस्लिम यूनिवर्सिटी में तिरंगा यात्रा निकालना गुनाह है ?

@sudhirchaudhary #DNA","2019-01-23T17:10:00.000Z","https://twitter.com/ZeeNews/status/1088121916861415429","@ZeeNews","0","0","0","University","Aligarh Muslim University aanay walay samay Mai aatanwad paida karnay wali University ban jaigi.","2019-01-25T12:43:00.000Z","https://twitter.com/PunderrSanjeev/status/1088779291217850368","https://pbs.twimg.com/profile_images/1129073200560631808/EFR69_hG.jpg","🚩I will win, not immediately but definitely 🚩","2018-09-07T09:19:00.000Z","Ambala, India","69","133","5849","1134","https://twitter.com//PunderrSanjeev","Sanjeev Pundir(Army)","@PunderrSanjeev","false",,,"true"
"https://pbs.twimg.com/profile_images/1589181965684862977/N9kZp8_g.jpg","Prerna Chettri","1297363097263288320",,,,,"false","false","0",,,,,,,,,,,,,,,,,,,,,,,,,,,,,,,,,"0","0","0","School","Friends' son in NC has resumed his school...once a week.I found that weird!!!!","2020-08-23T02:40:00.000Z","https://twitter.com/prernachettri/status/1297363097263288320","https://pbs.twimg.com/profile_images/1589181965684862977/N9kZp8_g.jpg","Doctor/Traveller.","2009-09-23T14:35:00.000Z","Gangtok,Sikkim,India","5420","680","29979","49611","https://twitter.com//prernachettri","Prerna Chettri","@prernachettri","true",,"@prernachettri","true"
"https://pbs.twimg.com/profile_images/1589181965684862977/N9kZp8_g.jpg","Prerna Chettri","1297053781687820288",,,,,"false","false","0",,,,,,,,,,,,,,,,,,,,,,,,,,,,,,,,,"0","1","0","School","This reminds me...I had a senior in my school by the name, Archana Ganapathy.","2020-08-22T06:11:00.000Z","https://twitter.com/prernachettri/status/1297053781687820288","https://pbs.twimg.com/profile_images/1589181965684862977/N9kZp8_g.jpg","Doctor/Traveller.","2009-09-23T14:35:00.000Z","Gangtok,Sikkim,India","5420","680","29979","49611","https://twitter.com//prernachettri","Prerna Chettri","@prernachettri","true",,"@prernachettri","true"
"https://pbs.twimg.com/profile_images/1661385600950214663/sMCCuX4K.jpg","The Voice of Sikkim","992308279480016898",,,,,"false","false","0","https://www.instagram.com/p/BiWPakNh7p6/?utm_source=twitter",,,,,,,,,,,,,,,,,,,,,,,,,,,,,,,,"0","0","0","University","SRM University Sikkim Kick started the state level two day Tech Fest… instagram.com/p/BiWPakNh7p6/…","2018-05-04T07:41:00.000Z","https://twitter.com/thevoicesikkim/status/992308279480016898","https://pbs.twimg.com/profile_images/1661385600950214663/sMCCuX4K.jpg","Sikkim’s Most Tweeting News Media","2009-02-09T12:44:00.000Z","Pakyong","9194","302","273","55222","https://twitter.com//thevoicesikkim","The Voice of Sikkim","@thevoicesikkim","false","voiceofsikkim.com","@thevoicesikkim","false"
"https://pbs.twimg.com/profile_images/1589181965684862977/N9kZp8_g.jpg","Prerna Chettri","990709145639702528",,,,,"false","false","0","http://www.bbc.co.uk/news/world-australia-43940122",,,,,,,,,,,,,,,,,,,,,,,,,,,,,,,,"0","0","0","University","I saw this on the BBC and thought you should see it:

Rotten durian causes Melbourne university evacuation - bbc.co.uk/news/world-austral…","2018-04-29T21:47:00.000Z","https://twitter.com/prernachettri/status/990709145639702528","https://pbs.twimg.com/profile_images/1589181965684862977/N9kZp8_g.jpg","Doctor/Traveller.","2009-09-23T14:35:00.000Z","Gangtok,Sikkim,India","5420","680","29979","49611","https://twitter.com//prernachettri","Prerna Chettri","@prernachettri","true",,"@prernachettri","true"
"https://pbs.twimg.com/profile_images/1661385600950214663/sMCCuX4K.jpg","The Voice of Sikkim","987270442410012672",,,,,"false","false","0","https://twitter.com/search?q=%23BreakingNewsSikim","https://www.instagram.com/p/BhyceKMg2uN/",,,,,,,,,,,,,,,,,,,,,,,,,,,,,,,"0","0","0","University","#BreakingNewsSikim 
No Conclusive Statement from Sikkim University on Permanent Campus 

Acting… instagram.com/p/BhyceKMg2uN/","2018-04-20T10:03:00.000Z","https://twitter.com/thevoicesikkim/status/987270442410012672","https://pbs.twimg.com/profile_images/1661385600950214663/sMCCuX4K.jpg","Sikkim’s Most Tweeting News Media","2009-02-09T12:44:00.000Z","Pakyong","9194","302","273","55222","https://twitter.com//thevoicesikkim","The Voice of Sikkim","@thevoicesikkim","false","voiceofsikkim.com","@thevoicesikkim","false"
"https://pbs.twimg.com/profile_images/1661385600950214663/sMCCuX4K.jpg","The Voice of Sikkim","987234311999979520",,,,,"false","false","1","https://www.instagram.com/p/BhyMCgrA867/",,,,,,,,,,,,,,,,,,,,,,,,,,,,,,,,"0","0","0","University","Permenant Sikkim Central University Row Protest Demand Followup :- 

Nine Members SUSA Body and… instagram.com/p/BhyMCgrA867/","2018-04-20T07:39:00.000Z","https://twitter.com/thevoicesikkim/status/987234311999979520","https://pbs.twimg.com/profile_images/1661385600950214663/sMCCuX4K.jpg","Sikkim’s Most Tweeting News Media","2009-02-09T12:44:00.000Z","Pakyong","9194","302","273","55222","https://twitter.com//thevoicesikkim","The Voice of Sikkim","@thevoicesikkim","false","voiceofsikkim.com","@thevoicesikkim","false"
"https://pbs.twimg.com/profile_images/1661385600950214663/sMCCuX4K.jpg","The Voice of Sikkim","987228035484041217",,,,,"false","false","3","https://twitter.com/search?q=%23mhrd","https://twitter.com/search?q=%23ugc","https://www.instagram.com/p/BhyJL3WAjvY/",,,,,,,,,,,,,,,,,,,,,,,,,,,,,,"0","0","1","University","SIKKIM CENTRAL UNIVERSITY PERMANENT CAMPUS DAY 02 STUDENT'S PEN DOWN PROTEST DEMAND 

#mhrd #ugc… instagram.com/p/BhyJL3WAjvY/","2018-04-20T07:14:00.000Z","https://twitter.com/thevoicesikkim/status/987228035484041217","https://pbs.twimg.com/profile_images/1661385600950214663/sMCCuX4K.jpg","Sikkim’s Most Tweeting News Media","2009-02-09T12:44:00.000Z","Pakyong","9194","302","273","55222","https://twitter.com//thevoicesikkim","The Voice of Sikkim","@thevoicesikkim","false","voiceofsikkim.com","@thevoicesikkim","false"
"https://pbs.twimg.com/profile_images/1661385600950214663/sMCCuX4K.jpg","The Voice of Sikkim","1294476190892412929","https://pbs.twimg.com/media/EfbnNbRWsAYItFD.jpg",,,,"false","false","51","https://twitter.com/PMOIndia","https://twitter.com/SrBachchan","https://twitter.com/rajnathsingh","https://twitter.com/Republic_Bharat","https://twitter.com/AmitShah","https://twitter.com/narendramodi_in","https://twitter.com/adgpi",,,,,,,,,,,,,,,,,,,,,,,,,,"2","0","8","School","Picture Of The Day, Amid Covid 19 Just Single Kid Hoisting Flag In His School On Auspicious 74th I Day 2020.

Kid Name - Kinchum Lepcha
Class I
Pachak Sec School
Duga BAC,East Sikkim

@PMOIndia @GolayPs @SrBachchan @rajnathsingh @Republic_Bharat @AmitShah @narendramodi_in @adgpi","2020-08-15T03:29:00.000Z","https://twitter.com/thevoicesikkim/status/1294476190892412929","https://pbs.twimg.com/profile_images/1661385600950214663/sMCCuX4K.jpg","Sikkim’s Most Tweeting News Media","2009-02-09T12:44:00.000Z","Pakyong","9194","302","273","55222","https://twitter.com//thevoicesikkim","The Voice of Sikkim","@thevoicesikkim","false","voiceofsikkim.com","@thevoicesikkim","false"
,,"1381219815164051458",,,,,"false","false","0","https://twitter.com/search?q=%23jio",,,,,,,,,,,,,,,,,,,,,,,,,,,,,,,,"0","0","0","University","#jio network
Jio network is very slow in my location, Sikkim Manipal University, Gangtok, Sikkim. My network no:79085 15865. Last 15 days not able to get proper support. This issue will be not considered in service center, I will be plan to shift the portal.","2021-04-11T12:17:00.000Z","https://twitter.com/mohamsuhail/status/1381219815164051458","https://pbs.twimg.com/profile_images/1064203394431180801/k-zBO2ZK.jpg","Health Care/ Medical Equipment Procurement/","2016-01-24T06:38:00.000Z","Tanzania","19","391","91","92","https://twitter.com//mohamsuhail","Mohamed Ali","@mohamsuhail","false",,,"false"
,,"1064986031642951680",,,,,"false","false","0","https://www.instagram.com/p/BqapZWNnCGdh5gaYTlV1Xdfuhg8VCxLKLNzPX80/?utm_source=ig_twitter_share&igshid=vfdzw2fafokj",,,,,,,,,,,,,,,,,,,,,,,,,,,,,,,,"0","0","0","University","Knight Rider = Night Ride 🏁 @ Sikkim-Manipal University of Health instagram.com/p/BqapZWNnCGdh…","2018-11-20T20:57:00.000Z","https://twitter.com/EhrazKhan4/status/1064986031642951680","https://pbs.twimg.com/profile_images/948315803870375936/OLZNW73f.jpg","Uploading","2017-12-27T19:38:00.000Z","Kolkata, India","21","200","906","217","https://twitter.com//EhrazKhan4","Ehraz Khan","@EhrazKhan4","false",,,"false"
,,"1319527414876127232","https://pbs.twimg.com/media/Ek_nK3YU8AAF-tD.jpg","https://pbs.twimg.com/media/Ek_nK3aUcAEa1ol.jpg","https://pbs.twimg.com/media/Ek_nK3tVkAA5wZg.jpg","https://pbs.twimg.com/media/Ek_nK3wU0AAJ69P.jpg","false","false","19","https://twitter.com/search?q=%23bestwishes","https://twitter.com/search?q=%23educationforall",,,,,,,,,,,,,,,,,,,,,,,,,,,,,,,"0","0","0","college","Ongoing counselling for admission of left out students to different colleges within Sikkim. 
#bestwishes 
#educationforall","2020-10-23T06:33:00.000Z","https://twitter.com/IndraHangSubba1/status/1319527414876127232","https://pbs.twimg.com/profile_images/1559784619796414465/nxH9J6h-.jpg","Member of Parliament, 17th Lok Sabha.","2014-03-08T14:24:00.000Z","Sikkim, India","4038","322","973","2807","https://twitter.com//IndraHangSubba1","Indra Hang Subba","@IndraHangSubba1","false",,,"false"
,,"1330501867047010304",,,,,"false","false","16",,,,,,,,,,,,,,,,,,,,,,,,,,,,,,,,,"0","1","0","college","Name- priya sharma trisu
Place-sikkim india
Age- 18
Qualification- still studying
Doing graduation in nepali from namchi government college kamrang in sikkim
Aru kei sodhnu xa❓","2020-11-22T13:22:00.000Z","https://twitter.com/PriyaTrisu/status/1330501867047010304","https://pbs.twimg.com/profile_images/1397143040624533504/f2pJbVej.jpg","My passion 🎶singing

❣️❣️❣️❣️working on netsurf communication private limited company","2020-06-19T13:22:00.000Z","रंगपो, भारत sikkim","341","691","996","148","https://twitter.com//PriyaTrisu","Priya TriSu","@PriyaTrisu","false",,,"false"
,,"1294957389230174208",,,,,"false","false","2",,,,,,,,,,,,,,,,,,,,,,,,,,,,,,,,,"0","1","1","college","I’m the one who ignores all the hate comment and tweet about MewGulf but there is a word called limit telling them they are annoying and all in live isn’t the way did i or anyone of us forced you to join the live go get a life dear more over you might be a school/college student","2020-08-16T11:21:00.000Z","https://twitter.com/KunzangU/status/1294957389230174208","https://pbs.twimg.com/profile_images/1419713253454716945/z1Lg0QO_.jpg","🌈♥️💜🍓✨","2018-09-20T13:18:00.000Z","Sky 🍓","37","142","12909","6664","https://twitter.com//KunzangU","Kunzang Uden","@KunzangU","false",,,"false"
"https://pbs.twimg.com/profile_images/1661385600950214663/sMCCuX4K.jpg","The Voice of Sikkim","1240673174821486594",,,,,"false","false","1","https://www.instagram.com/p/B96-sJ-J4BU/?igshid=1hc0nwheo3ree",,,,,,,,,,,,,,,,,,,,,,,,,,,,,,,,"0","0","0","college","Today, the Chief Minister Sh PS Tamang (Golay) met the Student Representatives and students of Gyalshing Degree College at Samman Bhawan, Gangtok. The meeting was held to discuss the problem regarding the long… instagram.com/p/B96-sJ-J4BU/…","2020-03-19T16:15:00.000Z","https://twitter.com/thevoicesikkim/status/1240673174821486594","https://pbs.twimg.com/profile_images/1661385600950214663/sMCCuX4K.jpg","Sikkim’s Most Tweeting News Media","2009-02-09T12:44:00.000Z","Pakyong","9194","302","273","55222","https://twitter.com//thevoicesikkim","The Voice of Sikkim","@thevoicesikkim","false","voiceofsikkim.com","@thevoicesikkim","false"
"https://pbs.twimg.com/profile_images/1661385600950214663/sMCCuX4K.jpg","The Voice of Sikkim","1239533606055403520","https://pbs.twimg.com/media/ETO1PApX0AEUCd9.jpg",,,,"false","false","10","https://twitter.com/search?q=%23BreakingNewsSikkim","https://twitter.com/search?q=%23psgolay","https://twitter.com/search?q=%23cmosikkim","https://twitter.com/search?q=%23govos",,,,,,,,,,,,,,,,,,,,,,,,,,,,,"1","2","1","college","#BreakingNewsSikkim 
Govt of Sikkim Makes Announcement On Coronavirus Outbreak 

In Sikkim Disco, Cinema Halls, Casino, Gyms, Melas, Tambola, Schools and Colleges Closed till 15th April 2020.

#psgolay #cmosikkim #govos","2020-03-16T12:46:00.000Z","https://twitter.com/thevoicesikkim/status/1239533606055403520","https://pbs.twimg.com/profile_images/1661385600950214663/sMCCuX4K.jpg","Sikkim’s Most Tweeting News Media","2009-02-09T12:44:00.000Z","Pakyong","9194","302","273","55222","https://twitter.com//thevoicesikkim","The Voice of Sikkim","@thevoicesikkim","false","voiceofsikkim.com","@thevoicesikkim","false"
"https://pbs.twimg.com/profile_images/1270289912802291716/Pg5EIgSA.jpg","ANUGAMINI","1239514807088242688",,,,,"false","false","0","https://twitter.com/search?q=%23Sikkim","https://twitter.com/search?q=%23Coronaindia",,,,,,,,,,,,,,,,,,,,,,,,,,,,,,,"0","0","0","college","Chief Minister of #Sikkim Shri PS Golay announcement in high level meeting.
Govt. and Private Schools , Domestic tourist,  Disco, Cinema Halls, Casino, Gyms, Melas, Tambola, and Colleges closed till 15th April 2020
Government will issue notification in this regards.
#Coronaindia","2020-03-16T11:32:00.000Z","https://twitter.com/anugamini2/status/1239514807088242688","https://pbs.twimg.com/profile_images/1270289912802291716/Pg5EIgSA.jpg","Leading Hindi Daily Newspaper Published from #Sikkim","2018-03-05T09:56:00.000Z","Gangtok","138","282","2705","1929","https://twitter.com//anugamini2","ANUGAMINI","@anugamini2","false",,"@anugamini2","false"
"https://pbs.twimg.com/profile_images/1661385600950214663/sMCCuX4K.jpg","The Voice of Sikkim","1185355319938994176",,,,,"false","false","2","https://twitter.com/search?q=%23psgolay","https://twitter.com/search?q=%23cmosikkim","https://twitter.com/search?q=%23sikkimgovernment","https://twitter.com/search?q=%23Sikkimkrantikarimorcha","https://twitter.com/search?q=%23skmparty","https://piped.video/3Bgs7DGQGX0",,,,,,,,,,,,,,,,,,,,,,,,,,,"0","0","0","college","CM Sh PS Tamang (Golay) Speech at Kamrang College Ground, Namchi 
18 Oct 2019

#psgolay #cmosikkim #sikkimgovernment #Sikkimkrantikarimorcha #skmparty
piped.video/3Bgs7DGQGX0","2019-10-19T00:41:00.000Z","https://twitter.com/thevoicesikkim/status/1185355319938994176","https://pbs.twimg.com/profile_images/1661385600950214663/sMCCuX4K.jpg","Sikkim’s Most Tweeting News Media","2009-02-09T12:44:00.000Z","Pakyong","9194","302","273","55222","https://twitter.com//thevoicesikkim","The Voice of Sikkim","@thevoicesikkim","false","voiceofsikkim.com","@thevoicesikkim","false"
"https://pbs.twimg.com/profile_images/1661385600950214663/sMCCuX4K.jpg","The Voice of Sikkim","1126290604214722561","https://pbs.twimg.com/media/D6FjUotV4AA-7vg.jpg",,,,"false","false","0","https://twitter.com/AICTE_INDIA","https://twitter.com/search?q=%23aicte","https://twitter.com/adsahasrabudhe",,,,,,,,,,,,,,,,,,,,,,,,,,,,,,"0","0","0","college","@AICTE_INDIA #aicte rejects recognition of Golaghat Engg College , Assam. What about fate of Sikkim State Run Polytechnics which are facing slew of shortcomings and matter is in High Court ? As well as newly opened Engg College under same roof of Polytechnic

@adsahasrabudhe","2019-05-09T00:59:00.000Z","https://twitter.com/thevoicesikkim/status/1126290604214722561","https://pbs.twimg.com/profile_images/1661385600950214663/sMCCuX4K.jpg","Sikkim’s Most Tweeting News Media","2009-02-09T12:44:00.000Z","Pakyong","9194","302","273","55222","https://twitter.com//thevoicesikkim","The Voice of Sikkim","@thevoicesikkim","false","voiceofsikkim.com","@thevoicesikkim","false"
,,"1315913261418598400",,,,,"false","false","0",,,,,,,,,,,,,,,,,,,,,,,,,,,,,,,,,"0","0","0","college","People trying to give justice to rape victims by keeping black dp is as useless as cc camera of your college.","2020-10-13T07:12:00.000Z","https://twitter.com/whodajubhai/status/1315913261418598400","https://pbs.twimg.com/profile_images/1289636864937226241/GwHX14se.jpg","I will find you and make you laugh","2020-08-01T18:56:00.000Z","Sikkim, India","1","0","4","55","https://twitter.com//whodajubhai","whodajubhai","@whodajubhai","false","piped.video/RYnbZnC9r6s",,"false"
