avatar,fullname,id,images/0,images/1,images/2,images/3,isQuote,isRetweet,likes,links/0,links/1,links/2,links/3,links/4,links/5,links/6,links/7,links/8,links/9,links/10,links/11,links/12,links/13,links/14,links/15,links/16,links/17,links/18,quotedTweet/avatar,quotedTweet/fullname,quotedTweet/images/0,quotedTweet/images/1,quotedTweet/images/2,quotedTweet/images/3,quotedTweet/links/0,quotedTweet/links/1,quotedTweet/links/2,quotedTweet/links/3,quotedTweet/links/4,quotedTweet/links/5,quotedTweet/links/6,quotedTweet/links/7,quotedTweet/links/8,quotedTweet/text,quotedTweet/timestamp,quotedTweet/url,quotedTweet/username,quotes,replies,retweets,searchQuery,text,timestamp,url,user/avatar,user/description,user/joinDate,user/location,user/totalFollowers,user/totalFollowing,user/totalLikes,user/totalTweets,user/url,user/userFullName,user/username,user/verified,user/website,username,verified
,,1401407662844125185,https://pbs.twimg.com/media/E3LM1xMVkAA6amA.jpg,,,,False,False,25,https://twitter.com/RatanLalNath1,https://twitter.com/EduMinOfIndia,,,,,,,,,,,,,,,,,,,,,,,,,,,,,,,,,,,,,2,3,22,exams,case ice state boards cancel exams cant tempura assamthis kind discrimination happened long wait final decisions need move studies,2021-06-06T05:16:00.000Z,https://twitter.com/UdichiD/status/1401407662844125185,https://pbs.twimg.com/profile_images/1327625106709827585/2QKf-7Do.jpg,"♋🇨 🇦 🇳 🇨 🇪 🇷 ♋
📍19📍
 𝐁𝐄𝐍𝐆𝐀𝐋𝐈🍂
🍁𝐿.𝑂.𝑆.𝑇🍁
#cancelTripuraboardexams",2020-11-14T14:50:00.000Z,"Tripura, India",36,31,256,68,https://twitter.com//UdichiD,Udichi Das,@UdichiD,False,,,False
,,1268201382886203393,,,,,False,False,3,https://twitter.com/HRDMinistry,https://twitter.com/DrRPNishank,,,,,,,,,,,,,,,,,,,,,,,,,,,,,,,,,,,,,0,0,0,University,sir tripuracollege student and years behalf friends want appeal please suggest central universities clear matter exams held held final semester,2020-06-03T15:22:00.000Z,https://twitter.com/NirbanChowdhury/status/1268201382886203393,https://pbs.twimg.com/profile_images/1531887904741478400/Obb-QeoH.jpg,Civil Service aspirant,2018-02-27T12:04:00.000Z,"Agartala, India",86,101,46904,22,https://twitter.com//NirbanChowdhury,Nirban Chowdhury,@NirbanChowdhury,False,,,False
,,1274032387329003520,,,,,False,False,0,https://www.instagram.com/p/CBoAtwZl5_m/?igshid=1o67ej6ztd42j,,,,,,,,,,,,,,,,,,,,,,,,,,,,,,,,,,,,,,0,0,0,University,tempura university central university,2020-06-19T17:32:00.000Z,https://twitter.com/Prasanjit_mcom/status/1274032387329003520,https://pbs.twimg.com/profile_images/1492481694817206275/fJdkGZiK.jpg,"(http://pjitdebnath)
Tripura, Belonia
7629988920",2019-02-13T03:52:00.000Z,Tripura,29,132,268,237,https://twitter.com//Prasanjit_mcom,Prasanjit Debnath,@Prasanjit_mcom,False,,,False
,,1309544140745535488,,,,,False,False,3,https://twitter.com/nsui_tripura,https://twitter.com/nsui,,,,,,,,,,,,,,,,,,,,,,,,,,,,,,,,,,,,,0,0,1,college,today whereas director pressure director meet discussed various issuesthe issues corruption publication online merit list college demand students get admission right way,2020-09-25T17:23:00.000Z,https://twitter.com/RakeshDasiyc/status/1309544140745535488,https://pbs.twimg.com/profile_images/1582649810632708096/fFeDlSR7.jpg,"Member @INCTripura ,Ex-Vice-President @AITC4Tripura Youth Committee, Ex-State President of #Tripura State @NSUI Views Personal",2017-01-27T07:50:00.000Z,"Agartala, India",828,745,2845,1396,https://twitter.com//RakeshDasiyc,Rakesh Das,@RakeshDasiyc,False,,,False
https://pbs.twimg.com/profile_images/1398253519094763522/b10Nhvic.jpg,Raju Ghosh,1342501144803741696,,,,,False,False,0,,,,,,,,,,,,,,,,,,,,,,,,,,,,,,,,,,,,,,,0,0,0,School,sir compulsory thought bhagavat git school slabs beginning youth cultured bharatiya gurukul sanskrit jai hind jai chart,2020-12-25T16:03:00.000Z,https://twitter.com/RajuGho82700901/status/1342501144803741696,https://pbs.twimg.com/profile_images/1398253519094763522/b10Nhvic.jpg,"Mechanical Engg, Cummins India Ltd",2018-01-15T14:01:00.000Z,"Agartala, India",51,201,58758,1243,https://twitter.com//RajuGho82700901,Raju Ghosh,@RajuGho82700901,False,,@RajuGho82700901,False
https://pbs.twimg.com/profile_images/1661677441377775617/AAj05II-.jpg,News Record,1294682956078780416,,,,,False,False,0,https://twitter.com/BjpBiplab,https://www.fastnation.in/?p=26369,,,,,,,,,,,,,,,,,,,,,,,,,,,,,,,,,,,,,0,0,0,college,with independence day tempura announces state first medical college outside agartala fastnationinp26369,2020-08-15T17:10:00.000Z,https://twitter.com/NewsRecordindia/status/1294682956078780416,https://pbs.twimg.com/profile_images/1661677441377775617/AAj05II-.jpg,"newsrecord.in - Most Popular News Websites in the India & all type of Latest News - India, Politics, Sports, Entertainment, Futures, More News .",2015-02-09T14:32:00.000Z,India,815,1658,3261,13761,https://twitter.com//NewsRecordindia,News Record,@NewsRecordindia,False,newsrecord.in/,@NewsRecordindia,False
https://pbs.twimg.com/profile_images/935431705577455616/6hRKZY0t.jpg,Tarit Kanti Chakma,1293783487808303104,https://pbs.twimg.com/media/EfRxJ72VoAAJ56T.jpg,,,,False,False,6,https://twitter.com/NitSurathkal,https://twitter.com/BANGDA,,,,,,,,,,,,,,,,,,,,,,,,,,,,,,,,,,,,,0,1,0,college,college days best bro miss bangalore sea foods fish fry,2020-08-13T05:36:00.000Z,https://twitter.com/ChakmaTarit/status/1293783487808303104,https://pbs.twimg.com/profile_images/935431705577455616/6hRKZY0t.jpg,"District Magistrate & Collector,Gomati.
A Happy Gardener & Nemophilist/Tweets are personal/RTs nt endorsement",2017-11-28T07:46:00.000Z,"Agartala, India",7610,495,2685,841,https://twitter.com//ChakmaTarit,Tarit Kanti Chakma,@ChakmaTarit,False,,@ChakmaTarit,False
https://pbs.twimg.com/profile_images/1700504780244647936/pcP_KVHk.jpg,Ratan Lal Nath,1292809464278446080,https://pbs.twimg.com/media/EfD7WwLUEAMDOZV.jpg,,,,False,False,17,,,,,,,,,,,,,,,,,,,,,,,,,,,,,,,,,,,,,,,0,1,6,college,new step providing ease transparency admission general degree collegesthe common admission portal general degree college tempura live today portal students apply course guys tempura based eligibility,2020-08-10T13:06:00.000Z,https://twitter.com/RatanLalNath1/status/1292809464278446080,https://pbs.twimg.com/profile_images/1700504780244647936/pcP_KVHk.jpg,"Minister of Power, Agriculture & Farmer's Welfare and Election Department, Govt. of Tripura.",2019-01-01T07:04:00.000Z,"Tripura, India",11352,251,4927,5087,https://twitter.com//RatanLalNath1,Ratan Lal Nath,@RatanLalNath1,False,,@RatanLalNath1,False
https://pbs.twimg.com/profile_images/1700504780244647936/pcP_KVHk.jpg,Ratan Lal Nath,1291735334128979968,https://pbs.twimg.com/media/Ee0qa5FUMAEnuGi.jpg,https://pbs.twimg.com/media/Ee0qbhwVAAEvjtm.jpg,https://pbs.twimg.com/media/Ee0qcHLUwAEhe36.jpg,,False,False,20,https://piped.video/watch?v=JU1BQNxf2Ss,,,,,,,,,,,,,,,,,,,,,,,,,,,,,,,,,,,,,,0,1,5,college,participated international seminar neither east west vistas post colonial discourses organised english department womens college,2020-08-07T13:57:00.000Z,https://twitter.com/RatanLalNath1/status/1291735334128979968,https://pbs.twimg.com/profile_images/1700504780244647936/pcP_KVHk.jpg,"Minister of Power, Agriculture & Farmer's Welfare and Election Department, Govt. of Tripura.",2019-01-01T07:04:00.000Z,"Tripura, India",11352,251,4927,5087,https://twitter.com//RatanLalNath1,Ratan Lal Nath,@RatanLalNath1,False,,@RatanLalNath1,False
https://pbs.twimg.com/profile_images/1700504780244647936/pcP_KVHk.jpg,Ratan Lal Nath,1290621762510548998,,,,,False,False,65,,,,,,,,,,,,,,,,,,,,,,,,,,,,,,,,,,,,,,,1,4,50,college,launch online admission portal general degree colleges system make admission procedure easy transparent,2020-08-04T12:13:00.000Z,https://twitter.com/RatanLalNath1/status/1290621762510548998,https://pbs.twimg.com/profile_images/1700504780244647936/pcP_KVHk.jpg,"Minister of Power, Agriculture & Farmer's Welfare and Election Department, Govt. of Tripura.",2019-01-01T07:04:00.000Z,"Tripura, India",11352,251,4927,5087,https://twitter.com//RatanLalNath1,Ratan Lal Nath,@RatanLalNath1,False,,@RatanLalNath1,False
https://pbs.twimg.com/profile_images/913599174309851136/e5b1Lgka.jpg,Swanirbhar Majumder,1276315449156722688,,,,,False,False,2,,,,,,,,,,,,,,,,,,,,,,,,,,,,,,,,,,,,,,,0,0,0,college,write thank note every month someone past willingly unwittingly helped boss senior college even neighbor purely selfish reasons nothing makes feel better sending unsolicited thank,2020-06-26T00:44:00.000Z,https://twitter.com/swanirbhar/status/1276315449156722688,https://pbs.twimg.com/profile_images/913599174309851136/e5b1Lgka.jpg,Academician/ Researcher/ Nerd/ foodaholic/ movie maniac/ self-proclaimed 24x7 social network celebrity and faculty of electronics and IT. SPOC SWAYAM and NPTEL,2009-11-12T16:09:00.000Z,"Tripura, India",312,276,6837,36275,https://twitter.com//swanirbhar,Swanirbhar Majumder,@swanirbhar,False,swanirbharmajumder.com/,@swanirbhar,False
https://pbs.twimg.com/profile_images/1376918940090253314/hUCeiyfg.jpg,ABVP Tripura,1263692585740140544,,,,,False,False,1,https://twitter.com/search?q=%23ABVPForEducation,,,,,,,,,,,,,,,,,,,,,,,,,,,,,,,,,,,,,,0,0,2,University,aware current situation country time quite difficult open schools universities right play future students making issue examinations abvpforeducation,2020-05-22T04:46:00.000Z,https://twitter.com/ABVPTripura/status/1263692585740140544,https://pbs.twimg.com/profile_images/1376918940090253314/hUCeiyfg.jpg,"Official Twitter Handle - Tripura Pradesh , Akhil Bharatiya Vidyarthi Parishad (ABVP) | Official National Handle : @ABVPvoice",2020-04-07T13:28:00.000Z,"Tripura, India",1510,63,2425,3414,https://twitter.com//ABVPTripura,ABVP Tripura,@ABVPTripura,False,,@ABVPTripura,False
https://pbs.twimg.com/profile_images/1723378632054456320/Sab4QdZ7.jpg,Prasenjit Das,1263164936261439488,https://pbs.twimg.com/media/EYepv4GWAAEn8-N.jpg,https://pbs.twimg.com/media/EYepx7NX0AA1oE7.jpg,https://pbs.twimg.com/media/EYepyWtWoAMBKdr.jpg,,False,False,13,https://twitter.com/DeveshTiwariINC,,,,,,,,,,,,,,,,,,,,,,,,,,,,,,,,,,,,,,1,1,2,University,congratulations brother national coordinator social media sui incharge doon university dehradun ranch universityranchi,2020-05-20T17:49:00.000Z,https://twitter.com/PrasenjitDas_/status/1263164936261439488,https://pbs.twimg.com/profile_images/1723378632054456320/Sab4QdZ7.jpg,Editor-in-Chief @NewsRecordindia | Former Vice President Tripura State @iyctripura & @NSUI |,2011-12-30T13:22:00.000Z,"Tripura, India",1242,58,9021,17106,https://twitter.com//PrasenjitDas_,Prasenjit Das,@PrasenjitDas_,False,banglahunt.com/nsuis-vp-reac…,@PrasenjitDas_,False
https://pbs.twimg.com/profile_images/1254423948449550338/dF45fOrl.jpg,uniquecareersolution.com,1257950202104811520,https://pbs.twimg.com/media/EXUjCnUWsAAAdom.jpg,,,,False,False,0,https://twitter.com/search?q=%23AnushkaSharma,http://www.uniquecareersolution.com,,,,,,,,,,,,,,,,,,,,,,,,,,,,,,,,,,,,,0,0,0,University,know anushkasharma education career passed mount carmel college bangalore affiliated bangalore university direct admission mount carnal college call 7005127202 visit uniquecareersolutioncom,2020-05-06T08:27:00.000Z,https://twitter.com/UCSupdates/status/1257950202104811520,https://pbs.twimg.com/profile_images/1254423948449550338/dF45fOrl.jpg,A warm welcome to our profile.We are the leading and trustworthy education consultancy service company from North East.Visit uniquecareersolution.com,2018-05-15T17:54:00.000Z,"Agartala, India",19,121,1,111,https://twitter.com//UCSupdates,uniquecareersolution.com,@UCSupdates,False,uniquecareersolution.com,@UCSupdates,False
https://pbs.twimg.com/profile_images/1254423948449550338/dF45fOrl.jpg,uniquecareersolution.com,1257586648382091264,https://pbs.twimg.com/media/EXPYZAoWAAAi9qm.jpg,,,,False,False,0,,,,,,,,,,,,,,,,,,,,,,,,,,,,,,,,,,,,,,,0,0,0,University,unique career solution consulting assists family students making educational decisions services may include helping find india overseas college university enrollment good fit student experience team assist also good placement,2020-05-05T08:23:00.000Z,https://twitter.com/UCSupdates/status/1257586648382091264,https://pbs.twimg.com/profile_images/1254423948449550338/dF45fOrl.jpg,A warm welcome to our profile.We are the leading and trustworthy education consultancy service company from North East.Visit uniquecareersolution.com,2018-05-15T17:54:00.000Z,"Agartala, India",19,121,1,111,https://twitter.com//UCSupdates,uniquecareersolution.com,@UCSupdates,False,uniquecareersolution.com,@UCSupdates,False
https://pbs.twimg.com/profile_images/1254423948449550338/dF45fOrl.jpg,uniquecareersolution.com,1256813296361095168,https://pbs.twimg.com/media/EXEZBeoXkAUOd8y.jpg,,,,False,False,1,http://www.uniquecareersolution.com,,,,,,,,,,,,,,,,,,,,,,,,,,,,,,,,,,,,,,0,0,0,University,know rahul admission assistance call 7005127202 visit uniquecareersolutioncom join university one exceptional stateoftheart infrastructure facility study private deemed university karnataka narc grade,2020-05-03T05:10:00.000Z,https://twitter.com/UCSupdates/status/1256813296361095168,https://pbs.twimg.com/profile_images/1254423948449550338/dF45fOrl.jpg,A warm welcome to our profile.We are the leading and trustworthy education consultancy service company from North East.Visit uniquecareersolution.com,2018-05-15T17:54:00.000Z,"Agartala, India",19,121,1,111,https://twitter.com//UCSupdates,uniquecareersolution.com,@UCSupdates,False,uniquecareersolution.com,@UCSupdates,False
https://pbs.twimg.com/profile_images/1554429492680015872/H2Q_16m0.jpg,PIB in Tripura,1401048412066222084,https://pbs.twimg.com/media/E3GGFx9VIAYYk5f.jpg,,,,False,False,1,https://twitter.com/search?q=%23NIOS,,,,,,,,,,,,,,,,,,,,,,,,,,,,,,,,,,,,,,0,0,1,exams,national institute open schooling nos with board exams 2021 cancelled,2021-06-05T05:29:00.000Z,https://twitter.com/PIBAgartala/status/1401048412066222084,https://pbs.twimg.com/profile_images/1554429492680015872/H2Q_16m0.jpg,"Official Twitter account of Press Information Bureau, Government of India, Agartala, Tripura.",2017-08-28T07:15:00.000Z,"Agartala, India",6353,411,626,40746,https://twitter.com//PIBAgartala,PIB in Tripura,@PIBAgartala,True,,@PIBAgartala,True
https://pbs.twimg.com/profile_images/1658750445475762176/oMseCTfK.jpg,Abhijit Paul,1400821262813827074,,,,,False,False,1,https://twitter.com/RatanLalNath1,https://twitter.com/BjpBiplab,https://twitter.com/search?q=%23canceltbse12thboardexams2021,https://twitter.com/search?q=%23SupremeCourtofIndia,https://twitter.com/search?q=%23cancelboardexam,https://twitter.com/search?q=%23modijisave12thstudents,,,,,,,,,,,,,,,,,,,,,,,,,,,,,,,,,0,0,1,exams,sir please cancel state board exam canceltbse12thboardexams2021 supremecourtofindia cancelboardexam modijisave12thstudents,2021-06-04T14:26:00.000Z,https://twitter.com/AJAbhijitPaul/status/1400821262813827074,https://pbs.twimg.com/profile_images/1658750445475762176/oMseCTfK.jpg,"📸 || FREELANCE PHOTOGRAPHER ||
                   🎦 || CINEMATOGRAPHER ||",2020-11-18T05:36:00.000Z,"Tripura, India",17,135,1459,161,https://twitter.com//AJAbhijitPaul,Abhijit Paul,@AJAbhijitPaul,False,facebook.com/AJAbhijit.in,@AJAbhijitPaul,False
https://pbs.twimg.com/profile_images/1658750445475762176/oMseCTfK.jpg,Abhijit Paul,1400820268155637761,https://pbs.twimg.com/media/E3CWWJJVIAE9ej2.jpg,https://pbs.twimg.com/media/E3CWWJHUUAM8DBb.jpg,,,True,False,1,https://twitter.com/RatanLalNath1,https://twitter.com/DrRPNishank,https://twitter.com/BjpBiplab,https://twitter.com/RatanLalNath1,https://twitter.com/narendramodi,https://twitter.com/search?q=%23cancle12thboardexam2021,https://twitter.com/search?q=%23SupremeCourtofIndia,,,,,,,,,,,,,,Dr. Ramesh Pokhriyal Nishank,https://pbs.twimg.com/media/E3CWWJJVIAE9ej2.jpg,https://pbs.twimg.com/media/E3CWWJHUUAM8DBb.jpg,,,https://twitter.com/niostwit,,,,,,,,,"Keeping the safety and security of our students on priority, NIOS cancels class 12 examinations. Students will be evaluated based on objective criteria to be announced soon. This will benefit around 1.75 Lakhs students.

@niostwit",2021-06-04T12:01:00.000Z,https://twitter.com/DrRPNishank/status/1400784803641786372,@DrRPNishank,0,0,1,exams,dear sir please cancel tase board exam cancle12thboardexam2021 supremecourtofindia,2021-06-04T14:22:00.000Z,https://twitter.com/AJAbhijitPaul/status/1400820268155637761,https://pbs.twimg.com/profile_images/1658750445475762176/oMseCTfK.jpg,"📸 || FREELANCE PHOTOGRAPHER ||
                   🎦 || CINEMATOGRAPHER ||",2020-11-18T05:36:00.000Z,"Tripura, India",17,135,1459,161,https://twitter.com//AJAbhijitPaul,Abhijit Paul,@AJAbhijitPaul,False,facebook.com/AJAbhijit.in,@AJAbhijitPaul,True
https://pbs.twimg.com/profile_images/1658750445475762176/oMseCTfK.jpg,Abhijit Paul,1400484377902022664,,,,,False,False,5,https://twitter.com/DrRPNishank,https://twitter.com/RatanLalNath1,https://twitter.com/search?q=%23cancle12thboardexam2021,https://twitter.com/search?q=%23CancleStateBoardExams,https://twitter.com/search?q=%23StateboardExams,,,,,,,,,,,,,,,,,,,,,,,,,,,,,,,,,,0,0,1,exams,sir please cancel tase board exam cancle12thboardexam2021 canclestateboardexams stateboardexams,2021-06-03T16:07:00.000Z,https://twitter.com/AJAbhijitPaul/status/1400484377902022664,https://pbs.twimg.com/profile_images/1658750445475762176/oMseCTfK.jpg,"📸 || FREELANCE PHOTOGRAPHER ||
                   🎦 || CINEMATOGRAPHER ||",2020-11-18T05:36:00.000Z,"Tripura, India",17,135,1459,161,https://twitter.com//AJAbhijitPaul,Abhijit Paul,@AJAbhijitPaul,False,facebook.com/AJAbhijit.in,@AJAbhijitPaul,False
https://pbs.twimg.com/profile_images/1658750445475762176/oMseCTfK.jpg,Abhijit Paul,1400353291578470400,,,,,False,False,1,https://twitter.com/RatanLalNath1,https://twitter.com/search?q=%23cancleboardexams2021,https://twitter.com/search?q=%23cancleTBSEboardexam,,,,,,,,,,,,,,,,,,,,,,,,,,,,,,,,,,,,0,0,0,exams,sir please cancel tase board exam cancleboardexams2021 cancletbseboardexam,2021-06-03T07:26:00.000Z,https://twitter.com/AJAbhijitPaul/status/1400353291578470400,https://pbs.twimg.com/profile_images/1658750445475762176/oMseCTfK.jpg,"📸 || FREELANCE PHOTOGRAPHER ||
                   🎦 || CINEMATOGRAPHER ||",2020-11-18T05:36:00.000Z,"Tripura, India",17,135,1459,161,https://twitter.com//AJAbhijitPaul,Abhijit Paul,@AJAbhijitPaul,False,facebook.com/AJAbhijit.in,@AJAbhijitPaul,False
,,1401588050287759361,,,,,False,False,4,https://twitter.com/search?q=%23CancelTripuraboardexams,https://twitter.com/search?q=%23CancelTripuraboardexams,https://twitter.com/RatanLalNath1,https://twitter.com/narendramodi,https://twitter.com/EduMinOfIndia,,,,,,,,,,,,,,,,,,,,,,,,,,,,,,,,,,0,0,3,exams,respected sir lives matters dont need sympathy looking lives please favourcancel exams canceltripuraboardexams canceltripuraboardexams,2021-06-06T17:13:00.000Z,https://twitter.com/UdichiD/status/1401588050287759361,https://pbs.twimg.com/profile_images/1327625106709827585/2QKf-7Do.jpg,"♋🇨 🇦 🇳 🇨 🇪 🇷 ♋
📍19📍
 𝐁𝐄𝐍𝐆𝐀𝐋𝐈🍂
🍁𝐿.𝑂.𝑆.𝑇🍁
#cancelTripuraboardexams",2020-11-14T14:50:00.000Z,"Tripura, India",36,31,256,68,https://twitter.com//UdichiD,Udichi Das,@UdichiD,False,,,False
https://pbs.twimg.com/profile_images/1661677441377775617/AAj05II-.jpg,News Record,1399797155867488256,,,,,False,False,0,https://www.fastnation.in/?p=39135,,,,,,,,,,,,,,,,,,,,,,,,,,,,,,,,,,,,,,0,0,1,exams,case class board exams cancelled health safety students utmost importance says mode fastnationinp39135,2021-06-01T18:37:00.000Z,https://twitter.com/NewsRecordindia/status/1399797155867488256,https://pbs.twimg.com/profile_images/1661677441377775617/AAj05II-.jpg,"newsrecord.in - Most Popular News Websites in the India & all type of Latest News - India, Politics, Sports, Entertainment, Futures, More News .",2015-02-09T14:32:00.000Z,India,815,1658,3261,13761,https://twitter.com//NewsRecordindia,News Record,@NewsRecordindia,False,newsrecord.in/,@NewsRecordindia,False
https://pbs.twimg.com/profile_images/1661677441377775617/AAj05II-.jpg,News Record,1399797047293743104,,,,,False,False,0,https://www.fastnation.in/?p=39113,,,,,,,,,,,,,,,,,,,,,,,,,,,,,,,,,,,,,,0,0,0,exams,case class exam cancelled fastnationinp39113,2021-06-01T18:36:00.000Z,https://twitter.com/NewsRecordindia/status/1399797047293743104,https://pbs.twimg.com/profile_images/1661677441377775617/AAj05II-.jpg,"newsrecord.in - Most Popular News Websites in the India & all type of Latest News - India, Politics, Sports, Entertainment, Futures, More News .",2015-02-09T14:32:00.000Z,India,815,1658,3261,13761,https://twitter.com//NewsRecordindia,News Record,@NewsRecordindia,False,newsrecord.in/,@NewsRecordindia,False
https://pbs.twimg.com/profile_images/1691438633235226624/xyzSyl-q.jpg,Devid Debbarma,1399751800509538309,,,,,False,False,7,https://twitter.com/PMOIndia,https://twitter.com/narendramodi,https://twitter.com/cbseindia29,https://twitter.com/search?q=%23COVID19,,,,,,,,,,,,,,,,,,,,,,,,,,,,,,,,,,,0,0,1,exams,hobble decided cancel exams class aii students keeping view ongoing covid19 pandemic shall ensure safety security students teachers parents put end anxiety minds students gratitude,2021-06-01T15:36:00.000Z,https://twitter.com/devid_tiprasa/status/1399751800509538309,https://pbs.twimg.com/profile_images/1691438633235226624/xyzSyl-q.jpg,BJP Karyakarta | State General Secretary @BJPSTMORCHA | Hindu by birth | Tripura | Bharat,2012-07-02T20:52:00.000Z,"RC Ghat , Agartala , Tripura",2811,469,43848,22654,https://twitter.com//devid_tiprasa,Devid Debbarma,@devid_tiprasa,False,,@devid_tiprasa,False
https://pbs.twimg.com/profile_images/1554429492680015872/H2Q_16m0.jpg,PIB in Tripura,1399733978177753093,,,,,False,False,14,https://twitter.com/search?q=%23CBSEClass,https://twitter.com/narendramodi,https://pib.gov.in/PressReleasePage.aspx?PRID=1723496,https://twitter.com/sonalgoelias,,,,,,,,,,,,,,,,,,,,,,,,,,,,,,,,,,,0,0,2,exams,cbseclass aii board exams cancelled class aii results made per welldefined objective criteria timebound manner decision class case exams taken interest students,2021-06-01T14:26:00.000Z,https://twitter.com/PIBAgartala/status/1399733978177753093,https://pbs.twimg.com/profile_images/1554429492680015872/H2Q_16m0.jpg,"Official Twitter account of Press Information Bureau, Government of India, Agartala, Tripura.",2017-08-28T07:15:00.000Z,"Agartala, India",6353,411,626,40746,https://twitter.com//PIBAgartala,PIB in Tripura,@PIBAgartala,True,,@PIBAgartala,True
,,1386866742270459904,,,,,False,False,0,,,,,,,,,,,,,,,,,,,,,,,,,,,,,,,,,,,,,,,0,0,0,School,nothing feels good without school,2021-04-27T02:16:00.000Z,https://twitter.com/KhogendraRupini/status/1386866742270459904,https://pbs.twimg.com/profile_images/1704139511125753856/RGACsBCI.jpg,"Official Account Of Khogendra Rupini Programmer | Front-End Web Developer | YouTuber | Investor | Co-Founder Of @levoric | HTML, CSS, JAVASCRIPT, CYBER SECURITY",2018-12-31T04:23:00.000Z,"tripura, India",2308,1529,10483,26538,https://twitter.com//KhogendraRupini,Khogendra Rupini,@KhogendraRupini,False,piped.video/khogendrarupini,,False
https://pbs.twimg.com/profile_images/1554429492680015872/H2Q_16m0.jpg,PIB in Tripura,1399731841079279623,,,,,False,False,1,https://pib.gov.in/PressReleasePage.aspx?PRID=1723496,,,,,,,,,,,,,,,,,,,,,,,,,,,,,,,,,,,,,,0,0,1,exams,case class aii board exams cancelled,2021-06-01T14:17:00.000Z,https://twitter.com/PIBAgartala/status/1399731841079279623,https://pbs.twimg.com/profile_images/1554429492680015872/H2Q_16m0.jpg,"Official Twitter account of Press Information Bureau, Government of India, Agartala, Tripura.",2017-08-28T07:15:00.000Z,"Agartala, India",6353,411,626,40746,https://twitter.com//PIBAgartala,PIB in Tripura,@PIBAgartala,True,,@PIBAgartala,True
https://pbs.twimg.com/profile_images/1492481694817206275/fJdkGZiK.jpg,Prasanjit Debnath,1254704893899702272,,,,,False,False,0,https://www.instagram.com/p/B_erlq8l_uz/?igshid=qwtfyebh77wj,,,,,,,,,,,,,,,,,,,,,,,,,,,,,,,,,,,,,,0,0,0,University,beautiful nature blue sky campus courtesy planes tempura university central university suryamani nagar agartala,2020-04-27T09:32:00.000Z,https://twitter.com/Prasanjit_mcom/status/1254704893899702272,https://pbs.twimg.com/profile_images/1492481694817206275/fJdkGZiK.jpg,"(http://pjitdebnath)
Tripura, Belonia
7629988920",2019-02-13T03:52:00.000Z,Tripura,29,132,268,237,https://twitter.com//Prasanjit_mcom,Prasanjit Debnath,@Prasanjit_mcom,False,,@Prasanjit_mcom,False
https://pbs.twimg.com/profile_images/913599174309851136/e5b1Lgka.jpg,Swanirbhar Majumder,1249038168021557249,,,,,False,False,0,https://twitter.com/search?q=%23BharatPadheOnline,https://twitter.com/HRDMinistry,https://twitter.com/DrRPNishank,https://twitter.com/SWAYAMMHRD,,,,,,,,,,,,,,,,,,,,,,,,,,,,,,,,,,,0,0,0,University,good initiative bharatpadheonline request prepare vacation central universities with april start extra set courses current semester pending courses jan may semester taken,2020-04-11T18:14:00.000Z,https://twitter.com/swanirbhar/status/1249038168021557249,https://pbs.twimg.com/profile_images/913599174309851136/e5b1Lgka.jpg,Academician/ Researcher/ Nerd/ foodaholic/ movie maniac/ self-proclaimed 24x7 social network celebrity and faculty of electronics and IT. SPOC SWAYAM and NPTEL,2009-11-12T16:09:00.000Z,"Tripura, India",312,276,6837,36275,https://twitter.com//swanirbhar,Swanirbhar Majumder,@swanirbhar,False,swanirbharmajumder.com/,@swanirbhar,False
