avatar,fullname,id,images/0,images/1,images/2,images/3,isQuote,isRetweet,likes,links/0,links/1,links/2,links/3,links/4,links/5,links/6,links/7,links/8,links/9,links/10,links/11,links/12,links/13,links/14,links/15,links/16,links/17,links/18,quotedTweet/avatar,quotedTweet/fullname,quotedTweet/images/0,quotedTweet/images/1,quotedTweet/images/2,quotedTweet/images/3,quotedTweet/links/0,quotedTweet/links/1,quotedTweet/links/2,quotedTweet/links/3,quotedTweet/links/4,quotedTweet/links/5,quotedTweet/links/6,quotedTweet/links/7,quotedTweet/links/8,quotedTweet/text,quotedTweet/timestamp,quotedTweet/url,quotedTweet/username,quotes,replies,retweets,searchQuery,text,timestamp,url,user/avatar,user/description,user/joinDate,user/location,user/totalFollowers,user/totalFollowing,user/totalLikes,user/totalTweets,user/url,user/userFullName,user/username,user/verified,user/website,username,verified
,,1420588932744372224,https://pbs.twimg.com/media/E7byGt2VkAIa2Fl.jpg,,,,False,False,2,,,,,,,,,,,,,,,,,,,,,,,,,,,,,,,,,,,,,,,0,0,1,phd,congratulations victor debbarma successfully completing pod proud society,2021-07-29T03:36:00.000Z,https://twitter.com/Noatia_sukla/status/1420588932744372224,https://pbs.twimg.com/profile_images/1703730632244051969/pGabDiel.jpg,"Minister of Cooperation , Tribal welfare ( TRP & PTG ) Welfare of Minorities, Government  of Tripura",2018-02-24T13:23:00.000Z,"Agartala, India",1619,180,2507,2262,https://twitter.com//Noatia_sukla,Sukla Noatia,@Noatia_sukla,False,tripura.gov.in/councilminist…,,False
,,1442020496892039176,,,,,False,False,0,https://twitter.com/search?q=%23Jumla,,,,,,,,,,,,,,,,,,,,,,,,,,,,,,,,,,,,,,0,2,0,phd,bhai school meh hate kya manmohan singh governor fbi school paid kar aur sake toh pod kar lena aur sun desk charade like kam karma pasta haifekna nazi hot juma,2021-09-26T06:57:00.000Z,https://twitter.com/SayandeepHazari/status/1442020496892039176,https://pbs.twimg.com/profile_images/1426282447310757890/b6sOHJPG.jpg,"Navodayan 💕 | Northeastern 🇮🇳

#_fitnessfreak🏋️
#_entertainer🤠
 
                          ~If nothing goes right go left~",2021-08-13T20:36:00.000Z,"Tripura, India",121,148,505,243,https://twitter.com//SayandeepHazari,Sayandeep Hazari (Bhullanath) 🌱,@SayandeepHazari,False,,,False
,,1475705435441164288,,,,,False,False,2,https://twitter.com/bhupeshbaghel,,,,,,,,,,,,,,,,,,,,,,,,,,,,,,,,,,,,,,0,0,0,College,college fisheries सरहम,2021-12-28T05:49:00.000Z,https://twitter.com/ShivbhajanChan1/status/1475705435441164288,https://pbs.twimg.com/profile_images/1650688909221990400/UQQsE0Bz.jpg,,2020-04-06T03:51:00.000Z,kawardha india,15,143,50,20,https://twitter.com//ShivbhajanChan1,Shivbhajan Chandravanshi,@ShivbhajanChan1,False,,,False
,,1476938029516218371,,,,,False,False,2,https://twitter.com/search?q=%23Students_faculties,https://twitter.com/nhm_tripura,https://twitter.com/EduMinOfIndia,https://twitter.com/search?q=%23DME_Tripura,https://twitter.com/MoHFW_INDIA,,,,,,,,,,,,,,,,,,,,,,,,,,,,,,,,,,0,0,0,College,sinceritycooperation would never erased heartstudentsfaculties can express feelings love gratitude entire college administrationthank everything dmetripura,2021-12-31T15:27:00.000Z,https://twitter.com/agtgovtmedical/status/1476938029516218371,https://pbs.twimg.com/profile_images/1588571450490748928/5m89psKK.jpg,"Digital Smart Education and Tele healthcare organization.
Teleconsultations allow a physician in a remote area to receive advice from a specialist.",2020-06-26T08:45:00.000Z,"Agartala, India",103,226,91,201,https://twitter.com//agtgovtmedical,National Telemedicine Hub NMCN_AGMC & GBPH.,@agtgovtmedical,False,nmcn.in,,False
,,1465727618540396545,https://pbs.twimg.com/media/FFdPfYtVkAUhgv4.jpg,,,,False,False,4,https://twitter.com/search?q=%23AzadiKaAmritMahotsav,,,,,,,,,,,,,,,,,,,,,,,,,,,,,,,,,,,,,,0,0,0,College,azadikaamritmahotsav kamalpur govt degree college,2021-11-30T17:01:00.000Z,https://twitter.com/paulsagar00/status/1465727618540396545,https://pbs.twimg.com/profile_images/1717615251989098497/4W551N4c.jpg,जननी जन्मभूमिश्च स्वर्गादपि गरीयसी। 🚩                                                                  State Social Media Convenor @ABVPTripura,2020-01-21T19:58:00.000Z,"Tripura, India",274,178,45911,2452,https://twitter.com//paulsagar00,সাগর পাল 🇮🇳 Sagar Paul 🕉️,@paulsagar00,False,instagram.com/paulsagar00?ig…,,False
,,1450848165649735682,,,,,False,False,0,https://theriseeast.com/tripura/hm-amit-shah-arriving-on-nov-21-to-lay-foundation-stone-of-forensic-university-in-tripura/#.YXA3NuhrNrY.twitter,,,,,,,,,,,,,,,,,,,,,,,,,,,,,,,,,,,,,,0,0,0,University,amit shah arriving not lay foundation stone forensic university tempura,2021-10-20T15:35:00.000Z,https://twitter.com/AnilSar38167287/status/1450848165649735682,https://pbs.twimg.com/profile_images/1420398128235114500/bq_c8N1x.jpg,"3rd year trained Swangsevak in Rss as west Dist. bouddhik Pramukh.

Studied B.Tech. in civi Engineering.

Serving as Asstt. Engineer in  state Agri. Dept",2021-03-19T16:43:00.000Z,,24,52,1141,2636,https://twitter.com//AnilSar38167287,Anil Sarkar,@AnilSar38167287,False,,,False
,,1447512438568460292,https://pbs.twimg.com/media/FBaY5AVUUAQ9jGa.jpg,,,,False,False,1,https://twitter.com/search?q=%23NanajiDeshmukh,,,,,,,,,,,,,,,,,,,,,,,,,,,,,,,,,,,,,,0,0,0,University,tributes venerable nanajideshmukh jayanti social activist nana established india first rural university exemplary work field education health rural selfreliancehe remains eternal inspiration quest transform indian villages,2021-10-11T10:40:00.000Z,https://twitter.com/AruyanRupini/status/1447512438568460292,https://pbs.twimg.com/profile_images/1634049425848020992/8YXGyBNv.jpg,"BJYM State Excu.Member,Ex-BJYM Sadar Rural Dist.Member,
Ex-BJYM Vice President,Mandai Mandal,
Office Secretary-Raima Twisa Society(NGO),
Hob:Interested in IT/SM",2018-10-14T16:55:00.000Z,"Agartala, India",57,481,6314,7891,https://twitter.com//AruyanRupini,Aruyan Rupini Official,@AruyanRupini,False,gmail.in/,,False
,,1445286781407035395,https://pbs.twimg.com/media/FA6wqtrVIAQLlsy.jpg,,,,False,False,0,http://Govt.degree,,,,,,,,,,,,,,,,,,,,,,,,,,,,,,,,,,,,,,0,0,0,College,proud govtdegree college gandachara,2021-10-05T07:16:00.000Z,https://twitter.com/RupaMohanTripu1/status/1445286781407035395,https://pbs.twimg.com/profile_images/1434779382611013635/R-g2YLmI.jpg,College Student. Poetry writer. Social Activities,2021-09-06T07:23:00.000Z,,0,14,95,12,https://twitter.com//RupaMohanTripu1,Rupa Mohan Tripura,@RupaMohanTripu1,False,,,False
,,1415156544782553091,https://pbs.twimg.com/media/E6OlXcuUYAQU5My.jpg,,,,False,False,0,,,,,,,,,,,,,,,,,,,,,,,,,,,,,,,,,,,,,,,0,0,0,University,today birthday mahendranath gusta author sri sri ramakrishna kathamritahe disciple ramakrishna born july 1854 kolkata died june 1932 kolkata known author sri sri ramakrishna kathamrita education hare school presidency university,2021-07-14T03:49:00.000Z,https://twitter.com/Prasantadebroy1/status/1415156544782553091,https://pbs.twimg.com/profile_images/1416234362769530881/LAH0nv8S.jpg,Indian,2016-11-17T01:32:00.000Z,"Tripura, India",10,130,61,100,https://twitter.com//Prasantadebroy1,Prasanta debroy,@Prasantadebroy1,False,,,False
,,1437395896514142209,,,,,False,False,0,https://twitter.com/RatanLalNath1,https://twitter.com/BjpBiplab,,,,,,,,,,,,,,,,,,,,,,,,,,,,,,,,,,,,,0,0,0,University,right equality tempura university and ith semester online exam bed college ith semester online exam tempura university final ith semester,2021-09-13T12:41:00.000Z,https://twitter.com/DanDaz18/status/1437395896514142209,https://pbs.twimg.com/profile_images/1401453355235377153/-L2Hn3-0.jpg,you will know everything about myself when u talk to me,2021-06-06T08:17:00.000Z,"California, USA",24,86,929,31,https://twitter.com//DanDaz18,Dan_Daz,@DanDaz18,False,,,False
,,1441637167780880384,,,,,False,False,0,,,,,,,,,,,,,,,,,,,,,,,,,,,,,,,,,,,,,,,0,0,0,College,couid destroyed still college admissions counseling going fresher party school didn even gave farewell,2021-09-25T05:34:00.000Z,https://twitter.com/Bangtan_0613_07/status/1441637167780880384,https://pbs.twimg.com/profile_images/1657020117002387456/o2M_LoCJ.jpg,"៹ 일도 없단 듯이 一 𝕝𝕚𝕗𝕖 𝕘𝕠𝕖𝕤 𝕠n
#방탄소년단: I'm in love with the 7boys from Korea. 20/",2020-05-29T14:39:00.000Z,NJ SJ YG HS JM TH JK,117,578,71301,26873,https://twitter.com//Bangtan_0613_07,BangtanoHolic💜,@Bangtan_0613_07,False,,,False
,,1427313541741092877,,,,,False,False,1,,,,,,,,,,,,,,,,,,,,,,,,,,,,,,,,,,,,,,,0,0,0,University,dont fail life normal job average income dont fail life get average grades dont university dont fail life wear name clothes dont follow trends,2021-08-16T16:57:00.000Z,https://twitter.com/PujaMal73948787/status/1427313541741092877,https://pbs.twimg.com/profile_images/1649071341226819585/Jni-cEQP.jpg,Her heart was a secret garden and the walls were very high🍂🍁,2020-09-20T10:31:00.000Z,"Agartala, India",12,0,91,70,https://twitter.com//PujaMal73948787,Puja Malakar,@PujaMal73948787,False,,,False
,,1372893335937904646,https://pbs.twimg.com/media/Ew1_NlMUYAUAa2-.jpg,,,,False,False,17,https://twitter.com/search?q=%23TripuraBudget2021,,,,,,,,,,,,,,,,,,,,,,,,,,,,,,,,,,,,,,0,0,10,University,delighted announce setting national law university agartala improving quality legal education connection communication state along corresponding central ministry department tripurabudget2021,2021-03-19T12:50:00.000Z,https://twitter.com/RatanLalNath1/status/1372893335937904646,https://pbs.twimg.com/profile_images/1700504780244647936/pcP_KVHk.jpg,"Minister of Power, Agriculture & Farmer's Welfare and Election Department, Govt. of Tripura.",2019-01-01T07:04:00.000Z,"Tripura, India",11352,251,4927,5087,https://twitter.com//RatanLalNath1,Ratan Lal Nath,@RatanLalNath1,False,,,False
,,1422022018828967936,,,,,False,False,3,,,,,,,,,,,,,,,,,,,,,,,,,,,,,,,,,,,,,,,0,0,1,University,han nasa mocha lane walk scientist iso development diana han nanda ina geta amit shah university lecture diva jamie mafia kabe curia geta thakur there jesse chomp gangster culture development manta hunter aur maid key rake,2021-08-02T02:30:00.000Z,https://twitter.com/hsDMjqd0hK0XkO0/status/1422022018828967936,https://pbs.twimg.com/profile_images/1316629031140257793/jvfAlruB.jpg,Shivvakt,2020-06-17T09:20:00.000Z,,23,39,26926,10007,https://twitter.com//hsDMjqd0hK0XkO0,prasad_shiba_,@hsDMjqd0hK0XkO0,False,,,False
,,1437396378074836993,,,,,False,False,0,https://twitter.com/RatanLalNath1,https://twitter.com/BjpBiplab,,,,,,,,,,,,,,,,,,,,,,,,,,,,,,,,,,,,,0,0,0,College,holy cross college online mode mob university online exam,2021-09-13T12:42:00.000Z,https://twitter.com/DanDaz18/status/1437396378074836993,https://pbs.twimg.com/profile_images/1401453355235377153/-L2Hn3-0.jpg,you will know everything about myself when u talk to me,2021-06-06T08:17:00.000Z,"California, USA",24,86,929,31,https://twitter.com//DanDaz18,Dan_Daz,@DanDaz18,False,,,False
,,1368778075689938945,,,,,False,False,0,https://twitter.com/search?q=%23happywomensday,https://twitter.com/search?q=%23happyinternationalwomensday,https://www.instagram.com/p/CMJOEASJnA9/?igshid=a4g032os3e8h,,,,,,,,,,,,,,,,,,,,,,,,,,,,,,,,,,,,0,0,0,University,happywomensday happyinternationalwomensday tempura university,2021-03-08T04:18:00.000Z,https://twitter.com/swanirbhar/status/1368778075689938945,https://pbs.twimg.com/profile_images/913599174309851136/e5b1Lgka.jpg,Academician/ Researcher/ Nerd/ foodaholic/ movie maniac/ self-proclaimed 24x7 social network celebrity and faculty of electronics and IT. SPOC SWAYAM and NPTEL,2009-11-12T16:09:00.000Z,"Tripura, India",312,276,6837,36275,https://twitter.com//swanirbhar,Swanirbhar Majumder,@swanirbhar,False,swanirbharmajumder.com/,,False
,,1464292324079403009,,,,,False,False,2,,,,,,,,,,,,,,,,,,,,,,,,,,,,,,,,,,,,,,,0,0,0,School,jag aha tha kaali rate saith choose mere badly bhai mere saith dude are whool beta kiss hath choose dil royal jab maa school take hath code,2021-11-26T17:57:00.000Z,https://twitter.com/PritamC69256819/status/1464292324079403009,https://pbs.twimg.com/profile_images/1505289489388048384/yv27s7zy.jpg,small circle,2021-05-30T15:30:00.000Z,,10,121,14979,536,https://twitter.com//PritamC69256819,yeahsunny,@PritamC69256819,False,,,False
,,1445314669837631489,https://pbs.twimg.com/media/FA7KCBWVgAIlpDN.jpg,,,,False,False,1,,,,,,,,,,,,,,,,,,,,,,,,,,,,,,,,,,,,,,,0,0,0,Masters,murder civilization ashamed still exist society surrounded inferior basebornsordid lousy media houses whore still lacking licking balls ruling masters even digesting kind brutality shame yaaaaakkk,2021-10-05T09:07:00.000Z,https://twitter.com/ImranAhmedTR/status/1445314669837631489,https://pbs.twimg.com/profile_images/1709638682913697793/0MftkLo-.jpg,All India Trinamool Congress -  Member @AITC4tripura,2019-12-28T06:07:00.000Z,"Tripura, India",1286,222,7104,2899,https://twitter.com//ImranAhmedTR,𝗜𝗺𝗿𝗮𝗻 𝗔𝗵𝗺𝗲𝗱,@ImranAhmedTR,False,facebook.com/Imran4Tripura/,,False
https://pbs.twimg.com/profile_images/1700504780244647936/pcP_KVHk.jpg,Ratan Lal Nath,1364933870647353353,https://pbs.twimg.com/media/EvE4E2wVkAEPmn0.jpg,https://pbs.twimg.com/media/EvE4FxXVcAEAz-R.jpg,https://pbs.twimg.com/media/EvE4GznVcAcfRqD.jpg,https://pbs.twimg.com/media/EvE4HpAUUAAgBSB.jpg,False,False,20,,,,,,,,,,,,,,,,,,,,,,,,,,,,,,,,,,,,,,,0,0,8,University,glad attend fresher welcome programme vatos ifi university kamalghat,2021-02-25T13:42:00.000Z,https://twitter.com/RatanLalNath1/status/1364933870647353353,https://pbs.twimg.com/profile_images/1700504780244647936/pcP_KVHk.jpg,"Minister of Power, Agriculture & Farmer's Welfare and Election Department, Govt. of Tripura.",2019-01-01T07:04:00.000Z,"Tripura, India",11352,251,4927,5087,https://twitter.com//RatanLalNath1,Ratan Lal Nath,@RatanLalNath1,False,,@RatanLalNath1,False
,,1460632694031716352,https://pbs.twimg.com/media/FEU1r4bVEAYQc29.jpg,,,,False,False,3,,,,,,,,,,,,,,,,,,,,,,,,,,,,,,,,,,,,,,,0,0,0,School,kids tomorrows future give wings fly grow good citizens love lots stxaviers school,2021-11-16T15:35:00.000Z,https://twitter.com/Subhankar_BJP/status/1460632694031716352,https://pbs.twimg.com/profile_images/1481127822991446019/0VtkINIO.jpg,bjp,2017-11-17T15:56:00.000Z,Bishalgarh,463,365,2160,2579,https://twitter.com//Subhankar_BJP,Subhankar Saha,@Subhankar_BJP,False,,,False
https://pbs.twimg.com/profile_images/1700504780244647936/pcP_KVHk.jpg,Ratan Lal Nath,1402674120656003076,https://pbs.twimg.com/media/E3dMmk_VIAU4_mD.jpg,https://pbs.twimg.com/media/E3dMnZUUYAMhH9b.jpg,https://pbs.twimg.com/media/E3dMpmoUYAIs9jB.jpg,https://pbs.twimg.com/media/E3dMqLYVUAQGKb8.jpg,False,False,50,https://twitter.com/NBirenSingh,https://twitter.com/PemaKhanduBJP,,,,,,,,,,,,,,,,,,,,,,,,,,,,,,,,,,,,,0,15,8,College,chaired community empowerment programme distribution technology products along important dignitaries virtual physical mode organized college fisheries can impale lembucherra,2021-06-09T17:09:00.000Z,https://twitter.com/RatanLalNath1/status/1402674120656003076,https://pbs.twimg.com/profile_images/1700504780244647936/pcP_KVHk.jpg,"Minister of Power, Agriculture & Farmer's Welfare and Election Department, Govt. of Tripura.",2019-01-01T07:04:00.000Z,"Tripura, India",11352,251,4927,5087,https://twitter.com//RatanLalNath1,Ratan Lal Nath,@RatanLalNath1,False,,@RatanLalNath1,False
,,1459869221500768257,,,,,False,False,0,https://twitter.com/RatanLalNath1,https://twitter.com/BjpBiplab,https://twitter.com/sanjayswadesh,https://twitter.com/chandni_ias,,,,,,,,,,,,,,,,,,,,,,,,,,,,,,,,,,,0,0,0,School,4244 schools,2021-11-14T13:02:00.000Z,https://twitter.com/Tanmoy_cborty/status/1459869221500768257,https://pbs.twimg.com/profile_images/1731721218909511680/RnH2JcEQ.jpg,"Journalist with @IndiaTodayNE . 
By lines for @News9Tweets
@thewire_in @thequint @AJEnglish @TheFederal_in. Ex-Correspondent with @ttindia",2013-03-11T03:15:00.000Z,"Tripura, India",435,923,2829,2329,https://twitter.com//Tanmoy_cborty,Tanmoy Chakraborty,@Tanmoy_cborty,False,indiatodayne.in/author/tanmo…,,False
,,1439328426784014339,https://pbs.twimg.com/media/E_mFk1HVkAE0JU3.jpg,,,,False,False,0,,,,,,,,,,,,,,,,,,,,,,,,,,,,,,,,,,,,,,,0,0,0,Masters,jarod maestro ahead ali khan cordially met ass sarasanghchalak mohan bhagwat presented marathon release book master masters,2021-09-18T20:40:00.000Z,https://twitter.com/AruyanRupini/status/1439328426784014339,https://pbs.twimg.com/profile_images/1634049425848020992/8YXGyBNv.jpg,"BJYM State Excu.Member,Ex-BJYM Sadar Rural Dist.Member,
Ex-BJYM Vice President,Mandai Mandal,
Office Secretary-Raima Twisa Society(NGO),
Hob:Interested in IT/SM",2018-10-14T16:55:00.000Z,"Agartala, India",57,481,6314,7891,https://twitter.com//AruyanRupini,Aruyan Rupini Official,@AruyanRupini,False,gmail.in/,,False
,,1474275568422047746,,,,,False,False,0,,,,,,,,,,,,,,,,,,,,,,,,,,,,,,,,,,,,,,,0,0,0,School,found something new learn rust back school winter,2021-12-24T07:07:00.000Z,https://twitter.com/Jugapratim/status/1474275568422047746,https://pbs.twimg.com/profile_images/1558865784637890560/uux6YxQj.jpg,looking towards life,2011-03-02T04:00:00.000Z,The Subcontinent,266,719,6779,3158,https://twitter.com//Jugapratim,Jugapratim,@Jugapratim,False,linkedin.com/in/jugapratim-g…,,False
,,1467459967347093506,https://pbs.twimg.com/media/FF13DsWVcAE7YRG.jpg,https://pbs.twimg.com/media/FF13DsWVQAAwJPq.jpg,https://pbs.twimg.com/media/FF13DsXUYAcZu4N.jpg,https://pbs.twimg.com/media/FF13DsXVkAIdJsg.jpg,False,False,24,,,,,,,,,,,,,,,,,,,,,,,,,,,,,,,,,,,,,,,1,1,8,School,today visited jolaibari madras school kadamtala kurt assembly constituency meet members children good see many orphan kids given studying opportunity free cost assured provide financial expenses,2021-12-05T11:44:00.000Z,https://twitter.com/pujanbiswasTR/status/1467459967347093506,https://pbs.twimg.com/profile_images/1593622012248805383/ZZmdU0gc.jpg,"Advocate, BSL.LLB Pune University. St. John’s International Residential School, Chennai. Former President, Tripura Pradesh Youth Congress. A servant of people.",2010-08-24T19:51:00.000Z,Tripura,3856,1337,33572,31984,https://twitter.com//pujanbiswasTR,Pujan Biswas,@pujanbiswasTR,False,thepujanbiswasblog.wordpress…,,False
,,1470485314070327301,,,,,False,False,0,,,,,,,,,,,,,,,,,,,,,,,,,,,,,,,,,,,,,,,0,0,0,School,nursery school,2021-12-13T20:06:00.000Z,https://twitter.com/mr_deb1/status/1470485314070327301,https://pbs.twimg.com/profile_images/1468653041578647554/tcE3ix7U.jpg,Something try to work for some people's needs,2021-12-08T18:44:00.000Z,,16,851,333,5077,https://twitter.com//mr_deb1,Mr. Prasenjit Debnath,@mr_deb1,False,,,False
,,1459869219147845644,https://pbs.twimg.com/media/FEJ_UTVVUAINSL4.jpg,,,,False,False,10,,,,,,,,,,,,,,,,,,,,,,,,,,,,,,,,,,,,,,,1,1,2,School,completed schooling government school agartala didn't clue parents teacher meeting feeling great scenario changing mega parent teacher meeting held tempura lakh parent participated,2021-11-14T13:01:00.000Z,https://twitter.com/Tanmoy_cborty/status/1459869219147845644,https://pbs.twimg.com/profile_images/1731721218909511680/RnH2JcEQ.jpg,"Journalist with @IndiaTodayNE . 
By lines for @News9Tweets
@thewire_in @thequint @AJEnglish @TheFederal_in. Ex-Correspondent with @ttindia",2013-03-11T03:15:00.000Z,"Tripura, India",435,923,2829,2329,https://twitter.com//Tanmoy_cborty,Tanmoy Chakraborty,@Tanmoy_cborty,False,indiatodayne.in/author/tanmo…,,False
,,1448621147860267013,https://pbs.twimg.com/media/FBqJP_QVkAclv3E.jpg,https://pbs.twimg.com/media/FBqJP_SUYAc_KzV.jpg,,,False,False,17,,,,,,,,,,,,,,,,,,,,,,,,,,,,,,,,,,,,,,,1,1,2,School,long many school mates,2021-10-14T12:06:00.000Z,https://twitter.com/pujanbiswasTR/status/1448621147860267013,https://pbs.twimg.com/profile_images/1593622012248805383/ZZmdU0gc.jpg,"Advocate, BSL.LLB Pune University. St. John’s International Residential School, Chennai. Former President, Tripura Pradesh Youth Congress. A servant of people.",2010-08-24T19:51:00.000Z,Tripura,3856,1337,33572,31984,https://twitter.com//pujanbiswasTR,Pujan Biswas,@pujanbiswasTR,False,thepujanbiswasblog.wordpress…,,False
,,1447099777242460163,,,,,False,False,1,,,,,,,,,,,,,,,,,,,,,,,,,,,,,,,,,,,,,,,0,1,0,School,upon time belly school music depended heavily bengali folk music sub used sing ganglia rongila childhood fav humming daylight composing elderly super bengali artists jayaji susumi become favourites lisping music screen,2021-10-10T07:20:00.000Z,https://twitter.com/dewali_de/status/1447099777242460163,https://pbs.twimg.com/profile_images/1436262911131865089/rZlXHqxT.jpg,"Book @TLCUK POETRY @StrixLeeds
@amberflorazine @poetrybusiness
@cwwriters #addastories
ESSAY @SeverineLit
Column NORTH EAST COLORS ( local daily)",2017-09-12T14:27:00.000Z,India,2442,3617,230735,12383,https://twitter.com//dewali_de,Dewali Deb,@dewali_de,False,dewalideb.wixsite.com/websit…,,False
,,1452110586456666113,,,,,False,False,0,https://twitter.com/AdvPardeepGupta,https://twitter.com/AdvMamtaSharma,,,,,,,,,,,,,,,,,,,,,,,,,,,,,,,,,,,,,0,0,0,School,board marks discrepancy principal school says case done moderation marks2030 marks deducted name moderation result compartmentcannot take admission higher studies,2021-10-24T03:11:00.000Z,https://twitter.com/Aparaji57398288/status/1452110586456666113,https://pbs.twimg.com/profile_images/1673381741418143744/2sf_3pJF.jpg,"NIT'A 
BIO-ENGG DEPT. 
2022-26
TAURUS♉",2021-10-23T15:03:00.000Z,"Agartala, India",1,26,78,18,https://twitter.com//Aparaji57398288,Aparajita Das,@Aparaji57398288,False,,,False
,,1446782278072295428,,,,,False,False,0,https://www.instagram.com/p/CUzeRLQh0vg/?utm_medium=twitter,,,,,,,,,,,,,,,,,,,,,,,,,,,,,,,,,,,,,,0,0,0,School,friends camilla dry high school,2021-10-09T10:19:00.000Z,https://twitter.com/md_ashikur042/status/1446782278072295428,https://pbs.twimg.com/profile_images/1520684769537048577/MoB591rb.jpg,"Enough about me! Let's talk about you 😊

~Facebook: mdashikur042
Instagram: md_ashikur042
Whats app: +8801810466156",2019-08-25T01:53:00.000Z,"Muradnagar,Cumilla,Bangladesh",18,68,59,29,https://twitter.com//md_ashikur042,Md. Ashikur Rahman,@md_ashikur042,False,,,False
,,1433481636700561443,,,,,False,False,0,https://twitter.com/search?q=%23quotesoftheday,,,,,,,,,,,,,,,,,,,,,,,,,,,,,,,,,,,,,,0,0,0,Masters,dont follow blindly masters quotesoftheday,2021-09-02T17:27:00.000Z,https://twitter.com/nilanjan_dr/status/1433481636700561443,https://pbs.twimg.com/profile_images/1200024265799565314/6jZRC77h.jpg,Motivational Speaker with a Goal to educate and Awake the Nation,2018-12-25T11:28:00.000Z,India,106,212,1744,2164,https://twitter.com//nilanjan_dr,drnilanjandatta,@nilanjan_dr,False,,,False
,,1403568697868881923,,,,,False,False,0,,,,,,,,,,,,,,,,,,,,,,,,,,,,,,,,,,,,,,,0,0,0,Masters,class started watching vids like way say new device fearlessly bought lenore power watching review masters,2021-06-12T04:23:00.000Z,https://twitter.com/kanad_majumdar/status/1403568697868881923,https://pbs.twimg.com/profile_images/1089464343337422848/vV6LHAr_.jpg,,2019-01-24T07:48:00.000Z,India,38,48,76,62,https://twitter.com//kanad_majumdar,Satya Vachan,@kanad_majumdar,False,,,False
,,1466238950394064899,,,,,False,False,0,,,,,,,,,,,,,,,,,,,,,,,,,,,,,,,,,,,,,,,0,0,0,exams,finishing exam overtime,2021-12-02T02:53:00.000Z,https://twitter.com/isq_wave/status/1466238950394064899,https://pbs.twimg.com/profile_images/1467863274821664773/AKg_9iWt.jpg,,2021-11-08T05:19:00.000Z,"Tripura, India",2,0,3,74,https://twitter.com//isq_wave,𝐀𝐧𝐮~•𓆩♡𓆪🧸,@isq_wave,False,,,False
,,1467870830533218307,,,,,False,False,0,,,,,,,,,,,,,,,,,,,,,,,,,,,,,,,,,,,,,,,0,0,0,exams,good luck everyone exam especially reading instead studying,2021-12-06T14:57:00.000Z,https://twitter.com/isq_wave/status/1467870830533218307,https://pbs.twimg.com/profile_images/1467863274821664773/AKg_9iWt.jpg,,2021-11-08T05:19:00.000Z,"Tripura, India",2,0,3,74,https://twitter.com//isq_wave,𝐀𝐧𝐮~•𓆩♡𓆪🧸,@isq_wave,False,,,False
,,1399338473673302023,https://pbs.twimg.com/media/E2ty7KvUcAI4gD0.jpg,,,,False,False,0,https://twitter.com/search?q=%23Statistics,https://twitter.com/search?q=%23Data_Science,,,,,,,,,,,,,,,,,,,,,,,,,,,,,,,,,,,,,0,0,0,Bachelors,iitkanpur announced two new degree programmes statistics datascience offered 202122 session department mathematics statistics two course year bachelor science year bachelor sciencemaster science bums,2021-05-31T12:14:00.000Z,https://twitter.com/NabarupG/status/1399338473673302023,https://pbs.twimg.com/profile_images/1425516468733562881/6M-sQbpo.jpg,I Love Democracy,2020-12-27T07:55:00.000Z,,39,155,9,2002,https://twitter.com//NabarupG,NABARUP GANGULY,@NabarupG,False,,,False
,,1465233492778766337,,,,,False,False,0,,,,,,,,,,,,,,,,,,,,,,,,,,,,,,,,,,,,,,,0,0,0,exams,talented boot talented fer ate hai exam pele din gap hone bad pure syllabus complete kar let,2021-11-29T08:17:00.000Z,https://twitter.com/isq_wave/status/1465233492778766337,https://pbs.twimg.com/profile_images/1467863274821664773/AKg_9iWt.jpg,,2021-11-08T05:19:00.000Z,"Tripura, India",2,0,3,74,https://twitter.com//isq_wave,𝐀𝐧𝐮~•𓆩♡𓆪🧸,@isq_wave,False,,,False
,,1468200485916233728,,,,,False,False,1,https://examsdaily.in/indian-coast-guard-recruitment-2021-notification-application-details,https://twitter.com/exams,,,,,,,,,,,,,,,,,,,,,,,,,,,,,,,,,,,,,0,0,0,exams,indian coast guard group recruitment 2021 released with pass apply via daily indian education portal,2021-12-07T12:47:00.000Z,https://twitter.com/Davidmi65783135/status/1468200485916233728,https://pbs.twimg.com/profile_images/1371652778091679744/LaMfmqZl.jpg,,2021-03-16T02:40:00.000Z,"tripura,agartala",2,17,106,58,https://twitter.com//Davidmi65783135,uttam kalai,@Davidmi65783135,False,piped.video/channel/UC5Sat_z…,,False
